Num,Review,Review_type
62731,"бір сағат бұрын тұрып, секс-жұмыскерлерді қорғау үшін баспасөзге бару үшін олар менсіз қайда жоқ",bad
62732,"бұл тұманды диплом алу деп атайды, дегенмен жұмысқа шығу жақын емес",bad
62733,мені қалай бақытты еткені бақытты,bad
62734,"бейсенбіде өнер көрсетсең, менің тамағым ауырады",bad
62735,"Ресейдегі шенеуніктерге деген сенімсіздік кеңінен таралған, сондықтан олар Ресейдің сыртында патриоттар Млынды тартып алып, жылы ұя салуға барады",bad
62736,тағы екі физикалық литр мен екі математиктен қалай өмір сүруге болады,bad
62737,"о, бұл сабақтар әрдайым мұғалімдерді ауыстыруды ұнатпайтын",bad
62738,Джоли 9 99 жаман әзіл,bad
62739,қайтадан шешілмеген флз қарғыс атсын сені лақтырды,bad
62740,Ібіліс бүгінгі геометрияны тек содан кейін gds-пен жасады,bad
62741,иә қарғыс атқым келеді 25 мұрынның астында сол жақ стска,bad
62742,"иә, магомед оларды тез тыныштандыратын",bad
62743,менің джинсым тізеден сәл жоғары суланып кетті,bad
62744,rt gej tulgaag y baysan bol rt hiykh l bailaa heh,bad
62745,соғыс қалай жарияланғанына қарамастан,bad
62746,сервер орындалуда,bad
62747,"Егер қызғалдақ педофил және садомасист екені анықталса, мен оған таң қалмаймын, оның пасық бұзық екені анық, мен Е.П.-ден ұяламын",bad
62748,қазір екі интерактивті барлық әдебиеттер репрессияға ұшырады,bad
62749,Сонымен қатар мен бұл таңғажайып жол белгісін зерттеймін,bad
62750,"мен 1-ші жұпқа қалай барғым келмейді, мен бармаймын",bad
62751,"ескі вакуум бүгінде дәл осылай жасалады, өйткені бұл тозақ",bad
62752,"Мен адамдарға ақшаға қалай тәуелді екеніне таңқаламын, мен фуууууу адамдардағы осы қасиетті қалай жек көремін",bad
62753,"қарғыс атқан интернет өшірулі, енді мен ауруханаға баруым керек, әйтпесе мен жөтелден өлемін",bad
62754,Ол кездегі әділетсіздік үшін бұл қалай?,bad
62755,анамның бұл бағалар туралы әлі білмейтіні жақсы,bad
62756,"десанттың қонуына арналған нөмірлер алынып тасталды, олар бәрін жіберіп алды",bad
62757,"Джобс Apple компаниясының басшысы лауазымынан кетіп, өте данышпан Стив адам болған",bad
62758,оятар алдында иттің қыңсылап жылайтын бір нәрсе оянды,bad
62759,"менде литрге несие болмағанымен қоймай, оны бүгін де сағынып, кешігіп келді",bad
62760,бүгін мен бірнеше ағылшын тілегім келмейді,bad
62761,"кешіріңіз, Милли, әрине, рушкада болған жоқ, бірақ маған бұл фш емес сияқты болып көрінді",bad
62762,"rt Мен ашуланған өкінішті сезінемін, бірақ бұл мен тіпті бас әріптермен жазатын факт",bad
62763,"көрпе астына оранып, кешке осылай ұйықтай бер",bad
62764,"бәрі темекі шегуге қарсы, сонда кім үшін тонна темекі өндіріледі",bad
62765,"сериалды көргенде, ол ең нашар және жүздеген басқаларға мәңгі барады деп үміттенесіз",bad
62766,Америкадағы «Ортақ дәуірден кейінгі» фильмнің фантастикалық сәтсіздігі Алтыншы Жерден кейінгі жалпы дәуірден кейінгі фантастикалық әрекетті сәтсіз аяқтады,bad
62767,"ааа, мен қаншалықты жаманмын, бірақ мен қазірдің өзінде лицейге барамын, әлі ұйықтамадым",bad
62768,қараңғы әлем балансы fak x x,bad
62769,"біреу GIA есебінен тозып кетті, мен твитті бұздым",bad
62770,"Қайырлы күн, мен жай ғана мектептен келдім, ауа температурасы көтерілді",bad
62771,"қазір айтыңызшы, жаңбыр жауып жатыр, машиналар тоңып жатыр, жолдар, әйтпесе менде ауланың терезелері бар",bad
62772,мұң - үкіметтің Сочиде Олимпиадаға қар жаууы үшін алдап жүргені шығар,bad
62773,"Ұйқым қанбады, зомбилер сияқты жүремін",bad
62774,"Маған тағы 2 кг салмақ қосу керек, бірақ ол нәтиже бермейді",bad
62775,"Зая демалысқа келді, менің уақытым да болмады",bad
62776,"қайғылы, жақсы, бұл келесі жолы дегенді білдіреді",bad
62777,rt whoeeeeert мен төменгі жағында тұрамын,bad
62778,"кешіріңіз жігіттер, адамдар шындық үшін қараңғы болды",bad
62779,"тесттегі сәттілік, менің ағымым 9 53 және мен үшін тағы 5 сабақ отыру керек",bad
62780,"сондықтан менің сүйікті әжем кетті, қымбаттым, мен оған көп айтатын уақытым болмады, мен оны енді ешқашан көрмеймін, мен сені сүйемін",bad
62781,бірақ біз тағайындамаймыз,bad
62782,кеше жүгірдің сен университетке бардың,bad
62783,Ff мәтінді жылжытқанда және бөлектеу кезінде тежегішті неге баяулататынын түсіне алмаймын.,bad
62784,"бұл жалған үйлесімділіктен немесе кез-келген нәрседен гөрі жақсы, бірақ 5-тен ештеңе болмайтындықтан жақсы",bad
62785,"Мен сыныптастарымды өлтіремін, олардың арқасында тарихқа бармадым",bad
62786,"кешке кразист мен жұмысқа осындай дәмді түскі ас дайындадым, түнгі 2-де тұрып, барлығын жеп қойдым",bad
62787,үш күннен кейін дәл осылай болады,bad
62788,"содан кейін әкем келіп, оларды алуды ұсынды, тіпті салдары уақыт келді дейді",bad
62789,семіз бала мен сені сағындым,bad
62790,"қандай күн бір күн емес, тәуелсіз",bad
62791,"бүкіл сынып биологияны жазды, бұл мен білмейтін тозақ сұрақтары",bad
62792,rt және мен твитті өңдеу батырмасын күтемін,bad
62793,"бұл жаһандық емес, бірақ мен шынымен де орындалғым келеді, көмектесе алмаймын",bad
62794,Мен бұл әлемнің маған ғана қатал болатынын түсінетінімнен көз жасым төгіліп жатыр,bad
62795,"қалай болғанда да таң атқан жоқ, бұл күн қандай сұмдық болатынын елестетіп көріңіз",bad
62796,химиялық тазалау оңай емес болып шығады,bad
62797,енді бір нәрсе маған қазір сіз какао құлағыңыз келмейтінін айтады,bad
62798,"таңертең кофеден емес, процедуралардан басталады",bad
62799,радиода қаншама мағынасыз әндер ойналады,bad
62800,"Мен жаманның бәрінен кінә іздегім келеді, аузымды жауып, қолымды пернетақтадан алыс ұстай аламын",bad
62801,"Мен бір тәуліктен бері тамақ ішкен жоқпын, сілкініп тұрмын, бірақ бұған қарамастан, бір кесек тамағыма түспейді",bad
62802,таңертең шынайы ұйқыға арналған аң аулау,bad
62803,"Стюи қоңырсыз қайғылы, мен онымен бірге қайғырғым келеді",bad
62804,банктің осындай қара тізіміне тап болды,bad
62805,"егер мен бір рет жиырма минут бұрын келген болсам, әйтпесе ертерек келіп, оны ұзақ күттім",bad
62806,"Менде ps3 әлі бар, сондықтан мен pay.pal арқылы rus.USA төлемін қолданбайтын шығармын",bad
62807,мен шаштараз креслосында отырған кезде жақсы ештеңе болған жоқ,bad
62808,"Қарғыс атсын, мен ертерек келген жалғыз уақыт және менің қыздарым жоқ",bad
62809,"бүкіл түн ұйықтамады, өйткені мен ауруды жек көремін",bad
62810,"Менде дұрыс терминал арқылы билеттер тура 2 есе қымбат болды, тек ВКО-да қалайы болатын еді",bad
62811,"Менің айтайын дегенім, менің қолдарым мені ұзақ уақыт бойы ауыртады.",bad
62812,кешегі көңіл-күй ешқашан қалпына келмейтіні,bad
62813,"хмм 11-сынып емес, бірақ кейбіреулерін сөгіп тастады",bad
62814,лювак кофесі менің өмірімдегі ең жиіркенішті кофе,bad
62815,"Мен бүгін отырамын, ертең мен баруым керек",bad
62816,"түнде ұрысқа кірді, онсыз, бұл тікелей",bad
62817,"егер ол жоқ болса, онда бір нәрсе болуы мүмкін",bad
62818,"Мен екі жылдан кейін бірінші рет вхлам ауруына шалдықтым, сақтандыру дәрі-дәрмектері бар екенін есіме алдым",bad
62819,бүкіл бет жанып тұрған қышу қышуы болып жатыр,bad
62820,сессия барысында студенттерге қатысты қатыгездік пен зорлық-зомбылық туралы фильмнен кейін аман қалу,bad
62821,"жөтелмен жөтеліп ояндым, мені ештеңе етпейді",bad
62822,"құрметті қазіргі тариф, жылдамдық пен эрудицияға сәттілікке байланысты барлық бонустар төмендетіледі, жалпы сәттілік жоқ, қиындық қайғыда",bad
62823,Айтуға болатын және айтуға тура келетін бірнеше сөз болған кезде мен өзімді жек көремін және қой сияқты отырамын Үнсіз мен қорқыныштан ұялған кезде өзімді жек көремін,bad
62824,мұнда nifiga трико киюге болмайды,bad
62825,"Мен мерекелерді жақсы көремін, бірақ мен бұл туралы кипишти жек көремін",bad
62826,мені залдан шығарып жібергендей болды және фильмнің үзіліп қалған фильмін көруге рұқсат берілмеді,bad
62827,rt мен ұйықтай алмай жатқанда,bad
62828,rt ahaha nat ra,bad
62829,"бірінші рет мен таңертең таңертең кофе ішуге деген құштарлықпен ояндым, демек, ауырып қалу тіпті жақсы емес",bad
62830,ертең мен білетін ең керемет адам армияға кетеді,bad
62831,"ааааа маған жұмысқа барудың қажеті жоқ, менде ұйқысыздық жоқ, шынымен де, мен ұйықтаймын мен ұйықтағанды ​​ұнатамын",bad
62832,"кету мүмкіндігі жеткіліксіз, бірақ кетіп қалу үшін овидий ешқашан қол жеткізе алмады",bad
62833,Мен енді блог жүргізбейтінімді тағы ұмытып кеттім,bad
62834,"Мен мұңды музыканы қостым, көңіл-күй жоқ",bad
62835,"маған сен шұғыл керексің және құшақтаймын, бірақ сен ауруханадасың",bad
62836,"дәл қазір алгебра жазыңыз, мен ештеңе жазбаймын ба деп қорқамын",bad
62837,"түнде ол өте нашар және күте тұрды, бұл өрт емес еді",bad
62838,шілтер мен етікке қиындық жоқ,bad
62839,"мен өзіме демалыс жасауым керек, әйтпесе мен енді мектепке бара алмаймын",bad
62840,"ерте тұрды, бірақ сүйікті ағылшын тілің үшін не істей алмайсың",bad
62841,"неге менің шашым бұйра, неге ол түзу емес 3",bad
62842,жаным мұңайма мен сені сүйемін және сені қатты сағындым,bad
62843,"Менде бүгін үнсіздік күні, сөйлей алмаймын",bad
62844,"Менің ойымша, барлығы демалыс күндерін эссе немесе басқа жұмыстармен айналысуды асыға күтеді, бірақ мен нихромды күткен бойда оны жасағым келмейді",bad
62845,"бүгін сізге тоқуға бару керек, менің бармағаныма бір ай болған сияқты",bad
62846,"түнде оған ауырсынуды басатын дәрілерді беріңіз, олар оған үш жарымнан асқанша ештеңе айтпайды, ол азапталған",bad
62847,апатқа ұшыраған su 27 экипажымен келіссөздер жазбасының авторы түрмеге жабылады,bad
62848,үшінші күні менің көзім дірілдейді,bad
62849,мұнда медальдар осындай қожды тірідей әкелді,bad
62850,"егер сугин ​​кім болса, тозақ кім?",bad
62851,rt жақсы,bad
62852,"қарғыс атқырмын мен ұлдарға, мен қалай едім",bad
62853,"иә, жалпы, біз сізді күтеміз",bad
62854,"Мен ұйықтағым келеді, бірақ мен курстарға тез дайындалуым керек",bad
62855,"және сіз интернеттегі қайда бонсай қарағайына бізден тапсырыс бере аласыз, олар сатпайды, бірақ қалайды",bad
62856,rt ene hashaany uchryg oloog y hashaagaa bagasgakhsan geed bodozh bayital harin h b r nemead baikh,bad
62857,"О, мен қалайша қатты тілегім келеді, өйткені мен қатал қарапайымды сағынамын",bad
62858,"күніңді бұзғың келеді, таңертең таразыға тұр",bad
62859,"Телефонымды толтыруға да уақытым жоқ, оны бүгін жасауды ұмытпаймын деп үміттенемін",bad
62860,"Валерий Иванович, ересектер өтірік айтпайды, Настя, бірақ ер адамдар пысық, ал ер адамдар ешқашан ересек емес",bad
62861,"ал ертең тек менің орыс тіліндегі аудармамды жаса, мен басқа сыныпқа барғым келмейді",bad
62862,"ебля менде 2, ал мен трахаем болады",bad
62863,"бұл, әрине, керемет, бірақ мен Джолиді қашан актриса ретінде көремін?",bad
62864,"Мен курстарда отырамын және бір апта бойы ішімдік ішкен әжеге ұқсаймын, hddd мен ақымақпын, бұл диагноз",bad
62865,"jh chase кітабын екіге жұтып қойды, мушкетерлер клубының кәдесыйы оның ең жақсы кітабы емес",bad
62866,бұл ең қызықсыз микроавтобус жүрісі болды,bad
62867,"дабыл уақытын орнатып, оны қосуды ұмытып кетті, нәтижесінде емтиханға көп уақыт кетті",bad
62868,"депрессияны шоколадпен емдеуге шешім қабылдады, бірақ менің мұрным қандай да бір себептермен қышып кетеді",bad
62869,"Сыртта үрейлі жел тұрса, тт қалпақ киюге мәжбүр болады",bad
62870,неге мені байқамайсың,bad
62871,ақша 11 4-те келді,bad
62872,неге twitterfox echofon chtoli ретінде жазыла бастады,bad
62873,"бұғы, мен сізге портфель тастағым келмеді, жарайды, мені кешіріңіз",bad
62874,олардың барлығы қарапайым математика,bad
62875,"Мен бармадым, бірақ мен ұйықтаймын деп ойладым.",bad
62876,"ақыр соңында олар ұялмайды, істеп жатқан істерінің мағынасын түсінбейді, мұңды білмейді",bad
62877,"ххх және сенбіде таңертең көршіңнің жаттығуы туралы айтпа, мен АХАЖ-да тұрамын",bad
62878,"Мен мектепке қалай болса да 11-ден 11-ке келуге дағдыландым, ертең біз бірінші боламыз",bad
62879,бля сағат алтыда тұрды,bad
62880,"Мен өзімді жаман сезініп қана қоймаймын, геометриядан 1 3, физикадан 2 5 шығардым",bad
62881,Мен мүлдем ештеңе істей алмайтыныма келісемін,bad
62882,қара галава айналады және мұрын тыныс алмайды,bad
62883,"иә, магомед оларды тез тыныштандыратын",bad
62884,"аа қарғыс, мен қазір кетемін",bad
62885,"мектеп оқушылары мен студенттерін осы ғажайыпты көруге достық көпшілік жетектейді, мен одан аулақ болғаным жақсы және патрульдік полиция қызметкерлеріне өкінішті, олар онсыз да ессіз болып қалды",bad
62886,не болғанын еске түсіру және бұл енді ешқашан қайталанбайтынын білу қаншалықты ауыр,bad
62887,тапсырмалар бір рет менің қаншалықты қорқынышты екенімді береді,bad
62888,Жарнама меннен бас тартпағанша жақсы,bad
62889,"Мен ауырған кезде қалайы қалай болатынын армандайтынымды және ұйықтауым керек екенін байқадым, бірақ мен ондай нәрсені шынымен қаламаймын",bad
62890,"rt қорқынышты әділетсіздік жүйке жасушалары қалпына келмейді, ал май өлмейді",bad
62891,мұң қайғы-қасірет,bad
62892,бейбақтар қан ұрлайды,bad
62893,және ол Ильдарикті сағынады,bad
62894,көп ұзамай 3 наурызда Самарада 25 өмірдің билеті мені тағы айналып өтеді,bad
62895,тегнеее алчуураар дараал явжиина н дні хаулт хайгад олдогг у,bad
62896,PPC Мен мұны білгенде өзімді жаман сезінемін,bad
62897,осы уақытқа дейін автокөлік жүргізушілеріне тыйым салуды ғана естідім,bad
62898,"кілемшелерді талдау емтиханында конспектіні қолдануға болады, ааа, иә ол солай болар еді",bad
62899,Мен диван тұрған жерде жердің тартылыс күші күшейгенін сезу,bad
62900,"күтуге шыдай алмаймын, бірден шыға бастайды",bad
62901,"ертең киномакс негізінде алғашқы кинофильм кинотеатры базасында смагтың бос жері хоббиті ашылады, әр билет үшін 4 рубль.",bad
62902,"иә, олар әлі күнге дейін менің көкнәр хипсторы үшін сафариде отырғанымды жынданатыны есімде",bad
62903,"арман физикалық тұрғыдан пайғамбарлық етіп, престе максималды жылдамдықты 6 басу нормасынан өтіп, аяғы түсіп кететін нүктені бұруға мәжбүр болды",bad
62904,"мектепте мен бір жағынан оларды қатты сағындым, екінші жағынан",bad
62905,"Менің бір сабағым қалды, мен басында диванға ұйықтаймын, балалар князь Владимир туралы әдеби оқылымды оқиды",bad
62906,"міне, мен доктор албанның қасында тұрмын, бірақ мен өзімнің ұрпағым емес ерекше сезінемін",bad
62907,соңында барлық ойыншы лай болды,bad
62908,svfu қайтадан мен мұнда ақылдылардың арасында мылқау емеспін,bad
62909,"Кешкі ұранға қарап, жеміс-жидек өзгеріп отырды, мұнда қайтадан және сәлемдесуде о-о!",bad
62910,әріптестер конференция туралы ақпаратты зұлым тәжірибе басталардан 1 минут бұрын ауыстырады,bad
62911,"rt Қытайға сапарым туралы ойлана алмаймын, Гонконгтан Гуилинге тікелей қалай баруға болады және одан Гуанчжоуға және Гуанчжоуға қалай баруға болады?",bad
62912,олар қазірдің өзінде,bad
62913,ессіз шаршадым және маған әлі көп нәрсе жасау керек,bad
62914,"ертең кім барады, мен қызыл шалбармен барғым келмейді",bad
62915,қамыр ноуууу 8 траха,bad
62916,bedalaga және мен жақында,bad
62917,"бәрі менің инстуалды жауып тастады, менің көңіл көтеруім жоғалып кетті",bad
62918,осында сіз бәрін үнемі жабыстыра аласыз,bad
62919,менің арқасында қазір тұшпара жей алмаймын,bad
62920,Кем дегенде сен сияқты алтыншы сынып оқушылары,bad
62921,Фанзонада сатылымның басталуы 25-тен тұрады 7,bad
62922,Чиж фантомының осы беларуссиялық өнеркәсіптік панк-мұқабасын тыңдағаннан кейін,bad
62923,келді және мұғалім 1 минутқа кешігіп келді,bad
62924,"мүлдем жылы емес, мүмкін, мұздату шеттері",bad
62925,"жақсы, бүгін өте салқын, тіпті микроавтобус та қызбайды",bad
62926,бұл жаңа жыл - 13 мен үшін ең жаман жыл,bad
62927,"Блажад олар керемет, бірақ мен шықпадым",bad
62928,қырғыш бір айға жоғалады,bad
62929,"мен қарда емес, жаңбырда ылғал жүргендей сезінемін",bad
62930,"Бллининнің басы ауырды, өйткені мен телефонға аааааа қарап отырдым",bad
