Num,Review,Review_type
60001,"тіпті Мысырда да қар жауып тұрса, біз олай болмаймыз",bad
60002,"Ресейде наразылық сезімдерінің өсуі, олар күмәнданар еді, мысалы мен қолдаймын",bad
60003,"екі трамвайды үйге жеткізіп салдым, бүгін менің жолым бар",bad
60004,"rt dr-ді құттықтай алмады, өйткені телефон dr-мен жұмыс істемеді, сиқырлы шаң мен жалғыз мүйізді лул о гт ұстайды",bad
60005,ол көпшілік назарында және үлкен суреттер бермейді 9 9,bad
60006,"бүгін бізде жақсы әңгімелесу мүмкіндігі болған жоқ, мен өте бос емес едім.",bad
60007,9,bad
60008,"Білмеймін, біреуі анық",bad
60009,мм өкпені смогтан тазартуға арналған тағамдық қоспаны жарнамалайды,bad
60010,"Мен демалыс алғым келеді, бірақ анам қазірдің өзінде дәрістер оқып жатыр",bad
60011,"иә, менің әкем татар ғана, бірақ мен бала кезімде оқытпадым, енді түсінбеймін",bad
60012,Ол қашан келетінін мен қатты сағындым,bad
60013,күлкілі емес,bad
60014,бұл менің есебім емес,bad
60015,"қазір мен диванда жатырмын, содан кейін мен курстарға барамын, содан кейін он минуттан кейін мен 2-ге ораламын",bad
60016,бәрі жақсы болса да осылай жазған кезде сұмдық,bad
60017,rt with sad Мен сізсіз жасай алмаймын,bad
60018,кез-келген сценарийде үйдегі зенит Боруссияны сағыну,bad
60019,ұрықтандыру және ұрықтандыру тыңдау ндаааааа,bad
60020,"rt, бірақ менің арманым арман болып қала береді, Торрес енді Петровскиге келмейді",bad
60021,rt сабақтарын өткізгіңіз келеді,bad
60022,"Мен тағы да Линди Хопты билеуге шыдамсыз болдым, бірақ мен бар шеберлігімді жоғалттым",bad
60023,"Мен қазір жұмбақтарды 24 есеппен шешемін, бұл қорқынышты түс",bad
60024,"uf Мен жалақы туралы не айтарымды білмеймін, сіздің Сочидегі жұмысыңыз ешқандай әсер етпейді, мүмкін сіз шығындарды өтей аласыз",bad
60025,Мен өзім кейінірек ешкімге фиксті ұнатпайтындықтан азап шегемін деп қорқамын,bad
60026,oo математикадағы бұл тест 2 немесе 3-ті жақсы көреді,bad
60027,Мен Изи Стивенске ғашықпын деп ойлаймын,bad
60028,"егер Голомазов бүкіл әлемге тартылмаған болса, бәрі жақсы болар еді, неге ол кезде спектакльді жақсарту керек болды?",bad
60029,бұл біз 12 12 жаста болдық,bad
60030,Мен және үй шаруасындағы әйелдерді өлтіргім келеді,bad
60031,12 эпизодтың періштесі эпизодтың төменгі жағы ғана толығымен аз және батырлықты жеңеді,bad
60032,Мен осы қысқы сессияда бос тұрған сияқтымын,bad
60033,тесілген аязды мұзды жел үшін тайғақ жолдар үшін суыққа еріндер үшін,bad
60034,неге мені жас Мәскеу уақытымен ренжітесің,bad
60035,"керемет жүру, бірақ барлық тізе көк",bad
60036,rt кәсіпкер Владимир Потанин бақытты медиа-бизнестен кететінін мәлімдеді,bad
60037,Туған күніңмен мен күнді білмедім және физика алдында сені құттықтамадым,bad
60038,Мен кадрға 5 минут кіруге тырысып көрдім,bad
60039,"rt компьютерде тамақ ішпеу туралы өзінің ережесін бұзып, жолда сорпа төгіп тастады",bad
60040,tape ru бүгін күтпеген жерден лас зығырды Мәскеудегі жидомасон жаңғырығынан жуып тастады,bad
60041,"rt мен Dropbox-қа жүктелген үйдегі конфигурациялардың жартысын жасаған, 5 қателікте жұмыс Dropbox-қа түскен ұтылушымын.",bad
60042,және жаңалықтың себебі - бір нәрсе дұрыс емес басталды,bad
60043,lal dya 3 azazazaz in the same,bad
60044,"Мен МТС жарнамасындағы осы шошқа банкі үшін қатты өкінемін, оның артынан ессіз апай келеді",bad
60045,rt кәсіпкер Владимир Потанин бақытты медиа-бизнестен кететінін мәлімдеді,bad
60046,қалай мен пістенің бүкіл пакетін ұрлап алдым?,bad
60047,"үлкен балалар бізбен бірге жүріңіздер, біз қарбыздан қорқамыз ахах",bad
60048,Мен жарты күн бойы котенканы көрмедім;,bad
60049,rt Мен мандариннің қабығын қоқыс жәшігіне көміп тастаймын,bad
60050,капеттер мен осылай шыдай алмаймын 2-ші күн мен көз жасыммен жүремін енді шыдай алмаймын көмек өтінемін,bad
60051,"балалар волейболдан айырылды, біз сені бәрінен жақсы көреміз",bad
60052,өте асыл тұқымды британдықтар өте ақкөңіл және жұмсақ,bad
60053,rt кәсіпкер Владимир Потанин бақытты медиа-бизнестен кететінін мәлімдеді,bad
60054,"белдікті сатып алды немесе жоқ, сіз ақша алып келмейсіз",bad
60055,"біздің соңғы аптада, сіз сәттілікке қол жеткізесіз",bad
60056,"rt кімге қол қою керек rt пернесін басу керек 3 қарғыс атсын, менде оқитын жігіт жоқ, мен оқыдым, өзара оқыдым",bad
60057,Мен бұл әнді қатты қайғырған сайын жібере алмаймын және Мариустың мойнын сындырғым келеді,bad
60058,"тікелей жарнаманың мамандары сіз кейбір мәліметтер мен сезімдерге сәйкес басу көлемін қалай бағалайсыз, ол 3 4-ке жетеді",bad
60059,"Мен осында тігіп жатырмын, сірә, жұмаға дейін интернетке шықпаймын",bad
60060,"Көз жасын төккенде мен сені бағып-қағып ала алмаймын, мен сені қатты жақсы көремін",bad
60061,Күні бойы тоңып жүрмін,bad
60062,"иә, әйтпесе сіз жұмыс істемейсіз 9 99",bad
60063,бұл қыңырлықты ешкім тіпті есіне алмайды,bad
60064,"иә, олар қазірдің өзінде мәңгілік бар деп айтты, мен трендте емеспін",bad
60065,"rt Мен осы аптада толығымен ауырғым келеді, себебі осы тоқсанның соңғы аптасы, өйткені мен қазірдің өзінде оқуға ерінемін",bad
60066,бірақ бұл тізімнен ештеңе болған жоқ,bad
60067,сіз неге орыс модасының сайтына кірдіңіз,bad
60068,"біреуінде 2-ден 3-ке дейін сабақ бар, ал бізде 6 және 4-і алгебралар",bad
60069,"менің джейбер есептік жазбам, ол компьютерді еліктіреді",bad
60070,Жаңа жылға дейінгі сессия өте қатал,bad
60071,"Мен қалаймын, бірақ менің ақшам жоқ, қайтадан әжелерден сөмкелерді ұрлап алғаныма өкінемін",bad
60072,ldpr бұдан былай оң өсудің доноры емес,bad
60073,"Мен залда кітап оқып отыр едім, содан кейін осындай шулау терезедегі апатқа қайғының тағы бір бөлігін қарады",bad
60074,математика пәнінен тестке эссе жазуды беларусь әдебиетіне үйрету керек,bad
60075,rt осы апта ең нашар болады,bad
60076,бұл менің өмірімдегі ең қайғылы жыл - мұңды сәт,bad
60077,"rt Мен отырамын 3 бөлімді біріктірумен 3 күн бойы азап шегемін, 8 іс-әрекетте шаршадым",bad
60078,"Шынымды айтсам, бұл толық n zde",bad
60079,компьютердің ақымақ тұмсығы телефонмен отыруы керек,bad
60080,"демалыстар басталған сияқты, ал мектепте одан да көп жұмыс бар",bad
60081,күніне екі олимпиада және екі зертхана - бұл толық есек,bad
60082,"а-а, енді сендердің адамдарың маған ақша жібермейтіндіктен, әжелердің неге ашуланатыны түсінікті болды",bad
60083,"Мен үй жануарларын қатты сағындым, мысықты құшақтап, итпен ойнағым келеді",bad
60084,"Мен, әдеттегідей, барлық қызықтарды өткізіп жіберемін",bad
60085,лайтбокс нысандарын көлеңкесіз түсіруге арналған осындай құрылғы бар,bad
60086,кешке дейін таспа менің кетуіме қатты өкінеді,bad
60087,"Мен дәл қазір әрең білдім, мен ұйықтаймын, маған не болып жатқанын түсінбеймін, менің басым қатты ауырады",bad
60088,"Buee ноутбукта Venda-ны қалпына келтіруге мәжбүр болды, сыбырлап, ысқырып, ысқырып",bad
60089,rt сені кім еске алатындығын ешкімге жазба,bad
60090,мені қалай жұмыс жасағым келетінін білетін бұл жұмыс маған қатты ұнады,bad
60091,"Түркиядағы кез-келген лайықты қонақүйде сіз балаңызды таңертең кешке тапсырып, оны 12-ші Мәскеу қаласында ала аласыз, мұндай клуб ашуланбайды",bad
60092,Мен мұны әр таң сайын Пушкаревтен көремін,bad
60093,"Ия, қиындық бізге жетті",bad
60094,"неге адамдар шаршайды және ұйықтағысы келеді, осыған байланысты мен өзімнің армандарымның бір жерінде қызғылт понилер жүгірудің орнына өз әлемімде өлемін",bad
60095,Анам мен семірдім дейді,bad
60096,"көңіл-күй жоғары, бірақ ертеңгі сот барлығын бүлдіреді",bad
60097,"rt оқуыма 2 аптадан аз уақыт қалды, мен тіпті қарыздар бола бастаған жоқпын",bad
60098,"эх шайнайтындар күнделікті өмірден жоғалып кетті, сондықтан ешкім ренжітетін емес деп ойлаған жоқ",bad
60099,алгебра сабағының азапты сағаты миымды тригонометриямен қайнатты,bad
60100,бәрі менің еблямды көріп үлгерді,bad
60101,"Мен бақсы-балгерлік үйді жақсы көремін, бірақ соңғы кездері бұл жанр біздің көңілімізді қалдырған кезде бәрі болып қалады",bad
60102,"Менде AdSL арқылы порт жіберу бар, маршрутизатор не upnp арқылы, не қолмен басталмайды",bad
60103,"Мен ағылшын тіліндегі эссеге әдеттегідей дайындалып жатырмын, бірақ көптен бері жауап бермегеніме өкінемін.",bad
60104,Мен ортасында қорғаныс тәртібін өзгерттім,bad
60105,"Сенің кеткеніңе 1 жыл өтті, менің қымбатты досым жер бетінде тыныштық берсін, біз жақсы көреміз",bad
60106,кел мен сағынамын,bad
60107,кешегі эпизодты таба алмай отырмын,bad
60108,"Мен үлкен шелегімді баскаға септім, сүйікті сұр сирень вельшиктен түсіп қалмас үшін құлап түсті",bad
60109,Менде алғашқы емтихан бар,bad
60110,қайтадан үлкен ит оның өміріне қауіп төндіреді,bad
60111,барыспен қала ааааааа неге мұңаямын,bad
60112,"Мен бақытты жаңа жылда тек қай жерден алуға болатындығын қалаймын, мен Аяз ата маған бақыт сыйлағанын қалаймын",bad
60113,"rt vika өзіңізді осы жағдайда ұстаңыз, мен сізге көмектесе алмаймын",bad
60114,"әркімде қалай ұйықтағысы келетіні туралы твиттер бар, бірақ мен жаттығуға баруым керек, және мен таңертеңнен бастап көңілдімін, бірақ менің ойымша, бұл ұзақ емес",bad
60115,"зенитке шірік тарату үшін барған, содан кейін зенит Дортмундпен айналысуы керек",bad
60116,"Мен оны ертең сағат 11-де аламын, бірақ бағдарламаны да үйреніп алған жоқпын",bad
60117,Қандай әдемі жігіттер қосылады деп ойладым,bad
60118,"бұл жағдайда сіздің өкпеңіз және тағы не ренжіп, қашып кетеді",bad
60119,хахаха иә жай катие ахаха кешір енді олай емес,bad
60120,ол денені бетімен жауып тастады,bad
60121,жастар 2 маусымы 14-ші жылдың 2-ші күзінде теледидарда шығады,bad
60122,"бірақ осы апта психоздармен және үміттермен өткенге ауыспасын, сонымен қатар университетке барар жолда өлмесін",bad
60123,опасыз бір үлкен мұңды қыз,bad
60124,"Кешіріңіз, жұмыс тоқтады",bad
60125,18 3-ке дейін өте күлкілі сіз батыл емессіз,bad
60126,"Ресейде біздің республикадан тым алыс жерде айналып жүрген көптеген керемет командалар мен жеке бишілер бар, маған бір нәрсе зиян тигізді",bad
60127,"мектепте олар кездейсоқ мені орындықтан құлатып жіберді, мен тіземді тістеп алдым, қалай екенін білмеймін, бірақ ауыр тиеді, мен твитті көшіріп алдым",bad
60128,"оайо gozaimasu minna san мен мұны осындай темір баспалдақта отырған кезде жазамын, әріптер ауласында, тергім келмейді",bad
60129,"және біз тарих пәнінің мұғаліміміз және оған мән бермейміз, содан кейін біз сүйікті демалыстарымыздан мектепке қайтатын нақты күнді білеміз",bad
60130,өте керемет сериал тек бір маусым үшін кешіріңіз,bad
60131,9999 9,bad
60132,"әрине, мен өзім тәртіпсізбін",bad
60133,"жақсы, кеше олар жылытуды өшірді, бүгін пәтерде суық",bad
60134,"кешіріңіз, мен басқа адамға жазғым келді",bad
60135,rt ең болмағанда өзіңізге өтірік айтуды доғаратын кез келді,bad
60136,"Әдетте жаңа жылда көрсетілетін барлық фильмдерді қарады, менің өмірім ешқашан өзгермейді",bad
60137,"11-сыныптың қызы менімен күнде амандасады және әдемі күлімсірейді, сондықтан ВК-дағы достарына әдемі қыз қосылды, жарайды сені",bad
60138,"қарғыс, егер cska топтан шықса, ол леопарды ұрады",bad
60139,және қазір вирлигиг сияқты күні бойы сыйлықтың артынан жүгіру,bad
60140,"Мен тесттер мен сессияларды өткім келмейді, мен ыстық шайдың ұйықтап, тұтқаларында болғанын қалаймын",bad
60141,"rt екі күнде ангина өтті, бірақ бәрі студияда жоқ",bad
60142,"Мен университетке қалай барғым келмейтіні туралы аздап түсінемін, бірақ 3 аптада бір рет мен өзімді сол жерде көрсетуім керек",bad
60143,жоғарыда айтылғандардың ешқайсысы ол жерге жаяу бармайды,bad
60144,"Міне, жаңа жыл құрдымға кетті, мен сыйлықсыз қалдым ехх, жақсы, мен туберкулезге қарсы дәріге ұзақ уақыт шыдай алмаймын",bad
60145,"иә, иә, кез келген қарсылас қорқынышты болар еді, бірақ арсенал ең қатты соққыға жетті",bad
60146,және жарылыстардың орнына шексіз теңдеулер мен есептер,bad
60147,автобустағы тамақ және глюкозаны әндейтін 2 дүмбілез,bad
60148,"rt Мен шайнайтын посттың батырмамен өшірілгенін растау туралы өтінішімді қалаймын, әйтпесе мен бүкіл жіпті жіберіп алып, тозаққа түстім",bad
60149,Менің қазір мұрным Аяз Атадан гөрі салқын,bad
60150,эй балалар қалайсыңдар?,bad
60151,12 сарас хоиш 3 гаранх н осогож ам ерседсен ген тасарч унасан х н бвал 1 2 луу залгад бга газриг н л helchikh yerd 3 sec l bolno,bad
60152,rt 12 saraas khoish 3 garan x n osgozh am ersedsen gene tasch unasan kh n bval 1 2 luu zalgaad bga gazryg n l helchikh,bad
60153,"Неге, менде бәрі жақсы",bad
60154,rt 12 saraas khoish 3 garan x n osgozh am ersedsen gene tasch unasan kh n bval 1 2 luu zalgaad bga gazryg n l helchikh,bad
60155,"о фууууууу қазір одан да жиіркенішті естіледі, мен саған қалай көмектесетінімді де білмеймін",bad
60156,"жақсы, әрдайым, қарғыс атсын, арсеналдың лигадағы мүмкіндігіне назар аударсын, мен күмәнданамын",bad
60157,"Мен бүгін күңкілдесемін, аяғым тозақ сияқты ауырады, мен оны баса алмаймын",bad
60158,rt Мен сенімен мәңгі бірге боламын,bad
60159,"Абидна Хрюша тек 3 5 концерттік операцияларды көреді PPC YouTube таксілері, әйтпесе ол менде 2 бар бар жерді таппайды",bad
60160,"Құдай маған сынақтарға күш береді, өйткені мен мүлдем дайындала алмаймын және қаламаймын да",bad
60161,"әзіл, менің суреттерім қоқысқа жүктелмейді",bad
60162,"Мен үйде тамақ жедім, тамақ қалмады",bad
60163,"қуаныш үшін ішу қайғы үшін ішу себепсіз бір күн емес, мен тұрып қаламын",bad
60164,ahem me b 1,bad
60165,"жарты сағаттан кейін біз кетіп бара жатырмыз, мен бір нәрсені ұмытып кетуге қорқамын",bad
60166,ертең экономикаға қайшы бағалау маңызды,bad
60167,"Мен осыдан бір плюс таптым, бірақ минус саны азырақ 3 апта өте қиын болады",bad
60168,"жалпы, мен оқимын және үй тапсырмаларын орындаймын, бірақ менде не тозақ бар, сонда жалқаулық араласып кетті",bad
60169,"Егер сіз twiiter-ге juick арқылы хабарлама жіберсеңіз, ол 114 таңбадан тұрады",bad
60170,"біз оларды бір күнде уладық, бірақ олар әлі күнге дейін табанды тіршілік иелері",bad
60171,"келесі бейсенбіге дейін мен 4 5 мың шақырымды еңсеруім керек, өйткені мен автомобильдегі автопилотты қатты қалайтынмын",bad
60172,"Мүмкін, бұл жақсылық үшін, маған бұл оқу залы қажет емес, сондықтан қажет, бірақ мен оны келесі жолы қатты қалаған едім, әрине, өкінішті",bad
60173,"Мен нашармын, жақсы, олар менің университетіме қарасуға қарамайды",bad
60174,"мас адамдар әдеттегідей бұрынғы адамдарға қоңырау шалады, мен қазір диплом жетекшісімін",bad
60175,менің миым миллиондаған проблемалар туралы ойлауға мүмкіндік беретін сәтті күтуде,bad
60176,"bl pawson, тағы да сурет жіберілмейді, суреттермен бірге стриптиз жойылады",bad
60177,"Мені Мәскеуге апарыңыз, мен ақымақ сияқты гүрілдегенімді қатты сағындым",bad
60178,"ертеңгі күн үшін 1 5 математикалық тапсырма орындау керек, мен суперменді құтқарамын",bad
60179,аааааааааааааа алинааааа сағындым,bad
60180,"тоқсанның соңғы күндері ең ұзақ, демалыс сияқты, бірақ олай емес сияқты",bad
60181,қалаған кезде менде қалқан жоқ,bad
60182,"rt тек жоғары жалақы ғана емес, сонымен қатар зейнетақы мемлекеттік қызметшілерге арналған формула бойынша басқа формула бойынша есептеледі",bad
60183,тіпті мен бұл фактіні мойындайтын шығармын,bad
60184,rf мэрін сайлау Уфада жарияланады,bad
60185,"бұл өте үлкен құрбандық Интернетті және барлық жағдайларды күтпестен күтеді, дегенмен сіз кімге қажет және кімге бәрібір екенін көре аласыз",bad
60186,"6 ұпайдан ұтылғанына қатты ренжіді, барлық ойнауға деген ұмтылыс жоғалды",bad
60187,rt бәрі менде,bad
60188,"Мен өз жігіттерімен сөйлесу кезінде қиындықтар туындаған кезде душқа түсіп, тамақ сұраған кезде мен үйге барғым келеді, бұл үйде болмайды",bad
60189,"eh басы бөлініп жатыр ма, әлде қайтадан ілулі ме немесе температура ма",bad
