Num,Review,Review_type
61387,"ҰОС ардагерінің әжесі 3 жылдан бері баспана кезегіне алынбаған, бірақ сот шешімінен бас тарту заңсыз деп танылып, не істеу керек",bad
61388,НТВ-дағы сұмдық - бұл кейбір офицерлердің клоундары жасаған суасты қайықшылары туралы мүлдем бос сөз,bad
61389,"менің үйге келгеніме 2 сағаттай болды, әлі жылы емес",bad
61390,"Сейсенбі күнін жек көремін, бізде сейсенбі күні математика бар",bad
61391,"бір мезгілде қол қою үшін ауруханалар мен мұғалімдерді айналып өту, зертханалар мен курстар жасау, рейтингтер жазу және емтихандар тапсыру қажет",bad
61392,"Ертең бұл күн қалыпты болуы керек, мен бүгін қатты шаршадым",bad
61393,жаман күн бүгін скучно және жалғыз,bad
61394,"иә, тағы не істеу керек, бізде екі орын бар сияқты, бірақ кім біледі, бәрі өзгеруі мүмкін",bad
61395,"өтінемін, кіріңіз, лоис қойыңыз, әйтпесе топ мүлдем бос",bad
61396,тек мен тұтынатын кейбір нәрселерді айтыңыз,bad
61397,жігіттер мүлдем не оқитыны туралы білмейді,bad
61398,сасық бл,bad
61399,священник қандай тар көзді нарн,bad
61400,Никита Тихонов туралы менің жұмбағымды ешкім тексерген жоқ және бұл күлкілі болды,bad
61401,"Мен үй тапсырмасын, тіпті ақымақ күрделі жоспарды, геометрия мен географияны орындауға өте еріншекпін.",bad
61402,бұл адамның ән салған тәрізді,bad
61403,"менің ағам шырынын іше бастағанда, тамағымен үлкен бөтелке шырын сатып алды",bad
61404,"міне, сен бейсенбіде де боссың",bad
61405,"2 14 шілдеде сағындым, сонда біз сізді көреміз",bad
61406,"ВК-да мимитра жазып, ретвит жасай алмау қаншалықты қиын",bad
61407,лента мен жауаптымын vk компьютерде қайырлы түн,bad
61408,менің досым ауруханаға ұзақ уақыт кетеді,bad
61409,"Мен жаңа жылға кәмпиттер, шоколадтар, тәтті сусындар мен лолиппалар алғым келеді",bad
61410,"көп ұзамай демалыс, мен биологиялық бойынша 2 алдым",bad
61411,орфографиялық қате жасаған кезде әлемде бір мөр басылады,bad
61412,"Мен оны қалай тыңдайтынын түсінбеймін, шынымды айтсам",bad
61413,"сөйлеу және жылау үшін өзіңізді иыққа қалай көмгіңіз келеді және ең бастысы, тыңдаушы түсініп, көмектесуге тырысады",bad
61414,"SMS келеді, мен оны қуана ашамын, сосын мтс-тан иә, ол маған SMS 3 жібере алады",bad
61415,"күні үйде от болды, мен түнгі 1-ден бері болмадым",bad
61416,қастар шкафында тұратын сехун туралы біздің әңгімеміз есіңізде,bad
61417,"мұңаймаңыз, әйтпесе ештеңе өспейді",bad
61418,"бүгін осы дүкендермен бос уақыт бәрін ұмытып, қатты шаршады",bad
61419,айпадтарда ақысызнан кейін интернет желісіндегі сиқырлар жоқ,bad
61420,Екі жүз жылдан бері тербелмелі орындықта немесе суретшіде болған емеспін,bad
61421,"бұл жаңадан өмір сүруді үйрену сияқты, мен одан әрі қалай жүру керектігін білмеймін",bad
61422,rt мен істеймін,bad
61423,"жақындарымыз бізді тастап кеткен кезде бір нәрсе өледі, біздің бір бөлігіміз өледі және ол ешқашан тірілмейді",bad
61424,"Мен деканаттан директордан келдім, бұл hrt mgavmib сияқты түсініксіз шаршады",bad
61425,мен немене жігітіме қате сурет жібердім аааа,bad
61426,"соңғы жобаның пайдаланушы нұсқаулығын аяқтады, мен оларды жазуды жек көретін болдым",bad
61427,"маған сәттілік сәулесін жібер, өйткені ертең мен қиын емтихан тапсырамын",bad
61428,"Мен үй тапсырмасын орындаймын, әйтпесе осының бәрін тыңдау үшін тоқтап қалдым",bad
61429,kr st менің сумнамды екінші рет лақтырды n арман pohalooooooooooooooooo,bad
61430,ахаха шынымен ол тек оянды,bad
61431,"қызылша лақтыратын барлық қуанышты эпизодтарды қарады, мен жай ғана жылап отырмын",bad
61432,Мен барлық сынақтарды автоматты түрде тапсырдым және барлық емтихандарды ояттым,bad
61433,кеш өте жақсы емес,bad
61434,"rt Мен тыныш жылы тыныш кештің сүйікті фильмдерімді көріп, ештеңе жасау керек емес екенін сезінгенін қалаймын",bad
61435,rt стакан кола жарты литр o o,bad
61436,"сондықтан, сонымен қатар кәдімгі қысқы киімнің уақытша жетіспеушілігінен мен қатты әлсіздікке шалдыққан сияқтымын, мойным қатты ауырады",bad
61437,бұл жолы есек арқылы,bad
61438,"Неліктен асханадан жаман иіс шығады, сондықтан үйге кезекшіліктен кейін келсең, бәрі сасық болады",bad
61439,ең бастысы - мен жоғалтқаныммен ол әлі тірі,bad
61440,"vf трафик жұмыс істемейді, интернет тым жоғары",bad
61441,rt gon толығымен бәрі жалған,bad
61442,Сіз анальгиннің толық күшін оны инъекцияны тоқтатқан кезде ғана түсінесіз,bad
61443,"Мен сейсенбі күндерін жақсы көремін, бірақ ертең сейсенбі алгебра тестінен ерекше болады деп ойлаймын",bad
61444,"Мен қазірдің өзінде екінші микроавтобуста отырмын, ол біріншіге қарағанда тіпті ыстық",bad
61445,"rt n in 5 ranku mi sidimo in ki, вокзалдағы мен қорқамын, сарымсақ ұйықтаймын",bad
61446,сен маған және өзіңе сенуге уәде бердің,bad
61447,Мен олармен байланысты тоқтатқандықтарын әлі түсінбедім,bad
61448,неге мен біреудің ақымақтығы үшін алаңдауым керек?,bad
61449,Мен сүйіктіме жете алмай мазасызданып жүрмін,bad
61450,тіс ауруы мен мұрыннан су ағу мені жынды етеді,bad
61451,бізде гимназия бар және сенбіде оқуымыз керек,bad
61452,"сиыр - бұл қасиетті жануар және медбике, бірақ кейбіреулер үшін бұл жай сиыр еті",bad
61453,"анам үйде болмаған кезде, мұндай меланхолия тіпті ешкіммен сөйлесу үшін жетіспейтіні жаман",bad
61454,"Мен қорқамын, бұл өте қарапайым емес, мен иммунитетке ие емеспін, бірақ hulk",bad
61455,"ар-ұждан, мен ұйықтайтын немесе кеміретін хомякқа ұқсайды, мен оны қалаған кезімде",bad
61456,"Мен бүйірлік перделерді отқа орнатқым келеді, тізбектерді қайта көтеріп, каталог нөмірін іздеуім керек",bad
61457,"Менде күні бойы көңіл-күй жоқ, қорқынышты күн",bad
61458,"sukpsdts маған ешкім екі-екіден жазбайды, бәрі сөйлеседі және мен сорғышпын",bad
61459,кім қандай әділетсіздік жазбауы керек,bad
61460,қалғаны керісінше,bad
61461,"Мен шаршап келдім, мен бірден кеткім келмейді",bad
61462,"тағы да жалқаулық немесе жұмыссыздық, бірақ алты айдан кейін емтихан тапсыру керек",bad
61463,"Міне, бәрі, егер Ачинскке барсам, шайтан көптен бері қалағанды ​​көрмеймін",bad
61464,"көңіл-күй сәл бұзылды, бірақ мен сауумын",bad
61465,"Бүгін балалар айтқанындай, Соня, сен Хлояға ұқсайсың, Саша сен бұзық ханшайымсың және кімге сену керек деді",bad
61466,"Мен күні бойы өзім жазған диалогты зерттедім, ол одан сұрамады",bad
61467,"әрине, сұйылтылғанға дейін ол алмаға оның шырыны деп отырғанымызға қарағанда бірнеше есе жақын",bad
61468,"Мен бүгін қатты шаршадым, қатарынан 3 тест қиын",bad
61469,rt біз гимназиямыз және сенбіде оқуымыз керек,bad
61470,"Мен қазір бір командамен ойнайтын едім, бірақ берілген жоқ сияқты",bad
61471,көше бойында жерде жатқан қарлы әндердегі растишка мен сағыз немесе нағыз бақыт туралы бірнеше сөз,bad
61472,"rt бұл ойындарға және ресейліктер бармайды, шенеуніктерді ел есебінен жұмылдыратын ештеңе жоқ",bad
61473,Мен тек 5 деген бағамен оқимыз,bad
61474,"егер жаңа жыл бұдан былай тезірек болса, мен қайда және кіммен тіпті таныс емес екенімді біле алмаймын",bad
61475,"алгебра параграфын оқығаннан кейін оқулықты жауып, ештеңе түсінбейтінімді түсіндім",bad
61476,"Мен саған ән айтпаймын, сен кенеттен көз жасыңа батасың",bad
61477,rt қыздар Санта Барбараны қаншалықты жақсы көреді,bad
61478,Мен өмірімде Берлинде бірінші рет қатты ауырдым,bad
61479,аха хоры мен тек иттермен әрекет ете алмаймын,bad
61480,Мен олар сияқты ешқашан ебля емеспін,bad
61481,бізді сөгіп жатқан сияқты,bad
61482,Мен адамдарды шынымен жақсы көремін және 1861 жылдан бастап оларға бере алмайтын өкінішті,bad
61483,"Ия, мен Настямын, ал сен Настя туралы әзілді білмейді екенсің, Настя - бұл сойқан, ал қазір мен шіркін!",bad
61484,"Мен жанашырлық білдіремін, сосын 21-ші жазудың бізге қандай болғанын айтыңыз",bad
61485,"Мен бүгінгі күнге дейін қатты шаршадым, бүгін мен кіреберістің негізгі патшасы арқылы үйге бара жаттым",bad
61486,rt орташа деңгей 7 көпір салу жиынтығында менің миым сау,bad
61487,"Мен өзімнің сүйіспеншілігімді сирек мойындаймын, егер бұл орын алса, мен оның орнына сізде не бар екенін сұраймын, ал мен сізді қатты жақсы көремін",bad
61488,"аялдамада тұрудың қандай суық екендігі жақсы, қазір мен үйде ыстық шаймен жылынып отырмын 3",bad
61489,"достар, кешіріңіз, егер мен сізбен араласатын адамдар туралы жазбасам, мен осы аптада өте бос емеспін, кеттік",bad
61490,кемпірқосақтар мен Аяз Атадан нг сыйлық алғысы келді,bad
61491,бұл линзаны канон эф 17 4 мм f 4l usm ақымақтар өлтірді,bad
61492,"олар сиқырлар мені мазақ етеді, мені барни iphone 5s шампан түсіне әкелді, мен оны қатты қалаймын, бірақ мен ақшаны қалай үнемдеу керектігін білмеймін",bad
61493,етік таңдау ешқашан мұндай қиын болған емес,bad
61494,"Сіздің мәртебеңізге қарамастан, кейде сіз мектеп жасырын сияқты болып, әрдайым сыныптастарыңызды жаман жағынан көрсетуге тырысасыз",bad
61495,"Бүгін мен шын жүректен есте қалған шюжмен сөйлестім, мен оған испанияда, ал ол менің казармаларыма бара жатырмын",bad
61496,"Даша, мен ауырып қаламын",bad
61497,"rt сіз сонда да жете аласыз, бірақ сіз қонақ үйге барып, билет сатып ала аласыз.",bad
61498,"Джанфранко Зола Уотфордтың менеджері қызметінен кетті, ол қабылданды",bad
61499,сіздің сайтыңыздағы кез-келген параққа өткеннен кейін терезе пайда болады бізге жазылыңыз ВКонтакте жазылды және терезе шығады,bad
61500,эй қара жолақтан кейін міндетті түрде ақ болады деп айтпа,bad
61501,rt o o Yandex поштасы кестелерде HTML әріптерімен түсініксіз қиянат жасайды,bad
61502,"Блин, маған Интернет үшін құпия науқанды жүргізу керек болды, мен үлкен көлемде ілінемін",bad
61503,"иә, бірақ біз мәйітті ешқашан таппадық",bad
61504,"бал мен балмұздақ еріп, менің қолым мас адамдай дірілдейді Мен ертеңгі күні күн әлдеқайда жақсы болатынын қалаймын",bad
61505,сондықтан Зола Уотфордтан кетті,bad
61506,"негізгі концерттен кейін мен алым боқтық болады деп қорқамын, ең бастысы біз аламыз",bad
61507,Мен жай ғана демалу үшін үйге келдім,bad
61508,"егер ең бастысы проблема болса, неге бару керек",bad
61509,rt жылау немесе өлтіру,bad
61510,Беларусьтар бұған онсыз да әбден үйренген,bad
61511,"Диана бронхитпен ауырады, мен оған бір нәрсе болғанын білдім",bad
61512,"Бля, мен директордың шыршаға шақыруымен айналысқан емеспін",bad
61513,"rt ақымақтықпен құрғақ еліктің қырық грамын 185 рубльден сатып алды, бірінші кезекте ол қымбат, ал екіншіден сиыр етінен айырмашылық аз",bad
61514,үйрек ешкім білмейді,bad
61515,менің аяқтарым конькилерден ауырады,bad
61516,"Мен әлі нақты білмеймін, бірақ бұл жерде гуманитарлық мамандықтарға сұраныс жоқ екені Ижевскіде жоқ",bad
61517,"бір апта өткен жөн, сондықтан көңіл-күй жоқ, бірақ мереке алдындағы күндер мен жаңа жылдық көңіл-күй бар",bad
61518,неге мен қажетсіз болған кезде әлсіз және мейірімдімін,bad
61519,ахахах ия сен менің армандауыма жол бермейсің,bad
61520,мен мысықтар мен бақалармен кездестіремін,bad
61521,"rt сіз жақсы адам сияқтысыз, содан кейін ол тұзаққа түседі екен",bad
61522,"Ия, барлығы мені елемейді, мен көп хат алмасқанға дейін ешкім ретвит жасамады, бірақ қазір өмірде не бар?",bad
61523,RT жаңа жыл құшақтайды,bad
61524,"rt тіпті рақымшылық жасау туралы өтінішке емес, шешен жауап",bad
61525,"Тони котятпен қорқақ болды, неге мен ештеңе есімде жоқ",bad
61526,"егер мен бірден жауап бермесем, онда мен хабарламаны көрмеймін.",bad
61527,"Мен бүгін зомби сияқты күні бойы 2 сағат ұйықтадым, бәрі депрессиялық тлен ахфахқа тұтастай зиян тигізеді",bad
61528,"құрметті ер адамдар, сіз бізді неге бағаламайсыз, бізге неге сонша ауыртпалық түсіресіз",bad
61529,"Айтпақшы, қазір, мизулина сияқты, ол ЛГБТ-ны қолдау үшін ақша табады, ал менің анам пичаль мен позаданың тонын сатып алды",bad
61530,"мұндай нәрселер, егер мен мезгіл-мезгіл депрессиялық музыка тыңдап, өзімді снотаға көмсем, онда бәрі жақсы, назар аудармаңыз",bad
61531,бүгін ат спорты мектебінде қайғы-қасірет болды,bad
61532,"Мен ауырдым, бірақ мен әлі мектепке баруым керек",bad
61533,"Мен Лаурамен бірге 2 сағат отырдым, сол жерде өлемін деп ойладым",bad
61534,"онсыз да, өкінішке орай, бұл жаңалықтардың бәрі инелер мен инелерге арналған",bad
61535,сарқылған күш жоқ алға қарай жүруге күш беріңіз менің көңілімді көтеріңіз,bad
61536,мүмкін оған жазыңыз пит жазыңыз pf иә иә мен мұның бәрі,bad
61537,егер мен Санкт-Петербургте тұрсам және мен бүгін жүрегімді жарып жатсам не істеуім керек?,bad
61538,Мен фукиннің заттарын сипаймын,bad
61539,менің сүйіктім қайтадан балалармен футбол ойнайтын шығар,bad
61540,"Мен Мәскеуге сағат 3-те жатар кезде ұйықтамаймын, бірақ скуповский сіздің логиніңізді қалдыра алады",bad
61541,rt Менің түрім өте қорқынышты және жаным шірік,bad
61542,"Жаңа жыл қарсаңында оқ атылып, гүрілдеген оқ басталды",bad
61543,твит батырмасы менің смартфонымда бір нәрсе 15 жыл басқаннан кейін кенеттен жұмыс істей бастады,bad
61544,"демалыс бәрі оларды күтеді, мен қазірдің өзінде осы демалыс күндері бізден не болатынынан қорқамын",bad
61545,рт ахха жоқ сабақтарға мен бүгін отырмаймын,bad
61546,"маған бұдан былай оған жазба, деді zadolbalietissors",bad
61547,кез-келген суреттер ашылуын тоқтатқан әлемді жаңартты,bad
61548,"о жақсы, мен сен 3сің, иә бәрі қалыпты болады деп уайымдама 3 мен жай 3 күн жазамын, жауап ретінде үнсіздік маған ұтылады",bad
61549,"Бүгін бүкіл ауыл күні менің аяқтарымда, олар кешеден бері маған зиян тигізді, өйткені мен көп жүрдім, маған аяқ киім керек",bad
61550,"не тыңдап отырсың, мен биологиядан сабақ беремін",bad
61551,rt Менің түрім өте қорқынышты және жаным шірік,bad
61552,"мен де негізгі оқиғаларды біле алмаймын, өйткені мен бәрін өзім үйреніп, өзімнен өтіп, басқа біреуден қабылдамауым керек",bad
61553,боқтық маған достар боқтық инфекция сука менің көз алдымда қурап қалады,bad
61554,"Рождестволық шыршаны асыға күтуде 3 1-де және 2-де қайта қаралған осындай эмоциялар шынымен жақсы фильм, қазір бұл өте сирек кездеседі, өкінішке орай",bad
61555,"Интернеттен емес, кітап оқудан бас тартуға ниет болды",bad
61556,"Менің жолым болды, бірақ мен өтірікке шыдай алмаймын және барлық жерде кәсіпқойлық өте ыңғайсыз",bad
61557,"Мен енді үмітімді үзбей, хачико ретінде өмірімде жақсы нәрсе күтуді жөн көрдім, содан кейін бәрі бос екенін біліп өлемін",bad
61558,суреттегі түсті емес пикселдерді табу қиынға соғады екен,bad
61559,"иә, бұл қалыпты жағдай сияқты, ертең маған тіс дәрігеріне бар дегенді айтпағанда, мен оны көрмеймін, ал сен ше?",bad
61560,"hmm компьютерді қараусыз қалдырды, інісі деген зиянды вирус менің бүкіл файлдарымды жеп қойды, өмірімнің жартысы қатты дискіден өшірілді",bad
61561,менің компьютерімнен жоғалып кеткенімді кешіріңіз,bad
61562,"бұл сұмдық, онда көптеген оң пікірлер болуы мүмкін емес, сіз бұл кошмарға қалай шыдадыңыз",bad
61563,сол мадкууу ухлее ухлее,bad
61564,"менің басым ауырады, өйткені мен ұйқымды қандырмаймын",bad
61565,"rt және мен де патриций қыздарыма сәлем айтқым келеді, мен сендерді қатты сағындым",bad
61566,мен бәрібір хат жазысқым келеді,bad
61567,"аххх, мен ешкімді ренжіткім келмейді, мен неге бірдеңе шешуім керек",bad
61568,"қазір қыстың өкінішті, таңертең жүгіре алмайсың",bad
61569,"Мен осы екі күнде саңылауларға бір трек естідім, енді ол мені сөгіп тастады, мен оны ұмытып, тағы тыңдағым келеді",bad
61570,rt блокнотпен Мишаның көзіне берді,bad
61571,Дубайдан келді және менің памеламды ұмытып кетті,bad
61572,сіз маған қарамайтындай әрекет етесіз,bad
61573,бірақ ас үйде ондай үй болған кезде маған ұнамайды,bad
61574,"Сіздің махаббат сиқырыңызды маған қолданыңыз, әйтпесе бүгін ағаш менен бас тартты",bad
61575,Денсаулыққа байланысты мен тезірек жазыла алмаймын,bad
