Num,Review,Review_type
30001,"ноооо, мұндай қарлы желдермен, демалысқа дейін емес, бұл анық d",good
30002,"сізде және менің әйелімде бірдей Юпа бар, мен сәлем жазғым келді сүйіктім д",good
30003,"Мен сізге ескертемін, бұл менің бірінші фф, сондықтан боқ толы x",good
30004,"Менің ойымша, қазір менің ойыма қиянатшыл ойлар сирек кездеседі, бірақ олар солай болады",good
30005,rt бәрінің де осындай көршілері бар,good
30006,"қандай да бір себептермен олар мысықтарға айтады, бірақ бірде-бір мысық ешқашан оның қайдан шыққанын болжай алатын адаммен бродер білігін ішпеген.",good
30007,"шай шай жақсы, рахмет мен сені де жақсы көремін 3",good
30008,"мені оқығаны үшін рахмет, сауығып кет",good
30009,"ең бастысы - мұз айдынын су басып, қалған қардың қажеті жоқ, тек аққала үшін ғана",good
30010,Леша бәрін жақсы отырғызады,good
30011,сіз жақсы адамсыз рахмет,good
30012,"броу 3 енді шөмішті жабыңыз, сіз бәріңіз тамаша d",good
30013,бірақ піскен алмалар одан да әдемі болу үшін күнге қарай тартылады,good
30014,Екінші күннен бері мен бұл күнтізбеден шыға бастадым,good
30015,"rt Мәскеуде алғашқы фотосессия, мен 18 жастамын сынап журналына түсемін",good
30016,Мен симс ойнаймын және қарақшыларды бір уақытта көремін,good
30017,сыныптастары олар соншалықты d 1,good
30018,Vick біз сәл жіңішкердік,good
30019,rt үшін твит,good
30020,"соңғы апталарда мен кроссовкалар мен шоколадты сүтпен ғана тамақтанамын, бүгін ммм жеймін",good
30021,"сүйек қорқынышты емес, ол емделуде",good
30022,rt kitty тұлға махаббат кезінде жай эпопея себеді dd,good
30023,Джулиан Леннон мәңгі леннон мәңгі леннон мәңгі леннон мәңгі леннон мәңгі леннон мәңгі эй иуде,good
30024,"бугагага әкесі нумен тағы 2 дау, кім бақытты екенін көрейік",good
30025,"ол кеше соншалықты мұқият қарады, мен ұялдым ахахах",good
30026,"ант бермеңіз, әйтпесе цермет темекісінің қорабын алмайсыз",good
30027,rt ертегідегі кездесулер онлайн танысу,good
30028,"мырзалар, біреу қандай-да бір себептермен менің аккаунтымды жасанды түрде жасады және барлығының достарына араша түсу арандатуға жатпайды",good
30029,"кеше менде темекі шегу туралы дін туралы қаламдар болды, мен ертең не болады деп ойлаймын",good
30030,Марстағы 3 секундтық төрт мтв жұлдыз бізді қалай басып озды,good
30031,"rt шай шай жақсы, рахмет мен сізді жақсы көремін 3",good
30032,өйткені әр қар үйіндісінде қыз жоқ,good
30033,менің қуыстарым,good
30034,жаңа жылдардағы жер мен басқа жерлер жаңа жылдардағы отандық таксам,good
30035,мұндай сынақтар мен емтихандар мерекеге дейін мүлдем болмайды,good
30036,ааа Жеңіс саябағында балалар слайдпен жүруге өте жақсы,good
30037,rt осы таңертеңгі суреттен d,good
30038,"иә, ол оған тек осылай қарайды",good
30039,"rt 8 наурызда олар сыйлаған бірнеше сыйлық түстен кейін өте қуанышты болды, кешке досы келді, жиенімен кетті",good
30040,ол 2-нің басында болғанына қуанғанын айтып қоңырау шалды,good
30041,Нәтижеге ризамын,good
30042,"ха, сіз терезе аштыңыз, мен твиттегі суреттер ауысады деп ойладым, бірақ нәтижесінде 2 терезе пайда болды",good
30043,"rt темекіні кез-келген жолмен тастауға тырыспаңыз, бұл жай ғана әдет және әдетті есірткі арқылы емдеу мүмкін емес",good
30044,оооооооооооооооооооооо бауырым аспазшы болып жұмыс жасайды інім аспазшы болып жұмыс істейді,good
30045,ескі досымның досы қыста шұлық байлады,good
30046,жүргізуші Майк Джексон д ия саша жетекші Меган Меган жетекші достар Марсадан,good
30047,Сіз университеттік колледждің мектеп күнделігінен қандай айырмашылығы бар екеніне таң қаласыз,good
30048,"Бәсекелес Фрэнкке киініп, содан кейін ддд шешіндіруге өте таңқаларлық болды, бірақ олар ұқсас сияқты",good
30049,"ахахаха менде әлі күнге дейін жолбарыстар бар, аахахаха",good
30050,"о, мен соқпақпен жүремін немесе осыдан бастаймын",good
30051,"Мен бейнені инстуацияға кездейсоқ қалай жүктей аламын деп ойлаймын, ол 5 минутқа жүктеледі, сіз қандай ингибирленген болуыңыз керек?",good
30052,ақыр соңында ол озон саяхатынан өтті және әрине иә болды,good
30053,"маған Настямен отырып, біз натахамен д маңызды әңгімелестік",good
30054,"rt неге ол маған хат жазады, мен саған келген сайын оған жазған сайын жаман болғанымды қалайды",good
30055,"иә, мен қазір білемін, бірақ мен қайшы қарындастарға ілінбеймін",good
30056,"Бүгін мен түнгі ыңғайсыздықтан ояндым және бұл туралы ойлау оңай болды, демек мен бәрін дұрыс істеп жатырмын",good
30057,"жігіттер джойстикке қоңырау және ысқырықсыз баға қалыпты деп кеңес береді, маңызды емес, әрине",good
30058,рт Джулиан Леннон мәңгі леннон мәңгі леннон мәңгі леннон мәңгі леннон мәңгі леннон мәңгі эй иуде,good
30059,rt кейде маған менің артымнан жақсы араласатын адамдар менің қандай қоқыс екенімді айтатын сияқты көрінеді,good
30060,витя бухой енді ширектің жарты кварталының жартысын сорғысы келеді por qua ширектің жартысы obrsu uraaaa деді d,good
30061,"ол, мектепке бармау үшін маған сыныптың ата-аналары қоңырау шалуы керек",good
30062,"ильшатик ришка ралиф идолка кешке рахмет, салқын болды, әсіресе ишка ришка ралиф бізді қуған кезде ақымақ г",good
30063,311 м турбо-концертке дайындықты бастау,good
30064,сондықтан барлық уақыт белдеулері қулық-сұмдық екені анық,good
30065,"иә, қыздар шынымен де қолдарында телефон ұстамайды, оның ішінде машинаның кілті бар және олар сол қолмен гестикуляция жасайды",good
30066,ахаха иә иә кездейсоқ телефон маған барып суретке түсті,good
30067,арттағы жігіт ұялды,good
30068,"Мен жай ғана Rive Gauche-тен тоналды крем сатып алдым, жақында барамын, және жаңа жылдық жеңілдіктер бар, крем 2 рубльге арзан",good
30069,rt сіз үшін жақсы жұмыс көңіл-күйін өмір сүріңіз,good
30070,мен қай затты тапқанымды көр,good
30071,"мен де, бірақ менде бар",good
30072,Мен жүк тиегіштің жыртылған бұрышы бар жарнаманы көрдім және менің жүрегімде қандай қуаныш болды,good
30073,"олар жарқыраған жасыл түсті тісіңмен ашпа дейді, мен саған көбірек айтамын, оны мүлде тықпаған жақсы",good
30074,"Мен жақсы түсіндім деп ойлаймын, мен донмен бірге отырамын",good
30075,"Маған ұнайды, ол құрғақ және күн шуақты болған кезде",good
30076,"Фильмдерді телефонның қақпағынан алып тастадым, білесіз бе, бірақ бұл әлдеқайда жақсы",good
30077,RT Lennon мәңгі қандай cynthia қандай йоко тек жарты x,good
30078,"rt fj, әдетте, ең керемет энергияны тікелей қуаттайды",good
30079,заза одоржин uzsniyh altaa avchhsan shuu,good
30080,rt кездейсоқ шаян болып кетпеңіз,good
30081,менің таспам 1 мтв жұлдыздар бір бағыт 2 мтв жұлдыздар марсқа 3 секунд 3 солдаттар мен жұлдыздар,good
30082,"баға мені бұзады ахах 8, ал мен олардың әндерін мүлдем білмеймін ахах, бірақ досым барып маған компания ұнай ма деп сұрады",good
30083,"rt ahah d мүмкін сіз онымен туыстарсыз, құдай, мен не туралы айтып отырмын d",good
30084,бүгін біз ыстық түннің өзін тербетеміз,good
30085,"ол сұрды шақырды, бірақ ол иә, ддддддддддддддд деді",good
30086,блокбастер шешендер мен дағыстан,good
30087,4 жылдан кейін көрейік,good
30088,иә иә иә ер адамдар оны лақтырды ол менің тізімімде xd,good
30089,папа көп ішпе дедім ахаххаха ол мені кімге алып барады,good
30090,RT канга бардан дюймге соққы поэзия сияқты естіледі,good
30091,"осылай тапқыр сөз тіркестері, оның жұмбақ шайы осылай пайда болады, мен де осыны қалаймын",good
30092,ахах күніне қанша рет құладың d,good
30093,олар қалай жақсы тойлады?,good
30094,мен қазір украиндықтың салқын екенін түсінемін,good
30095,"Аяқ киім маған Никитаның көптеген өнімдерін сатып алды, ал менің әйелім оны көрді",good
30096,"ааха біз пирамидалар мен эльф мұнарасын саламыз, каньон қазып, виктория сарқырамасын қытайлар қалай жасанды жасауды біледі",good
30097,"Маған сіздің пікіріңіз ұнайды және жалпы, m мен f-ге қарамастан, әркімнің өз артықшылығы мен кемшілігі бар",good
30098,"lol мкдуктағы құсбелгіні бердім, мен кішкентай балаға ұқсаймын",good
30099,"иә, мен оған оның фрик екенін де айтамын",good
30100,Сіздің өтінішіңіздің бірінші жартысына менің реакциям,good
30101,бүгін біз тимамен біз segafredoastana astana astanacity-де көңілді болдық,good
30102,көлік тонауға арналған болуы мүмкін,good
30103,"және қаншалықты азапты болса да, мен отырғанда, мен көзімді жұмып, бәрін кешіріп, жай күліп аламын",good
30104,"барлық ережелер, өмір жалғасуда, сіз жасамауыңыз керек",good
30105,ахахахах мен Сочиге апаратын жолды меңзедім,good
30106,Маңызды жас ұзақ өмір жасыңды таңертең сен таба алмайсың,good
30107,ooo менің көз жасымды әйелі p s егер ол мен емеспін,good
30108,рт адмирал өсек жақсы траха енді ддд,good
30109,"әлі көп оқымаған дәрігер, Құдайға шүкір, мен оны мүлде сатып алғым келмейді d",good
30110,rt ренжіді,good
30111,кез келген түсініксіз жағдайда сілкініс бастайды d,good
30112,жай емес,good
30113,rt бәрінің кімнің жалыққанын және кімнің жай зеріктікке ұқсайтынын бірден түсінгеніне қатты қуанды 2 жылудың арқасында,good
30114,"Приишов досым мені әулетте, мен осылай өсіп жатқанын көріп, мектепке бару үшін кішкентай сарайымды жоғалтып алдым",good
30115,"бүгін мен жаттығулар жасадым, сельтада 35 кг ахахах шок",good
30116,бұл махаббат бұл үміт,good
30117,Мәскеу маңындағы қарлы боран сіркіреп өтіп бара жатқан қарлы көліктер солтүстігінде әдемі сияқты жүреді,good
30118,"ахаха келісемін, бірақ, шамасы, Макарды білуге ​​өте қызығушылық танытты",good
30119,"Мен алғыс түсіндім, әдеттен тыс, бұрылысшылардың қиылысы есіме түсті, мен аздап есеңгіреп қалдым",good
30120,ахаха иә ол жай ұйықтай алмады,good
30121,rt бәрі емес d luishka 3,good
30122,жақсы жіберіңдер ром сука д,good
30123,"оның қасындағы қыз онша қуанбайды, мен қолыма тиген болар едім, дик жіберіп алар еді d",good
30124,"Украинаның үлкен туы - 55 гривен, Еуропаның туы - 65",good
30125,ешкім ертегі ойнағысы келмейді,good
30126,қарлы үлпілдек үлпектер үлпектері серуендеу,good
30127,RT Одесса мен Луганск қар жауады,good
30128,24 желтоқсаннан бастап және Рождестводан тыс жаңа жылдық ертегі сиқырларын шынымен қалаймын,good
30129,"Баяуламаңыз, менімен бірге барайық, біз сноуборд айдаймыз",good
30130,"Компьютердің жанында 5 минут отырғаны жақсы, бір жарым сағат өтті",good
30131,"rt Мен ұзақ уақыт бойы ауаны үрлейтін қол кептіргіштерді жек көремін, ол ұзақ уақыт бойы қағаз сүлгілері ережесі бойынша жұмыс істейді",good
30132,"niiit қателеспеймін, маған сіздің фотосуретіңіз дәлел ретінде қажет, сонда ғана мен сенемін",good
30133,rt Мен рахмет жеймін және жақсы күн өткіземін,good
30134,бас маған мүлдем мойынсұнбайды,good
30135,"жақсы дегенде сен өзіңнің ойыңда едің, қалғандардың бәрі сиқырлы болды, шын мәнінде мен бәрін білгеннен кейін тіпті жыламадым, мен өзіме өте мақтанамын",good
30136,"Артем Мен сізбен сөйлеспеймін, содан кейін сізге жабық Байкал ддд деп жариялаймын",good
30137,қытайдан көзілдірігі бар дианка атты теңіз маймылы өте керемет ахахах оо басталды,good
30138,rt осындай салқын мультфильмде викингтер туралы Тор аңызының аты көрсетіледі,good
30139,"біз өзімізбен бірге Мәскеуге барамыз, және біз тек белбеуге дайынбыз, екеуінен де жол жазбаларын күтіңіз",good
30140,ахах үйлену dd жаңа жылға біз сізге береміз,good
30141,"жасы үлкен, балмұздақ жеу күлкілі",good
30142,"тамаша ауа-райы, балалар шана теуіп күлкі көңілді жеткіліксіз",good
30143,"құдай керемет керемет фильм тамақтаныңыздар дұға етіңіздер махаббатты көріңіздер, бұл фильмді көрмеген көптеген жағымды эмоциялар міндетті түрде көрулері керек",good
30144,"Менде көп нәрсе бар, сонда барып шай ішемін",good
30145,ЖАРАЙДЫ МА,good
30146,"әйтпесе мен сабақтан кейін саған келіп, ыстық шай беремін, сен 1 көрпеге отырып қалпына келесің",good
30147,"Денсаулығыңыз мықты болсын, 35-ші күн, бізді әрқашан жағыңыздан сүйіп жүріңіз",good
30148,"үй ірімшігі бар rt, міне, сіз келесіде қайсысы екен деп ойланып отырасыз да, ақылмен тамақтанып, жаттықтырдыңыз",good
30149,"rt, меніңше, мен тым көп адамдарды оқимын d queremosviolettaenvivoenrusia",good
30150,rt lain egor сіз ddd сипаттай аласыз,good
30151,сәлем z түрі жақсы ааа вероника керемет,good
30152,"Мен сол қолыммен жазуды үйрендім, ал менің қолым оң жақтағымен бірдей",good
30153,rt ертең сот процесі барлық тоғызыншы сынып оқушыларына жауаптар туралы армандай берсін,good
30154,тіпті туған күнінде де әкем мен оған қалай табынғаныма қуанады,good
30155,ол ақымақ адам маған үнемі ессіз ойнайтынын айтады,good
30156,автобусты асыра қозғау,good
30157,"rt ойнау - бұл ағылшын тілінде жазылған сияқты, орыс тілінде оқу норма",good
30158,"рт, бірақ мені неге қалдырмайтынын білмеймін, өйткені олар Витя ак астындағы матанга шабады дд дейді",good
30159,"менің жазбам туралы едик шығар, ол жағымсыз емес, ал егер жоқ болса, қызықты xd",good
30160,қайырлы түймедақ менің сүйікті гүлдерім аквамол,good
30161,"жарайды, сен бұған қалай қарайсың",good
30162,"Бернард Верберттің циклоптардың күлкісі туралы кітабын оқып бітірдім, мен бәріне кеңес беремін",good
30163,төртінші күні мен иттер мен шоколадтар курсын жеймін,good
30164,"rt әнұранға қатысты орыс музыкалық қорабы бірнеше рет жыпылықтады, барлық жұлдыздар тек шынайы музыка",good
30165,Сара өте әдемі бақыт үйлену махаббаты,good
30166,бұл қаншықтан ұйықтамаңыз аахахаха сізді жақсы көремін,good
30167,"кеше сақиналардың иесі, ал бүгін Кариб теңізінің қарақшыларына мен көтерілемін",good
30168,"өте жақсы, көптен бері біз осылай жүрмейтінбіз, қыздарға көбіне ұнайтын",good
30169,rt рахмет қымбаттым,good
30170,"осы апта тез өтсін, соңында нәтиже болады деп үміттенемін",good
30171,ересек адам ретінде бүгін нөмір алды,good
30172,радиодағы қыз да ауа-райының романтикалы екенін мойындады,good
30173,"кештерді достармен қалай өткізгенді ұнатасың, бірақ ең бастысы - Витя қинамайды",good
30174,"көліктегі бум күшейген сайын, фагот дөңгелектің артында тұрған ақырет о лол",good
30175,"жарайды, мен шыдаймын, олар тезірек бастайды, тезірек бітіреді, мен түсінемін",good
30176,"Барлығына сәлем, ақыры, мен осындамын",good
30177,"ия, мен өзім сол кезде үй қызметкерімен бірге газельден шықтым, сальто жасадым",good
30178,Сю биатлоннан бас тартқан алғашқы жеңіс болады,good
30179,"Мен оған телефон шалмаймын, оған қоңырау шалсын",good
30180,rt емен сияқты дауыс бермейді d mtvstars Марсқа 3 секунд,good
30181,rt ahah newt,good
30182,бірақ тіпті осы кудридаррена да маған қуаныш сыйлайды,good
30183,"мен алғаш рет скорпиондарды естігенде ұзын арық ұзын вокалистті таныстырдым, содан кейін фотоны көрдім иә Клаус ондай емес",good
30184,"қараның қыста ақ болатынын білмедім, жай қалжыңдаймын",good
30185,"Сізге кінәлі, сіз менімен жұптасыңыз деді және сіз бәріңізге танымал болдыңыз, шу шу балаларға әсер етеді",good
30186,каааааааак каааааааак мені оятыңдар ол дұрыс емес иә ааааааааааааааааааааа,good
30187,"Мандаринді айтыңызшы, мен де сүйемін, ең бастысы сүйіктіңізден сүйіктіңізге айналмаңыз",good
30188,рт ахаха,good
30189,"rt қазір дәмді тағамдар сатып алды, енді телекеңді көріңіз",good
30190,"Менің компьютерімде папа бар, оны жүктеу мағынасы бар",good
30191,Дже телефондағы қағаз нұсқауларын оқып шығу үшін тағы бір екінші белгі жібергені үшін минус алды,good
30192,"әрқашан өзара резеңке тартпаңыз, үлкенірек өлшемді сатып алыңыз",good
30193,"Бүгін мен 9 тәттіге тәттілермен өзімді бүлдіремін, рахмет жаным",good
30194,бұл мені жай ғана су басқан,good
30195,"3 рет қаралды, бірақ сіз мен білетіндердің алғашқысыз",good
30196,"rt Мен бар күшімді саламын, сізді көргеніме қуаныштымын",good
30197,"rt өте суық, бірақ әдемі",good
30198,"rt табиғи түрде Кішкентай Ресеймен, Беларуссиямен, бірақ Севастополь туралы және кешіріңіз, сіз сұрамауыңыз керек, бірақ КСРО мен үкісіз",good
30199,және белгісіз d-ден басқа ешқандай шектеулер жоқ,good
30200,RT келли мен допинг ұлудың артынан жүреді,good
30201,олар iPhone-ды екі-үш рет зарядтай алады,good
