Num,Review,Review_type
33750,как же посмотреть бразильцев с испанцами хочется но бля в час ночи начало,bad
33751,"Мен де орташа тамақтанамын, мен өте нашар оқимын және өте жалқаумын, сонымен бірге рокты өте аз адамдар біледі.",bad
33752,"өмірде нағыз алғыссыздар кездеседі, сендер жақсы істер жасауға көмектесуге тырысып, өздеріңнің сырларыңа арнайтын достар табасың, содан кейін олар сенің бетіңе түкіреді",bad
33753,"қазір біз Ресейдің көзіне жас аламыз, мен оны жек көремін",bad
33754,"аһ, мен қаншалықты жаман парацетомол іштім, мен көп су ішіп, мұрнымды тамыздым, бірақ мен мектепке таңқаларлықтай барамын, бірақ менің тамағым неге ауырмайды",bad
33755,"сәлем, сен не істеп жүрсің қыз, сәлем",bad
33756,"және құстар сайрап жатыр, ал мен үшін көп қимылдар жасадым, ақымақ, дененің күйіне байланысты бұл құстарға мүлде тәуелді емес",bad
33757,вот и прошел мой день рождения печально как то,bad
33758,"жалпы алғанда, бәрі таңқаларлық және жақсы емес",bad
33759,"сонда біз барамыз, содан кейін біз instantfollowback тегін боламыз",bad
33760,радиолық басқарылатын тікұшақтар қайғы-мұңға 1 минут қана ұшады,bad
33761,"Блин, олар маған ұйықтауға мүмкіндік бермейді, мен ұйықтағым келеді.",bad
33762,"Мен бір әйелді кездестірдім, онымен бірге 11-сыныпта бірге курстарға бардым, есімде, сол кезде армиядан келген жігіт қуанып оралып, қазір белсенді болған",bad
33763,"ол үшін өзгерді, бірақ өкінішке орай, мен бір ерекшелігін өзгерте алмаймын, қанша жыл тырыссам да, өзімді сол үшін жек көремін",bad
33764,а мы опять будем писать сочинение как я провел лето на четырех языках,bad
33765,"жауапсыз махаббат сен бірсің, ал ол бір фф ру",bad
33766,и как я встану сегодня утром на тренеровку,bad
33767,"иә, бір адам қоңырау шалып, үндемейтінін айтты",bad
33768,вот этот шоколад с перцем и лимоном определенно лучшее что когда либо случалось в моей жизни теперь никакой другой есть не смогу увы,bad
33769,"егер бұл үйде мектеп оқушысының суреті бар болса, онда объектілер тізімінде сызғыш жоқ, содан кейін қайда бар ма екен деп ойладым",bad
33770,я сегодня заебался начальник хотел чтобы я заебался я его приказ выполнил,bad
33771,"блииин, мен сені қалай сағынамын, әсіресе кешке, қандай да бір себептермен түнге жақын, мен саған қоңырау шалғым келеді",bad
33772,қарғыс атқан бұл менікі екеніне сенімді болдым,bad
33773,"қалай суық болдым, әсіресе қыздырылмаған қолымның аяғы жылытуды жақсырақ қалар еді",bad
33774,"Мамыр айында және поляктар бізді рейтингке сәйкес жасайды, бұл Linux-пен бізбен бірге",bad
33775,шыдай алмады және арманы орындалған жоғары парақпен вики ашты,bad
33776,больше всего боюсь устать ходить ведь у меня сапоги на каблуке а удобной обуви нет,bad
33777,"ұйқым келеді, бірақ ұйықтай алмаймын",bad
33778,rt я люблю кадетство там такие крутые парни и им по пятнадцать где крутые парни в мои 15,bad
33779,"rt химия 1-ші сабақ, егер ол мені тақтаға шақырса, мен қайтадан өліп қаламын және 2-ші есептерде пздцтер пайда болады деп қалай қорқамын",bad
33780,"Хабарламаны оқыдым, қазір таңнан бері жылаймын",bad
33781,"Мен бүгін де фотосурет салғым келді, бірақ нәтиже шықпады, дүкенде қосалқы бөлшектер сатылатын дүкенді көрдім, онда визордың үстінде жартысы бар",bad
33782,"rt ugnich, постты поликке қою үшін нені басу керек, сонда кастондар да көрінуі керек, әйтпесе сенің бұл безеуді ешкім қолданбайды",bad
33783,тағы да осы оқиғалар ұшақтармен,bad
33784,"Мен бір жігітпен кездестім, менің көшірмем, бірақ бір аптадан кейін ол армияға кетеді",bad
33785,rt бізде көп нәрсе болды және ештеңе қалмады,bad
33786,и не хочется спать night clock three nosleep bad с лазо st дом 3 кв 59,bad
33787,Вербицкий өзінің ұстамдылығымен әлі де Ресейден кейін келе жатқан сияқты,bad
33788,зейнеткер қазір сізбен қалай байланысуға болады,bad
33789,"Мен Логикада жұмыс істедім, музыканы жаздым, телефонға қол жеткіздім және ноутбугымның қалай істен шыққанын, монитор бұралып істемеді",bad
33790,rt-ге байланысты дәлелдерім таусыла бастады,bad
33791,"және бәрі мені 8 ұйықтауға мәжбүр етті, мүмкін мен сенімен ұйқымды бөлісемін",bad
33792,"келесіде тұтқынды көру үшін, бірақ бүгін емес",bad
33793,"бұл қыс жаз сияқты, тек суық және айқын емес",bad
33794,Мен кинотеатрға және Жеңіс саябағына барғым келеді,bad
33795,ол әлі күнге дейін менің онымен жазысқан хаттарымды өшіріп тастайды,bad
33796,не спроста весь этот шум невозможно играть,bad
33797,"менің жалғыз көзілдірігім сүйіктісіз қалды және линзалардың жарамдылық мерзімі өткен айда аяқталды, ал жаңаларына ақша жоқ",bad
33798,сондықтан мен иттен жаманмын,bad
33799,"Катя Чехованың жабылуымен оның сайты мен блогы, оның музыкасы қазір қай жерде тегін таратылатынын анықтады.",bad
33800,"rt, алайда мен мүлде жетістікке жете алмадым және теесто қалай илеу керектігін білмеймін",bad
33801,нарықтағы rt lafa қайтадан үлкен ақша алғысы келетін ойындар үшін аяқталды,bad
33802,"Мен осыны қараңыз, мен галкин баскімен және көк жарықпен кездесемін",bad
33803,да достаточно посмотреть на вас вместе follow,bad
33804,біз көп ұйықтаймыз,bad
33805,бәрі немқұрайды және қайғылы,bad
33806,"әрине, мен бәрін түсінемін, бірақ мен мұны еш жерде жалғыздыққа орын жоқтай етіп жасауым керек?",bad
33807,"қарғыс атқан мен 15 минутқа кешігіп қалдым, егер сен мектепте болсаң, оған айт",bad
33808,к чему я это ах да я купила кетчуп к макаронам а он не вкусный,bad
33809,мен өте маңызды нәрсені сағынған сияқтымын және шайтанды қатты жөнге салдым,bad
33810,сондықтан сіз бәріңіз қайдасыз 9,bad
33811,ноутбуктегі батарея он минутқа созылғанда нашар,bad
33812,ебля оның атын дәретханаға түсіріп жіберді,bad
33813,Маған көңіл көтеру үшін бейне ұнады 32 хомяк пакман және адам факел пакман хомяк пен адам,bad
33814,сіз түнгі жолдармен жүрдіңіз бе жалаңаяқ қыз сегізаяқ о-о,bad
33815,локальный торрент трекер снова лежит напрягает уже,bad
33816,бери первое и третье воскресенье ff follow,bad
33817,домой пришла посылка с третьим томом волчицы и двухдисковым изданием макото синкая а я в армии,bad
33818,rt барлық троллдар қабырғаларынан ht тазаланғаннан кейін сұрақтарға жауап бере алмады,bad
33819,осыдан он жыл бұрын менің ағаш шөптермен уақытымды жоғалтпаңыз,bad
33820,к сожалению такие дебаты врядли состоятся,bad
33821,"өзімнің көңілімді көтеріп, қосымшаларды бұқаралық ақпарат құралдарына сүйреп апарып тірі бағдарламалық жасақтама жоқ",bad
33822,"сіз әлі шарапты орнатуыңыз керек, ал жаңа ойындар үйлеспейді",bad
33823,"сияқты, иә, кеттік немесе сізге сызықша керек, мен сізге интонацияны түсінбедім",bad
33824,ты что то начинал говорить instantfollowback,bad
33825,я и в азбуке вкуса была тут рядом все тоже самое только в 1 раз дороже,bad
33826,м4 2 полосы обочины местами разделительная okay,bad
33827,этекет эта кагда хочится тралить лалка и пить яшку а преходется здароваца и улибаца кароч 99,bad
33828,сильно заболела 6ой час я не могу уснуть адская боль в животе,bad
33829,"Мырзалар, оған 5 мың доллар беріңіз, қандай өкінішті",bad
33830,жалпы егістік жер тежегішсіз қандай-да бір гопникке айналады,bad
33831,"бәрін қайта қарау керек, өйткені сұмдық шатастырды",bad
33832,"о, сен неге қазір жоқсың, кузьмин бақытты емес",bad
33833,"иә, сізге ұнамайтын шығар",bad
33834,"жаным, мен сені сағындым, біз сені сирек көреміз",bad
33835,менің өмірімнің ең жақсы жылдары және әлемдегі ең жаман күндердің бәрі бәрін құртты,bad
33836,"мектепте маған бір өлеңді жаттауды өтінді, есімде жоқ.",bad
33837,короче поспав за эту ночь 2 часа я не выспалась странно да едунаработу,bad
33838,"тағы да 5 батырмасы ара-тұра жұмыс істейді, дәл қазір, ол жетіспейтін нәрсе, мен оны судан емес, судан қорғаймын, бұл бірдей белгілер емес",bad
33839,Мен әлі күнге дейін телефоныма флэш-дискіні қосудың дайын шешімін іздеймін,bad
33840,біз қазірдің өзінде твиттердің тренд тақырыбындамыз,bad
33841,"күн салқын болды, оны қайталауға болмайтыны өкінішті",bad
33842,"мен және менің жақын досым бар деп ойладым, ол қатты таңданды",bad
33843,прошлого не хочу и будущего боюсь как быть,bad
33844,оның келбеті ff тым көрініп тұр,bad
33845,Джаредлето біреуге твитпен жауап берді,bad
33846,"rt nope, итеру және қою шай енді ұйықтауға көмектеспейді",bad
33847,"Біз сіздің асығыңызға қосылғымыз келмейді деп ойладым, сондықтан диаспораңызды көбейтіп, славяндарды РФ-ға жібермеңіз, бұл біз үшін емес",bad
33848,сот күні ертең дипломмен келді,bad
33849,уже какой день левая рука ужасно ноет я чувствую что там что то не так там внутри очень больно,bad
33850,Анна маған сен туралы айтты,bad
33851,rt моя молодость кажется проходит зря я никогда не играла ни в одной самопальной рок группе беда беда надо исправлять,bad
33852,менің үш гигагерцтік процессорларым терабайт жадының гигабайттық бұрандалары және менің жаным супер марионы қажет етеді,bad
33853,"rt бәрінің екінші жартысы бар, тіпті Олегте шай бар, мен жалғызбын",bad
33854,"сен мені лақтырдың, содан кейін мен олармен сөйлескім келді, жарайды, қош бол қызанақ 3",bad
33855,как же спокойно на душе что он здесь уже жаль что всего на три дня и понедельник опять меня ждет одиночество,bad
33856,"Анди картрайт доминоны сөгіп алды, мен мұңайдым",bad
33857,"rt менің ойымша, біреуде құпия команда бар",bad
33858,украина не россия т е терпеть самоуправства не станет народ против и это выражает в россии только на кухне протестуют,bad
33859,"Мені 21 жаста, мен Карелия мен Сахалиннен басқа жерде болмағандықтан қысады",bad
33860,фабрика жабайы шөптердің альбомы әр түрлі рапидтерден қайда кетті және олар сияқты басқалары файл жойылды,bad
33861,надо свое хозяйство в деревне легче прожить если эта вакханалия не остановится то будут кранты у кого нет много бабла,bad
33862,ұзақ уақытқа созылған қатынастар және бес минут ішінде бәрін жойды ru ff,bad
33863,"Менің ескі достығым есімде еді, ол өте керемет еді, бірақ қазір бұл ұят",bad
33864,"rt Мен түнде сурет салғанды ​​ұнатамын, неге университет түнде ашық емес, мен келіп сурет салуды бітірер едім",bad
33865,хуже травмы левой ноги для меня может быть только отражение мяча этой частью ноги никак не приду в себя,bad
33866,"бірінші құраманың ашылуы керемет, оны тіпті IMHO ашылуы деп атауға болмайды",bad
33867,rt виджеттері nokia-да мен үшін twitter-де қызық жоқ,bad
33868,"және егер маған 11 3 қажет болмаса, бәрі жақсы болар еді",bad
33869,rt завтра я опять останусь без инета буду по вам скучать,bad
33870,я не боюсь сейчас об этом рассказывать ru ff ff ru,bad
33871,заслуживать доверие нужно годами а проепать его можно на 1 минуту,bad
33872,"екі минуттың ішінде мен арманыма жете алмадым, егер біреу оны бұзса, ол менің өмірімді тез және жылдам басқара бастайды",bad
33873,"Мен саған ілінетін кез-келген қаншыны өлтіремін, бірақ сен ілінетінді өлтіре алмаймын",bad
33874,rt ноутбуктің температурасын 3-тен тыс үнемі қалай ыстық болатындай етіп төмендетуге болады,bad
33875,"онымен емес, бізбен нашар сөйлесетіндігіңіз тітіркендіреді",bad
33876,сіз онымен ертең таңертең жауап қайтарасыз,bad
33877,"үшінші аптада эстон элисасының сүйкімді жігіттері қатты сұмдықты, олар мені интернетті сүйреді",bad
33878,Сілтемелер консолінің шолушысы Четоға ұнамады,bad
33879,rt пилять если это неподетски,bad
33880,"қарғыс атсын, бұл жұмыста қаншалықты маңызды, шоғырлану күні бойы айқайлайды, пәтердегі мысық жұмысы мүлдем жүрмейді",bad
33881,"сіз адамдардан қаншалықты жиі көңілі қаласыз, бақытты емес, бірақ бұл орын алады",bad
33882,"эх мен ыстық тамақты жек көремін, енді ол суығанша күтіңіз",bad
33883,я этис года 4 занимаюсь,bad
33884,"Зертхананың екі қызметкерінің түтінінің иісі мені қатты мазалайтын, олар мүлдем кеуіп кетпейді",bad
33885,дааа не ставится на замостить,bad
33886,для счастья мне не хватает внимания любви и уважения я много прошу,bad
33887,менің университетімнің веб-сайтында кестеден басқа барлық нәрсе бар немесе мен оны көрмеймін,bad
33888,раньше мама говорила мне не режь сама себе волосы счастье отрежешь теперь ни длинных волос ни счастья,bad
33889,сегодня четвертной дикант по русскому 9,bad
33890,love you я ого а не поздно ли ты мне это говоришь он это моя сестра писала пп,bad
33891,"иә, сондықтан мен жігіттің бетіндегі барлық таныс истериканы есіме түсірдім",bad
33892,эх кузьма вот так вляпаешься и на всю жизнь,bad
33893,поженитесь пока еще не слишком поздно teamfollowback,bad
33894,еще и свечка любимая вся прогрела завтра поедем новую покупать,bad
33895,алмұрт құрттың мылқауымен салыстырғанда екі есе қоректік болады,bad
33896,"кейбір хабарлама пакеттерін орнатқаннан кейін, бәрін қалай қайтаруға болатын жексұрын гном",bad
33897,"құрметті топ мүшелері, егер сіз аву жасасаңыз, баннер жасаңыз",bad
33898,"құрметті топ мүшелері, егер сіз аву жасасаңыз, баннер жасаңыз",bad
33899,интересно сколько уже чашек кофе я выжрал за сегодняшний день о о,bad
33900,обновил за каким то лешим surf теперь не работает простоплеер,bad
33901,"Мен бүгін лекцияға келдім, жақсы ұйықтамадым, таңғы асты жаман іштім, бірақ нафика мен түсінбедім",bad
33902,"ол оны итеріп жіберді, ол ер адам, қысқасы ол басталды",bad
33903,rt ақымақ мәселелер мүлдем шешілгісі келмейді,bad
33904,а считает меня мертвым и наверное поэтому меня не реплаит,bad
33905,біз мейрамханадан шыққан кезде қолайсыз сәтте жаңбыр жауды,bad
33906,"сыныптастар арасындағы менің беделім нөлге тең, олар менімен бірге ішкілері келмейді",bad
33907,Мен instantfollowback ff ru туралы бұрын ойланбағаныма сене алмаймын,bad
33908,"Мен демобилизациялау шляпасын таптым, ол белбеу етік, көгеру мен іш әйел шығарды",bad
33909,настя не дала мне сфотографироваться с воробьевым и малаховым,bad
33910,нам без мамы плохо нам без мамы скучно,bad
33911,"rt 37-де жұмыста емес, үйде болу керек",bad
33912,янусь убери защищенные твитты я не могу тебя ретвиттить,bad
33913,rt бәрі қорқынышты,bad
33914,хочу чтоб меня любили но я не заслуживаю этого,bad
33915,қалайы болса керек,bad
33916,так всегда перед сном,bad
33917,rt педивикию какие то импотенты делают иначе почему в статье вот об этом настолько уебищная фотография,bad
33918,rt не могу научит убунту мерить температуру проца я лох,bad
33919,бірақ сен мұны мен үшін жасамадың.,bad
33920,"rt серуендеуге шыққысы келеді, бірақ бәрі суық дейді",bad
33921,Мен сүйіктімнен жақсы түнсіз ұйықтай алмаймын,bad
33922,instantfollowback ff ru жасай алмайтын ештеңе жоқ,bad
33923,1 пункт зачета проработан осталось еще 6,bad
33924,"ең жаманы шындық болып шықты, көңіл айтамын",bad
33925,"rt өзінің сүйіспеншілігін дәлелдеуге дайын, бірақ ол бекер өкінішті",bad
33926,"Денис Ричи 9 қазанда қайтыс болды, мен дәл қазір ұлы адамның шайтанының адасқанын білдім",bad
33927,да сел я каталог книг составлять за полтора часа 49 книг и это только начало и ведь стивенсона не хватает одного тома обидно,bad
33928,Кешегі кенеттен сөнгендіктен офигенские жорық менің барлық туберкулезді бұрандасымды жанып кетті,bad
33929,черт дернул с семи до девяти спать здравствуй безсонная зимняя ночка,bad
33930,читаю в ночи значение родинок и это все правда все почти до единой мелочи и у меня так много созвездий,bad
33931,rt ресейліктердің көпшілігі әлі күнге дейін бір нәрсеге қысылған компьютер арқылы Интернетке кіреді,bad
33932,"1984 оқуды аяқтау қаншалықты қиын болғанымен, мен бәріне кеңес беремін",bad
33933,үш сағат бойы оны еске алған жастық шақпен еске алды,bad
33934,"иә, мен доллардың векселін жоғары-төмен қарадым, жоспар туралы сөз жоқ, тағы кім болды",bad
33935,"түзетушіде немесе маған бірдеңе болды, бірақ бұлай жұмыс істеу мүмкін емес",bad
