Num,Review,Review_type
64088,жаңа ғана мектептен келдім құдай шаршадым,bad
64089,"Мен максимумды қатты сағындым, бірақ қалай болғанда да мен өзімнен бұрын ойламаймын",bad
64090,"біздің мектептен rt түстен кейін кішкентайдай автобустан түсіп, жолмен өтіп бара жатқан машина жүріп бара жатты, бірақ ол қарамады",bad
64091,"бүкіл жаттығу коллапсқа ұласты, қыздар кеудесін спорттық шыңға қатты қысқан қыз келді, мен зейінімді жоғалттым",bad
64092,"rt дегенмен, сенің бір жерде екеніңді білу және дауысыңды естігеніңді сезе алмау қаншалықты қатал",bad
64093,"ye6 мастят қарғыс атсын, бұл пионерлер мені ауыртып алды",bad
64094,"иә, бізде екі сабақ жоқ, бірақ біз 7 сабақтың алдындамыз",bad
64095,"мен сияқты емес, ол әр секунд сайын жүреді",bad
64096,әрдайым бір жерден еститін ең қайғылы нәрсе,bad
64097,жақында бәрі қалпына келтіріледі,bad
64098,"бүгін Дорианның менің сүйікті құрамым болды, бірақ мен қайтадан жасай алмаймын",bad
64099,"Бұл менің қайғы-қасіретке толы болғаным, мен 2 жыл бұрын соңғы рет Алиді таңдандырған едім.",bad
64100,ертең мен тек жаттығуға барамын,bad
64101,Мен лалкадан фуфуфу мектебін білмеймін,bad
64102,Менде желшешек болмағаны мені шатастырды,bad
64103,"ертең ебля бурсаға бар, мен қаламаймын",bad
64104,"ебля телефон жөнделіп жатыр, мен қазір жұппен не істеп жүрмін?",bad
64105,"иә, бір нәрсе Варттың екі партиясын бұза бастады",bad
64106,rt Менде жел шешегі болмағаны мені шатастырды,bad
64107,"көп ұзамай олардың бірнешеуі айналып өтеді, оны кеш болғанша тоқтату керек, әйтпесе бәрі сөгіліп кетеді",bad
64108,"мектепте көңілді бұло vs1м жымиды, енді үйде ол жүзін көрсетті",bad
64109,"Мен курста отырмын, мұғалім егер мен теңсіздікті шешпесем, мен төрттен 2-ге жетемін деді",bad
64110,"қарғыс атсын ертең 7 сабақ сұмдық плюс ағылшын, сосын trenia",bad
64111,"Лоик - бұл мектеп ішіндегі ең сыдырғы, ал гимназияның спамынан айырылған Калмыкова емес, жақсы спам",bad
64112,"уақыттың тез зымырап өтетіні соншалық, менде уақыт жоқ",bad
64113,"rt қалай туған күніңе қонақтардың көңілін аулауға болады, не туралы сөйлесуге болады",bad
64114,"жоқ, тек техносиладан тыс",bad
64115,rt dima өзіне жақсы адам бола алмадым деп ұялып қайырылды,bad
64116,Менің миым қайнап жатқанын сеземін,bad
64117,дұрыс емес уақытта ауырып қалды гт лт,bad
64118,"5 теорияны жазған сияқты, бірақ тағы 2 теория және қарыздың бес практикасы",bad
64119,менің қыздарым ертең,bad
64120,"Жақын адамыңыз сізді себепсіз ренжіткенде, мен жылаудан шаршадым",bad
64121,"Байқаңыз, бірақ біз біртұтас екенімізді ұмытпаңыз, сіз біздің артымыздан жүрмеуіңіз мүмкін, бірақ бізді тек бір твит арқылы қуантыңыз",bad
64122,Мен сенімен сүйікті шаштарыммен бөліскім келмейді,bad
64123,"егер қоян бүгін келмесе, қайғы болады",bad
64124,"Мен анамнан жоқ дегенде байқауды тексеруді сұрадым, ол мені жіберді",bad
64125,көп рахмет,bad
64126,"қарғыс атсын ертең линзалар киюге тура келеді, мен әдетімнен шыққанмын",bad
64127,мм 9 schA көз жасына келеді,bad
64128,менің салмағым орындықта қалыпты жатуға жеткіліксіз,bad
64129,"бәрі, бәрі, бәрі мен бүгін тыңдамайтын радионы тыңдайды",bad
64130,"егер ол өлген болса, сіз оған қалай қарсылас бола аласыз?",bad
64131,"мен туралы армандаған кезде, сіз екеуміз құшақтасып, содан кейін мені арқама апардыңыз хд Мен тасбақамын",bad
64132,маған әлі ешкім ғашық болған жоқ,bad
64133,"Мен мұнда дүйсенбіге дейін келмеймін, спойлерлер",bad
64134,Мен сенбіде тағы бір іс-шараға барамын,bad
64135,"Күнделікті ештеңе оқуға уақытым жоқ, мен өзімді төмендетіп, кітаптан қол үзіп қаламын",bad
64136,"rt Мен сүйікті Twitter-дің онымен күнделікті байланысқанын қалаймын, мен оны өзіме аламын.",bad
64137,"Бұл қоқыс шашқа да лопуха, оны түнге қалдырады, сонда ол жуғаннан кейін пайдасы болмайды",bad
64138,"Шағымдар банктің біреуінің әкімшілігінің лицензияны алып тастаған кезде, несиелер бойынша қызмет көрсетілмегендігі туралы болатынын көрдім",bad
64139,Чех мұғалімі қазір менің сабыным гейлерді аватарлардан тазартуға мәжбүр болатынын біледі,bad
64140,Олар менің диванымды жүктеп жатқан кезде мен терезеге қарап отырамын,bad
64141,кейде менің синуситім қорқынышты болып көрінеді,bad
64142,Менде сұмдықты жалғыз толтыратындай сезім бар,bad
64143,иә ештеңе тек ертең бақылау және тексеру емес,bad
64144,rt dima өзіне жақсы адам бола алмадым деп ұялып қайырылды,bad
64145,"Мен сенемін, бірақ сен меніңше, сен үйде сақал емессің, мүмкін біз кездесеміз, мен тамақ ішуім керек, қарда серуендеп, жата берейік",bad
64146,"бірақ қақпаларды кеудемен жауып қою керек, сол сияқты шелмет қысым жасайды",bad
64147,Менде жаңа жылға керемет сыйлық болмай ма?,bad
64148,"ертеңгі күн ондай қиын емес, мен ұйықтағым келеді",bad
64149,"өкінішке орай, фикамен бәрі жаман болды, және осында қалады, ал Лариса көмектеспейді",bad
64150,бесінші iPhone-дан қосымша ақы алатын балалар,bad
64151,"Сіздің ойыңызша сіз қан мен асқазанның барлық ауруларын, кейбіреулері, осы ішкі аурулар клиникасын шатастырдыңыз",bad
64152,"қазірдің өзінде 17 желтоқсанда, және жаңа жылдық көңіл-күй жоқ және күтілмейді, дегенмен мен үшін желтоқсанның ортасы іс жүзінде демалыс болды",bad
64153,"мен көшеде жалғыз келе жаттым, мені хачи ұрып тастауы мүмкін еді, өйткені бұл барановичи стилі",bad
64154,"Мен өзімді білмеймін, мүмкін біреу қателескен шығар, мен шынымен де үміттенемін, өйткені мен өзімнің үштігіммен қоштасқаннан аман қалмаймын",bad
64155,Карма мені ешқашан мұндай қатал жазалаған емес,bad
64156,еревдмээр швв ым амтан харахаар,bad
64157,"бұл дәл қазір капетс, мен үш сабақты көп болу үшін отырамын және барлық сабақтарды білемін, иә, мен кереметпін, және барлығы 4 күн бұрын баға қойылады",bad
64158,сондықтан бүгінде сізден ешқандай жаман пиғыл болған жоқ,bad
64159,сүндетке отырғызу үшін кінәлі болмаңыз,bad
64160,"менің денем - қандай-да бір здецтер, содан кейін температура 2 күн, содан кейін асқазан бас тартады, мен демалыс күнін аламын",bad
64161,"АҚШ-та өмір сүруге барудың мүмкіндігі көп емес шығар, мен бұзылып жатырмын",bad
64162,өмір күн сайын мен жазбайтын күнәкарды кешіретін кезде ауырсыну болады,bad
64163,мен алты айдан бері келмегендей сезінемін,bad
64164,өйткені олар маған ұнамайды,bad
64165,Альфабанк Тх содан кейін жұмыс істеп жатқанын және оны қайта шеше алмайтынын жазды,bad
64166,"Мен бақытты болғым келеді, бірақ 12-өлең маған мүмкіндік бермейді",bad
64167,"Менің покотся қояндарымды киіп көрдім, мен 2-ші жылдағы коньки мұз айдынына барғым келеді, мен болған емеспін",bad
64168,"меніңше, олар ашуланшақ емес, олар 16 лимон ізбасарларын елестете алмайды және барлығы өздерінің үш рубльін салғысы келеді",bad
64169,Мен коктейльді көйлек көрсетпеу үшін серуендеу арқылы ауырып қаламын,bad
64170,Мен кептелісте тұру уақытын мүлдем ұмыттым,bad
64171,"менің жаным ауырып жатыр, енді сауығып кет",bad
64172,3 күнде менің киискам Германияның қайғысына ұшады,bad
64173,"Мен бүгін iPhone-ды ұрладым, енді мен инстинктке қалыпты фотосуреттерді қоя алмаймын, мен мұңайдым, экранды өзгерту керек",bad
64174,Дүкендерде әлі ештеңе жоқ екеніне қуаныштымын,bad
64175,неге барлық ұрандар жарысқа қатысқан жоқ,bad
64176,"иә, мен 38 жасқа толмаған жерде жоғары температурамен ауырдым",bad
64177,артефактіні қарау компьютерге байланысты ертеңге қалдырылуы керек,bad
64178,"иә, сүйіктім, бірақ менде үштікті қалтамда қалдыру болды",bad
64179,сонымен қатар менің кеудемдегі мұңда минус 4 кг және минус 1 өлшем бар,bad
64180,"Иә, кеше болды, жарайды",bad
64181,"Мен гма көремін, олар клип көрсетпейді",bad
64182,айыыыыыыыыыыыыыыыыыыыыыыыыыыыыыыыыыыыыыыыыыыыыыыыыыыыыыыыыыыыыыыыыыыыыыыыыыыиыыыыыыыыыыыыыыыыыыыыыыыыыыыыыыыыыыыыыыыыыыыыы?,bad
64183,"хна, менің аниме қыздарым пичалканы аудармайды",bad
64184,осылай бәрі сізді сындырғанша бәрі әрқашан жақсы,bad
64185,"суды өшіру үшін қатты ашуландым, бір нәрсе менің ертеңгі демалыс күнімді үнемдейді",bad
64186,"Ия, бүгін күн онша көп болған жоқ, бізде көпірде көлік апат болды, оның ішінде 4 адам болды, оның 3-і қайтыс болды, мен оларға өте өкінемін",bad
64187,rt сенімен менімен хат жазысудың басында мені қалай жақсы көретіндігіңді білді,bad
64188,"минустағы көңіл-күй, егер сенің көңіл-күйің жақсы болса, мен қасаңдық заңын айтқым келеді, содан кейін оны біреу бұзады",bad
64189,мдаа кедей ник жігіттер ақыры ешкілер қарғыс атқан нәрсені түсінбейді,bad
64190,тәкаппар адамдарға шыдамдылық таныту мағынасыз,bad
64191,"Мен кешкі сағат алты шамасында таңғы асты жек көремін, өйткені мен не жейтініме және қайтадан қанша жегеніме қарамаймын",bad
64192,"сондықтан сіз өзіңіздің батпағыңызда жалғыз өсіп, қышқылдануға мәжбүр боласыз",bad
64193,rt сондықтан мен Okda-ны сағындым,bad
64194,"Мен аламын, бірақ бәрібір ұйықтағым келеді",bad
64195,"мені құшақтаңыз, мен өте жалғызбын",bad
64196,"Ахуенна жаттығуы мен сындым, бірақ менің иығым, аяғым мен саусағым ауырады",bad
64197,"Бұрын таэквондо жасайтын және өнер мектебінде оқитын, бірақ қазір уақыт жоқ",bad
64198,Мен ВК сияқты смайликтермен олармен бірге Twitter мен Instagram-да жазғанын қалаймын,bad
64199,"Күні бойы мұндай жағдай өте қорқынышты, мен ұйықтағым келеді, мен өзімді ауыртып сезінемін",bad
64200,"менің көзімді суретке түсіру инста емес, сіз менің қиындықтарымды көре алмайсыз",bad
64201,"неге мен ақылдымын, мен сияқты көптеген адамдар, ал сен мен болуға тиіс емеспін, тек маған бұл өте қорлықты деп айт",bad
64202,"достарымен баяғыда мен полиция қызметкері боламын деп ішкі істер министрлігінің академиясына оқуға түстім, енді мен ондай ұрыспаймын",bad
64203,"rt Мен бұл үшін дұрыс күштер одағының алдында өз формамды жоғалтып, салмақ жоғалтып жатырмын, қазір менің тістерім күресіп жатыр және мен емделіп жатқан сияқтымын",bad
64204,"rt Мен бұл үшін дұрыс күштер одағының алдында өз формамды жоғалтып, салмақ жоғалтып жатырмын, қазір менің тістерім күресіп жатыр және мен емделіп жатқан сияқтымын",bad
64205,"жаңа жылда екі аптадан кейін мен оны қайда, кіммен болса да кез-келген жағдайда кездестіретінімді білмеймін",bad
64206,"rt Мен бұл үшін дұрыс күштер одағының алдында өз формамды жоғалтып, салмақ жоғалтып жатырмын, қазір менің тістерім күресіп жатыр және мен емделіп жатқан сияқтымын",bad
64207,Әйелдер рульге ие бола алмай 3 бала қайтыс болды,bad
64208,rt және мамыр айына дейін моленада қайтадан тыйым салынды,bad
64209,аз айтылды және көрсетілді,bad
64210,"нормалар еденге жылы, бірақ өте аз жатады",bad
64211,ттттттттттттттттт өмір өмірі,bad
64212,"және сіз тек жұмыртқалар бізден гөрі салқын деп айтпайсыз және сіз салоидтар айтпайсыз және жазбайсыз, енді біз ешқашан бір-бірімізді көрмейміз",bad
64213,"ахх кешіріңіз, жарайды, сіз әлі шарықтау шегін көресіз, бірақ ол неге Джуберден кетіп бара жатыр?",bad
64214,"иә, менің ойымша, мен тек матаннан үміттенемін",bad
64215,"Раскольниковтың адамгершілігі мен шайнауы мүлде есімде жоқ деп ойладым, хм",bad
64216,Даша мені тренажермен екінші рет лақтырды,bad
64217,екі аптаның ішінде теледидарды бірінші рет қосқан мен бірден мағынасыздық болды,bad
64218,"менің анамның туған күнін тойлайтын бұл компания тек әйелдер, өйткені ер адамдар ешкіммен ішуге бармады",bad
64219,сен ерніңді айналдырдың,bad
64220,егер мен сені теуіп жатсам,bad
64221,және менде соңғы серия,bad
64222,"Мен үшін бұл соншалықты жаман болады деп ойлаған жоқпын, өйткені мен оны қатты жақсы көрдім, ал қазір ол жоқ",bad
64223,Тағы да полицейлер стерва қоқыстағы ақшаны қайтадан тоқтатты,bad
64224,ол жалпы уақыттан кейін алдайды,bad
64225,"менің үмітсіздігім шарықтау шегіне жетті, мен өзімді дәрісте қалай өлтіруге болатынын білдім, бірақ Google маған кеңес бермеді",bad
64226,маған қайғылы смайликті лақтыруға рұқсат етіңіз,bad
64227,тек биология жыл соңындағы барлығын жоспарлы түрде жаңартқысы келмейді,bad
64228,маған қайғылы смайликті лақтыруға рұқсат етіңіз,bad
64229,"Мен оны бүгінге дейін біліп алар едім, бізге алдын-ала айтқан болатын, бірақ соңғы күні мен үйрене бастадым және нифиганы үйренбедім",bad
64230,Мен мектепте шаршадым.,bad
64231,"менің иегім кішкентай пздтс тісіме кірді, қазір жаттығуда аузымды жауып тастай алмаймын мб сəлем инъекциялар",bad
64232,"мұндай дауыс қайтыс болды, бұл оның көмегімен керемет",bad
64233,кедей күшік оған не керек мммммм,bad
64234,getwell жақын арада getwellsoonluhan rt lukhanchik oppa,bad
64235,Сіз бас киімді таппадыңыз деп үміттенемін,bad
64236,"неге сен маладсың, мен оның бір бөлігін жасай алмаймын",bad
64237,"кәсіби велосипедшілер аяқтарын қырады, менің әлемім бұрынғыдай болмайды",bad
64238,"Мамыр емес, көшедегі трамвай толы",bad
64239,"мен қалаймын, Мәскеуден басқа, мен Германияда 11 жыл бұрын болғанмын, бірақ мен оны әскери комиссариатқа байланысты жасамаймын",bad
64240,"Осы тоқсанның соңғы екі аптасында мен не сезінемін, қиын болады",bad
64241,Бүгін маған сендер мен біздер тек тамақ жағынан ғана ұқсаймыз деді,bad
64242,тағы да әуежай галереясына итермелеген ессіз жанкүйерлер getwellsoonluhan,bad
64243,"спортшы, мен жалпы жалқау есекпін",bad
64244,"қысқасы, твиттер өшпейді",bad
64245,"иә, мен өзім әлі түсінбедім",bad
64246,"Мен өзімді жудым, компьютеріме келдім, және қоңыздар боты 4 хабарлама жинады",bad
64247,"қазір мектепте болып жатқан жағдайға қарамастан, мен кеткім келмейді",bad
64248,мұнда ASM инстада оқитын болады және біз боксты айналып өтуге визуалды негіз болып табылады,bad
64249,rt бүркітші - бұл сіз мәңгілікке ауырғыңыз келетін ауру,bad
64250,ол қарғыс атқандай көрінеді және түтік алмайды,bad
64251,"безгегі, мен сенімен сөйлескім келеді, бірақ мен азап шегемін",bad
64252,күн сайынғы әдеттегідей,bad
64253,"және менің гарнитурам кеше сынды, енді кешке скайпсыз ұқсас затты қайдан алуға болатындығы өте скучно болады",bad
64254,сені қатты сағындым мен сені сағындым,bad
64255,"сондықтан ұялатынмын, мен жақсы едім, бірақ геометрия мен ағылшын тілі мені сындырды, содан кейін басқа пәндер байланыстырылды",bad
64256,"Жақындарыммен бірге түнеу үшін серуендегім келеді, бірақ бұл кезде болмайды",bad
64257,iif-тен соңғы сурет,bad
64258,бұл ақымақ тесттер сізге алдағы мерекенің барлық қуанышын сезінуге мүмкіндік бермейді,bad
64259,Қазір Интернет жылдамдығы өте баяу,bad
64260,"rt бүгін менің сүйікті құрамым Дориан болды, бірақ мен қайтадан жасай алмаймын",bad
64261,ipod-тан ретвит жасады,bad
64262,ия сен мені қолдауың керек,bad
64263,"Мен әдетте интернетте оған кіре бермеймін, барлығы танымал және өзін-өзі мақтайды",bad
64264,"о, менің арқам тағы ауырады, не",bad
64265,rt Мен оларға жете алмаймын,bad
64266,"жарайды линочка, мен тапсырыс алу үшін апайға бардым",bad
64267,бұл Газпромның жолымен немесе күнкөрісіне сәйкес бәрі сияқты,bad
64268,"pfff 4 настя деген не, біздің сыныпта 7 о болды, мен де настя",bad
64269,rt жақсы,bad
64270,"Мен ательеден спорттық юбкаға тапсырыс бергім келеді, ол туралы менде әлі жаман түсінік бар",bad
64271,"Ағымдағы тапқыр қыздарым бар деп ойладым, теледидар оқымаймын",bad
64272,rt менің досым қысқы аяқ киім болып шықты 9 9 сука пздтс,bad
64273,Маған бұл сессия мега-бут деп айтпаңыз,bad
64274,неге мені 15 минуттай далаға шығаруға рұқсат бере алмайсың?,bad
64275,rt Келіңіздер келіңіздер мені өтінемін,bad
64276,"болашақта ер адамдар туылмаса, біздің елде не болады",bad
64277,ол неге сонда болды?,bad
64278,бүгін омарташы не туралы айтқанын мен жақсы себептермен жіберіп алдым,bad
64279,бейне үшін жылау,bad
64280,арамдықты дәлелдеу аспазшы үшін өте өкінішті,bad
64281,әлі күнге дейін есімнен танған верох бар,bad
