Num,Review,Review_type
32361,я попала в такой снегопад сказочный настроение сразу новогоднее хочется творить добро,good
32362,Лениннің ескерткіштерін Коммунистік партияның жақын аймақтық комитеттеріне мұқият ауыстырыңыз,good
32363,оның келуіне дейін антдот Ресейде Олимпиада алауы тек жыныстық қатынас арқылы берілмеген,good
32364,"Клэйр Дэйнс көзді елең еткізе білгені үшін Отандағы рөлге бірден мақұлданды деген ой бар, бірақ тұтастай алғанда ол",good
32365,"Менде шаңғы бар, 75 мм",good
32366,61 күннен кейін Сочидегі Қысқы Олимпиада ойындарының ашылуына менімен бірге жабылуға 2 билет ұсынылды,good
32367,"сізде джупада бір нәрсе бар екенін, мен бірдеңе түсінбеймін",good
32368,boogun arsenal kuchasidan tashkari barcha kuchalarda bayram,good
32369,rt ahah tha рахмет d,good
32370,"жақсы, мен оған ұнайтынын білмеймін d",good
32371,мені де ұста,good
32372,"ооо, біздің қауіпсіздігімізге алаңдаймыз, бірақ біз өзімізді мұртымызбен",good
32373,как вижу белое св платье представляю бухих ужасных гостей за столом х,good
32374,хм осы түнді бірге өткізуге кеңес бере аламын,good
32375,"Адайларды елестетіп көріңізші, және тұтастай алғанда кіші жүз жиналып, Бергей Рысқалиев президент болды, бұл біздің көзқарасымыз бойынша Янукович туралы",good
32376,және быланчикке не болды d,good
32377,"Павел мен оған туа біткен комментаторға айтқандарымның бәріне пікір айта бастағанда, мен оны жақсы көремін",good
32378,rt конечно же здорово они очень гармонично смотрятся и дуэт получился прекрасный,good
32379,rt fuck бұл жай шедевр 1 1111 111 11,good
32380,Маған оның футболкасы қатты ұнайды,good
32381,теперь я поняла с кого писали героя корпорации монстров майка вазовского требую деньги за авторские права,good
32382,сіз chtoli д,good
32383,шынымен жақсы болар еді xd менің ең жақсы докторым болар еді,good
32384,"Назар аударғаныңызға рақмет, мен анархист д-ны сөггім келеді d",good
32385,капееец там паренек последний слева вообще огонь,good
32386,а я переживала что эт меня какой то другой кактус читать начал и запереживала хд но теперь я спокойна тоже скучал 33,good
32387,что то кросы мне не понравились а шапку одну оставлю d,good
32388,"ахахах ертең Ярошевичпен арам жоспар құрды, оны шындыққа айналдыру ғана қалады ахахаха",good
32389,көптеген нұсқалар ұсынылады - бәрі,good
32390,валяемся и слушаем музычку,good
32391,менің фотоларыма алғашқы реакция d,good
32392,"Руслан, егер олардың жоспарлары орындалмаса, мен өзін-өзі күйдіремін деді",good
32393,"Дадада, әрине, жарайды, келіңізші, қандай үзінді болуы мүмкін, мен оны айтқан кезде анаммен қатты күлді",good
32394,"Біз шынымен де тітіркендікпін, маған ұнайтыны мен сені ақымақтар",good
32395,оуу дарлинг это вообще такой вопрос я тебя слишком люблю чтоб сраться по нему просто разные у нас взгляды,good
32396,кто то принес мне счастья в двойном размере sweet love kinder свит хоум,good
32397,"ләззат алу сәтінен ләззат алыңыз, салқын киюге берет ааа",good
32398,ладно я хочу спать всем сладких,good
32399,Алина бұйырмайды д,good
32400,rt татьяна аверьянова с днем рождения,good
32401,"rt Мен келдім, біз үш нәрсені айта аламыз, біз семіз және бақыттымыз",good
32402,"Мен бақыттымын, неміс литрі",good
32403,есть в россии традиция посидеть на дорожку на унитазе,good
32404,класно погуляли поб сились повалялись хахаха я його б льше намилила есааааа,good
32405,rt все супер мы тебя любим продолжай снимать d,good
32406,"жоқ, бәрі твиттерге жаман, ол маған бүкіл параққа фон қоймайды, сондықтан мен оны іздеп, содан кейін d madhouse таңдауым керек болды",good
32407,"сол жылы кокада кола туып, сол гризлиде жақсы ән шырқады",good
32408,"осында сіз осындай қуанышты жігіттерді жазасыз, біз қазір 25-те",good
32409,Осы аптада мен өміріміз құрайтын ұсақ-түйек нәрселерді бағалайтындығымды білдім,good
32410,"фильмде бәрі жақсы болғанда және бәрі попкорн лақтырған кезде сыныпқа кинотеатрға бардым, Лиза қайғылы сәтті тауып, жылайды мен ғана",good
32411,"rt Мен байланыстың осындай батырмасын қалаймын, ол желіде болған кезде байланыс маған бұл туралы барлық жолдармен хабарлайды хд",good
32412,"жақсы, бүгін автобуста балаға ұнады 3",good
32413,rt boobneverdie Жақсы chито Ресей тағы да өзінің сүйіктісі үшін Д.,good
32414,жалғыз мухлис м ю ютказганига узини балкдан ташлабди кейінгі тур м ю га науқас кивораман уртокларимдан хавотирдаман,good
32415,"rt - бұл ноутбуктың рюкзагына түсінетінім, барлығы 8 бакс сатып алуды ұмытпаған жөн",good
32416,"rt жылдың әндері үшін өте керемет 2 13 әрқашан алдыңғы қатарда, біз үшін сіздің сөзіңізге дауыс беру есебінен",good
32417,"жақсы, күнделікті бизнес, бірақ кез-келген жағдайда, кез-келген уақытта қарсы алыңыз",good
32418,на волосок от смерти кот грыз меня а я его чмокала,good
32419,бірінші сынып сияқты бірінші рет немесе бірінші сынып сияқты бірінші сынып қарғыс атқан мен шынымен абдырап қалдым d,good
32420,менің көрпемді алатын сенсіз мен қалаймын d,good
32421,хаха ага я была ооочень удивлена,good
32422,"rt мен сондаймын, мен сондаймын x",good
32423,вот только что сделала немного веселья p,good
32424,прогулки 7 12 13 новые знакомства,good
32425,Ленин табыттағы төңкеруге жеткілікті орынға қызығушылық танытады,good
32426,Сіздің өміріңізді өзгертетін 1 жаңа жылдық тағамдар 1 героин,good
32427,"rt uraaaa, кем дегенде, біреу жақсы, ол керемет",good
32428,ахах я понял что надо сказать поменялись но было неожиданно х,good
32429,rt привет как твои дела 3,good
32430,"менің үй тапсырмамды ағылшынша жаса, сен канадалықсың, қайдасың, канадада, Торонтода еске аласың, үй тапсырмасы жағымды болуы мүмкін",good
32431,rt және тек byaka түсінеді d тұшпара ірімшіктері ddd,good
32432,ахахах мои пошлые мысли что вы делаете ахахах прекратите,good
32433,нп флот түлкілері ақ қысқы әнұран Мен сені іздедім ааааааааааааааааа бақытты Ангар қызы Диана,good
32434,энтеромпон энтеромпон ромпон это как помпон смешное слово,good
32435,жақын арада vnaukraina IMHO Днепрінің сол жағалауында қалады,good
32436,жақсы кешіріңіз кешіріңіз кешіріңіз бірден білу қиын,good
32437,"Мен бүгін сәл ертерек кетемін, барлығыңыз, қайырлы түн және сиқырлы армандар 3 дана",good
32438,бірақ мен кешірім сұрадым және ақыр соңында жарылысымды кесіп тастадым,good
32439,"Деканға қарағанда арзанырақ болса да, мен кейде прогресті жылдамдықты аздап өзгертетін сияқтымын",good
32440,"Білмеймін, бірақ егер сіз адреске кіргенде соңғы нүктені ұзақ ұстап тұрсаңыз, онда ол өзі ru com таңдауын ұсынады және т.б.",good
32441,ааахааа мен сіздермен скайп-дд сөйлеспеймін,good
32442,посмотри в инете запись программы жена киры прашутинской с лолитой и сравни,good
32443,дәретхана сіз қоқыс тастайтын және өз еркіңізбен білім алатын университеттен гөрі жақсы d,good
32444,не спорю но только в том случае если ты видел его или хоть что то о нем знаешь,good
32445,рт ахахаха,good
32446,я люблю своих одноклассников только даши не хватает и боди,good
32447,d hachit-ке көмектесу үшін kirich,good
32448,лооооол сен данышпансың dd pfff әлі d,good
32449,как и я тебе ты вообще как давно так не общались,good
32450,ахахахахахахахахахахахахахахах біз бір бөтелке арақ пен пицца сатып алдық,good
32451,Мен жақсылықтан басқа артықшылық белгілерін білмеймін,good
32452,"сіз тағы да бәрін дұрыс түсінбедіңіз, гт лт мысық, әрине керемет, сонымен қатар шетелдік, бірақ мен мысықты айтқым келген жоқ",good
32453,всегда смотрела и буду смотреть,good
32454,rt сіз ақылды адам сияқтысыз және сіз бәрін түсінесіз,good
32455,"rt бақыт жақын жерде, оны күту немесе тіпті ұмыту ғана қалады және ол жақын арада пайда болады",good
32456,хаха және қарамаңыз маңдайыңызды қолыңызбен сындырасыз,good
32457,"Маған көбірек ұнайтыны - біз жақсы көршіміз, олармен бәрі жақсы болсын, бірақ өзіміз",good
32458,Мен dd mtvstars бір бағытта күлу үшін Jas фильміне барғым келеді,good
32459,"rt, сондықтан сіз салмақ тастай алмайсыз, сондықтан аяғыңыз салқын",good
32460,мен кетіп қалдым,good
32461,"4321 сізге триллерлерді ұнатады, бұл фильм сізге ұнады",good
32462,"oo мен байқаудан өте ескі суреттерді лақтырып тастадым, мен осы жерде отырмын",good
32463,Мен ертең жүремін ертең тек ағылшын д,good
32464,виспались ф льм поидивились нажрались все як нада,good
32465,әсіресе рикман аланрикманға,good
32466,"Саша shar1ki v1d құдайын ал, мен қарғыс аттым Саш Мен қолғап киіп алдым",good
32467,rt у укров явная задержка в развитии по сносу памятников даже тормознутее эстонцев с грузинами впрочем це европа,good
32468,менің нақты талабым бойынша сіздің президенттің отставкаға кетуі,good
32469,Коломенскоеде ірімшік тортында біз қарындасымыз Алинасиничка қорықшасы Коломенскоймен бірге жүреміз,good
32470,"rt эксперименталды жан арбалары d бұл жолы стандартты емес қастандыққа тап болды, мен саған тырысып көруге кеңес беремін",good
32471,"Құдайым, мүмкін ава Twitter-ді қоспағанда",good
32472,а если ты опять его будешь обижать то тебе крышка d,good
32473,st lopatina d 2 kv 13 d kopische borovlyansky s c Минск облысы және Беларуссия индексі 223 53 жай конвертке жазыңыз,good
32474,ақыры мен оны өзіммен бірге суретке түсіруге мәжбүрледім,good
32475,меньше знаешь крепче спишь по ходу я слишком много знаю все таки неведение счастье,good
32476,скоро день св николая и я знаю что я попрошу в подарок билет в кино на хоббита,good
32477,"rt hilma-мен бүгін телефонмен 2 рет сөйлесті, мен сені қалай сағындым",good
32478,"Twitter-де барлығы Гүлнара Каримованың соғысы туралы жазды, ал аккаунт енді ашылмайды",good
32479,"Саша сенің, мен Ресей Федерациясында тұратын шығармын, ол менің президентім емес, жалпылама",good
32480,с днем рождения глеб исполнения желаний,good
32481,"rt answer dd мұндай күйзелісті тазартушы ханым кешке қарай blabla karoch деп аталатын көрпеге оралып, көрпе деп бастайды дейді",good
32482,сколько ж меня людей беспалевно читают аж страшно хотя нет d мне все равно нравится читать мысли го,good
32483,мне оооочень повезло что когда мы переехали у меня комната была уже а вот на северном с братом тоже комнату делила,good
32484,Мен өз жағдайымнан шығудың жолын таптым d,good
32485,"Екінші телефон емес, бала үшін бір нәрсе сатып алған дұрыс",good
32486,rt сіз қай уақытта барасыз,good
32487,rt Елена жақында Ресей паспортын алады,good
32488,Саша енді қалыпты жағдайда суретке түсейік,good
32489,"ұлдар курсанттар балалық шақты бір жерде қалдырды, вахаха жастық шақты еске алды ахаха",good
32490,RT байқауының жеңімпазы,good
32491,"бұл іс жүзінде солай, бірақ менің туыстарым табылар шығар хахах",good
32492,"rt Барлығына жаңа аптаның жақсы өтуін тілеймін, тез және байқалмай өтіп кетсін",good
32493,правосуд нравится даша с чего это нет не нравится,good
32494,бірақ күлгін лак қазір менің күйімді толық көрсетеді,good
32495,во молодца разошелся все так главное сняться а там пойдет тем более что он все умеет,good
32496,dada dd және қабырғада спортпен шұғылданудың барлық түрлері және т.б. d,good
32497,және кинотеатр кеңсесінің кеңестік фильмдерден алынған романс-трагедиясы,good
32498,"Менің ойымша, бұл менің ойымда ма немесе жоқ па деп ойлаймын d",good
32499,біз дәптерлердегі қателерді пышақпен өшірдік,good
32500,Маринадан келді және бірден ағама қонаққа бару бүгін осындай қарбалас күн,good
32501,rt oooo dnipropetrovsk пьесалары салқын болады,good
32502,если есть мальчик с пальчик то почему не может быть львенка с котенка,good
32503,ұзақ уақыт бойы сіз д таппас бұрын бәрін іздедіңіз,good
32504,а у нас вот вообще не будет отечественной литературы в след семестре остался коллоквиум в четверг и экзамен в январе,good
32505,"Бүгін менің бүкіл қалада керемет көршілерім бар, барлық терезелерінде шамдар бар, неге екенін білмеймін, бірақ өте әдемі және мерекелік",good
32506,Сіз арсенал бок деп атағаныңызды айтамын,good
32507,"тіпті визуалды BASIC-те сіз мысық жаза алмайтын шығарсыз, х болып шығады",good
32508,d сабақты жіберіп алмаңыз dd менің мүмкіндігімді білемін,good
32509,рт ахахаха,good
32510,сәттілік кинолары маған өте күлкілі болды,good
32511,они есть в psn для третьей соньки и стоят не дороже новой карты памяти,good
32512,блин я наверное готова попасть туда где нужно часами разливать чай по стаканам из чайника х,good
32513,сіз онымен нақты таныс емессіз,good
32514,восхищаешься человеком ровно до того момента пока не зайдешь на страницу вк,good
32515,у нее губы не оч накрашены чувствую завтра мне не жить,good
32516,"бір сәтке маған Линкевич туралы айтқандай болып көрінді, менікі дұрыс",good
32517,жаман мысық гран-при корольдік канин,good
32518,"rt менің өмірімде сіз осы уақытқа жеткенше көп нәрсе бар, біз кофеханаға барамыз және алкогольдік ішімдік ішеміз.",good
32519,сіз үшін өмірдегі ең маңызды нәрсе кім немесе кім?,good
32520,хотел сказать что за lvp будут глорить до первого приступа бешенства суареса но вспомнил что там еще старридж есть,good
32521,нашла блять авторитет ахахаха самой не смешно малкая d,good
32522,"сіз алдымен тәртіптегі аумақта заттарды ретке келтіресіз, Украина Ресейге еліктемейді",good
32523,rt сіз жыныстық жағынан қыңырсыз d,good
32524,473 с этим твитрм я ложусь спать спокойной ночи кисы,good
32525,ну в принципе вроде ничего если человек не обидет тот,good
32526,"rt, бірақ мен сені сөгетін боламын, мен өте ақымақпын",good
32527,rt песня года 2 13 1 и 2 января во всех телевизорах страны,good
32528,видел сегодня в метро пролетела мимо меня со скоростью света даже не заметив не успел даже окликнуть сурьезная такая,good
32529,я ее фамилию коверкала и нынче она фрискас,good
32530,рт ахахаха,good
32531,и запрещать пить кофе,good
32532,rt сука ясно,good
32533,"маған ешқашан мұндай мақтау сөздерді айтқан ешкім жоқ, мен дұға айтамын ахаза",good
32534,"«Блииин Жося» капеттерінің жолы болды, мен оның жексенбідегі концертіне барамын",good
32535,rt ахахаха,good
32536,бүгін біз күні бойы орталықта жаяу жүрдік,good
32537,"әйелдерімді көтеріңіз, мен қасиетті сумен твиттерге барамын",good
32538,жалғыз мүйізі бар 2 жақсы түнгі арман лентасын алыңыз,good
32539,rt заехал к маме а тут в телевизоре кушать готовит надо даг каналы подключить дома,good
32540,"және қыста не істемекпіз, бәрі біледі деп ойлаймын",good
32541,"егер елестетіп көріңізші, егер дауыс беру әлі де жалғасуда және дириктер дауыс бермейді, онда джаз mtvstars-ты бір бағытта жеңеді",good
32542,"rt кішкене мадақтау сұрағы болатынын кім болжай алады, қанша деп болжайды",good
32543,rt Мен өз жағдайымнан шығудың жолын таптым d,good
32544,"rt Мен мұнда ер мен әйелдің достығына сенемін, мен күйеуім екеуміз ең жақын доспыз",good
32545,"басып шығарыңыз, плакат нашар",good
32546,"rt, сіз күндізгіге қарағанда кешке көбірек тамақтанғыңыз келеді d",good
32547,Лондонға оқу бағдарламасын таңдауға көмектескеніңіз үшін рахмет,good
32548,rt засрала анжеличке всю стену и довольна,good
32549,честный трейлер прометея via,good
32550,до чего же люди докатились не понимаю откуда у студента мед фака есть время придумывать такую ересь браво,good
32551,"ахахах вчора сол суретке таң қалды, кешке стериттерде мен сол вм ш айналасында жаттым",good
32552,блин валера один из самых тупых вопросов которые я видела,good
32553,"көбірек кештер шырқаңыз, тек сексуалды рэп-хдд емес, олар сізге көбірек кештер сыйлай бастайды, бірақ сіздің дауысыңыз қарлығыңды керемет дауыс",good
32554,в ла не хватает солнца пасмурно и срывается дождик саули приехал к вам и теперь погода наладится,good
32555,"бүгін Nike кресттерге кірді, сондықтан олар анық алынды",good
32556,это ac dc ты просто впускаешь их в свою жизнь и они не хотят уходить,good
32557,ахах б кірпішті қойды,good
32558,"келесі жексенбіде рахмет, біз фоторепортажды күтеміз",good
32559,бірақ ол істің толық келісетінін айтады,good
32560,"аққұба ми тырнақтарына, әрине, аққұба",good
