Num;Review;review_type
22394;в минске нереально найти док станцию vantec с поддержкой esata я в печали;good
22395;и я надеюсь что никто не помешает мне выспаться завтра;good
22396;разговаривать всю ночь с другом а потом орать что не выспалась охуенно;good
22397;у ватсапа новое оформление;good
22398;lt pre gt а не перевести ли транспорт на какую нить mongodb d lt pre gt;good
22399;нет слов прекрасный парень растет повезло тебе с братиком;good
22400;что должно быть на столе чтобы ужин удался бисак мкц флу d азаза та спасибо за мою ебанутость d;good
22401;dd я тебе говорил о том что я об этом всем думаю;good
22402;я вот думала у тебя попросить но выбрала другое;good
22403;были с ребятами на катке очень круто;good
22404;да на диспансеризацию бы вас загнать;good
22405;да ман я тоже рад был потусить все будет нужно только время и немного кэша миир;good
22406;по оформлению страницы ты мог догадаться насколько давно на нее забили;good
22407;rt я конечно не против совсем не против;good
22408;rt я вся промокла до ниточки просто зато повеселилась от души спасибо вам за вечер з;good
22409;я гениален к конференции установил на телефоне 7 разных игр точно там скучать не буду или буду здесь писать;good
22410;алилуя смыла этот пожар у меня на голове ощущения превосходны;good
22411;rt как же меня прет теперь скролл большими пальцами d;good
22412;rt украина россия народы братья навека;good
22413;у тебя такие разнообразные фото в иг и в твиттере;good
22414;дискутируем с другом из украины по поводу ес пришли к выводу что надо валить в германию или англию и создавать свою группу;good
22415;о майн готт просто лесби оргию наблюдаем мы сейчас девочки из уора жгут;good
22416;город засыпает голод просыпается помог любимке с переездом;good
22417;кто в этом году заканчивает школу выпускники откликнитесь;good
22418;смотря третью часть пилы после первых двух уже как то похуй на кишки и мясо можно спокойно кушать спагетти и лицезреть;good
22419;опять поругалась со всеми;good
22420;нет как ты такое вообще могла про меня подумать аахахаахах;good
22421;ну я не жесткая его поклоница просто моя бабушка за него в том года смс ки отправляла;good
22422;попробуй докажи что уехал из рыбинска;good
22423;да а хотела чудной получится благодарю;good
22424;суббота збс каждую субботу у меня ночует тело и выдает необдуманные фразы;good
22425;rt действительно как фотошоп d чувак спасибо что успокоил меня фуух теперь все я спокойна;good
22426;так будет лучше уже прочитан уже поставлен лайк уже затронул х великолепный фанфик спасибо;good
22427;за пятницу х;good
22428;сидим в маленькой но очень хорошей компании давно так не отдыхали очень приятный вечер;good
22429;ура да здравствуют яйца и их единомышленники;good
22430;ну нет что нибудь чего я не видел х;good
22431;нет ничего лучше для меня быть похожими на джона и анну;good
22432;мальчик милый в фильме был;good
22433;тот самый знаменитый котенок;good
22434;ну я заболел и мне завтра к врачу на выписку только он меня не выпишет ибо кашель а ты как;good
22435;саша мой был прав он всегда прав люблю его скоро увидимся надеюсь время ожидания быстро пройдет;good
22436;у мамочки сегодня день рождения я ее ооооочень сильно люблю;good
22437;если не поздно х;good
22438;пьяное я в подарках набор для бани и набор lego;good
22439;не видела я по английски пишу печатными ачительница в школе так приучила да и то не ахти с;good
22440;я помню как ты открыла сегодня дверь электрона d;good
22441;так что ребята не плодите молодых хейтеров прекратите ненавидеть rox kis;good
22442;орфография хромает на обе ноги толи пальцы кривые то ли медленные не успевают за мозгом печатать d;good
22443;оу лимон танцует танго принц лимон денис савин графиня вишня анна леонова anya leo cipollino;good
22444;оказывается мой бытовой dvdшник понимает ac3 да еще и с двумя каналами звука;good
22445;хахаха точно чтобы все еще раз оценили твою значимость и популярность private account friends only;good
22446;выкидывание старой стиралки это сложный процесс;good
22447;rt ахахах тебе однако не много времени понадобилось;good
22448;оооооооооооо да это про меня либо одеяло либо насморк;good
22449;как отличить хорошего человека от плохого все плохиши живут в аркадаке d;good
22450;пц гугловую надпись ура у вас спама нет чуть было не прочел у вас не хватает прав;good
22451;нашла себя я как то раз на сайте анжи;good
22452;ахаахахахаахха нее мы сначала квм смотрели а сейчас мама по американскому жениху угарает дом 2 уже не смотрит давно;good
22453;зашла я на кухню там посуда взяла и помыла мама меня вкусно отблагодарила сейчас придет фотка с инстаграма d;good
22454;сашаааааа урааа не зря голосовали ира счастлива;good
22455;не особо тебя поняла но как скажешь;good
22456;к данному моменту школа научила меня только одному грамотно нести ахинею;good
22457;бежали с вовой в просторе на перегонки до туалета лол блять;good
22458;8 число я люблю тебя он скора будет маленькая моя у нас месяц я люблю тебя;good
22459;купила себе шапку бомбон в которой на пол головы ахах плодотворно плодотворно съездили;good
22460;а похвалить хвалю да ты будешь просто матерью года;good
22461;нафиг вообще девушкам диеты лучше есть много но малыми порциями водички больше пить и все хорошо будет;good
22462;блиин как же я могла забыть про тебя самую главную лопату если с тобой то три но именно в этой фразе про тебя речь не шла;good
22463;леонид аркадьевич я бы хотела передать привет всем кто сегодня был с нами вы охерительные и тчк максу типо спасибо за отбитую задницу;good
22464;пол 4 утра уже а ди почти половину книги прочитала очень крутая книга;good
22465;эх все бестолковые у одного только все хорошо так это же хорошо;good
22466;rt так математика вона така особливо вишка ну зна;good
22467;хорошо так все такие мысли прекрасные все что не случается все к лучшему пусть будет так как есть я счастлива и пусть падавиться;good
22468;rt да на работе у меня тоже yuki n на десктопе;good
22469;могу поспорить ну кроме второго конечно же;good
22470;ахаха не волнуйся зайди в булочную по пути;good
22471;если чувствуешь что законы аморальны то их надо нарушать хочу нарушать;good
22472;да концовка потрясающая но все таки мне хэ нравится у них все хорошо и они счастливы они заслужили;good
22473;так то равноценный обмен я подумаю;good
22474;посмотрел первый сезон dexter пиздато мне нравится качаю дальше;good
22475;не спится что то блять так впадлу завтра смена эта утренняя;good
22476;а никто не заметил что начальник поста все время говорит увот;good
22477;за последнее время эти выходные самые лучшие хоть они еще не закончились;good
22478;всех кого хотел со всеми встретился даже несмотря на холод и нелюбимую зиму я засыпаю под теплыми эмоциями или просто я пьян р;good
22479;rt с наступающим 2stick;good
22480;и вот когда этот участник не попадает в номинацию на вылет мама говорит ну конечно я же за него голосовала;good
22481;а еще одну фотку можешь кинуть все последняя а то меня потом провалинская загнобит;good
22482;эта песня у меня на рингтоне месяц стояла очень нравилась;good
22483;до слез пересматривая его в конце рыдала всегда в конце рыдаю когда фильм зацепил такая любовь в жизни наверно такого не бывает;good
22484;это тебе спасибо надо почаще так выбираться;good
22485;ок в 16 3 в парке горько;good
22486;восторг вспомнила твой лень рождения;good
22487;саааашка приехал ко мнееее радость давноневиделись;good
22488;отличный вечере но к сушам не притронусь целую неделю теперь;good
22489;никогда не репала с эмоциями;good
22490;да конечно понимаю и да если бы а не оказалась само очарование думаю мне не удалось бы никого уговорить но она жгла;good
22491;и что мне делать с этой информацией такой приятной и долгожданной на что расчет;good
22492;я тоже з так и будет и я заберу тебя себе на всегда;good
22493;да уж точно но все равно как странно было сразу своих твиттерских из украины вспомнила так странно;good
22494;грозились сделать мне градусник а сделали трактор какой то сделали короч зима я тебя люблю;good
22495;если янус пригласит обязательно опробую;good
22496;если в алми то забегай ко мне семак пащелкаем;good
22497;блин это было кажется так недавно но в тоже время так давно;good
22498;в который раз убеждаюсь что fstat намного надежней всяких там lstat и stat;good
22499;наконец то я дожила до того момента когда самая эксклюзивная мандаринка в твиттере;good
22500;rt посоветовали поставить на экран блокировки теперь настроение ок всегда;good
22501;никто ничего не достигает и не добивается;good
22502;отличный вечер и поднятое настроение спасибо;good
22503;если я вижу в ленте rt или fav то я сражу ретвичу и избраню даже не читая что написано мм ясн;good
22504;я супер повар умею жарить плюхи любой прожарки;good
22505;все правильно думаешь та по моему все уже привыкли что мы орем друг на друга но меня реально бесит;good
22506;мне кажется все пиздато погода люди вокруг меня все что окружает меня не хватает наверное только одного;good
22507;в чем встречать новый год befree подскажет;good
22508;знаю с недавнего времени два варианта этой фотографии причем ни один ни другой не могу себе позволить написать d;good
22509;икея работающая до двух часов ночи это странный но успокаивающий вариант субботнего досуга;good
22510;если его не считать то как раз и не очень а если считать то плохо;good
22511;возмездие первая часть;good
22512;rt на улице волшебно легкий снег нет ветра слабый мороз;good
22513;пусть будет пикча просто так под настроение з ы ах да скорее бы чм по футболу;good
22514;ну вот зачем ты меня раздразнила d;good
22515;поняла это по заглавной букве в пераом слове ахха вспоминаю как мы запевали ее зимой d;good
22516;ахахах типичные наши отношения с артемом;good
22517;блин безумно хочу чтоб меня называли не маша а машеньк или машка особенно мой парень а он маша маша ну или любимая родная это бзик;good
22518;правда она милая первое что попалось;good
22519;rt перепутались в кроватке ручки ножки шейки пятки вот к чему порой приводят в камасутре опечатки;good
22520;первая медаль ирины старых на этапах кубка мира ура biathlon биатлон;good
22521;надо родить драко амортенцию или как ее там родить ахахахах я имела ввиду подлить родить самый яд d рожай;good
22522;как поживаешь катюша хз ты тогда так и не написал я тоже 4е мне лезть в;good
22523;сенсей чудесное слово между прочим заменяет кучу учительских отчеств хд все мне пора заткнуться глупый спор;good
22524;вот это поворот ну ты кароч передавай приветики всем и пох что они меня не знают;good
22525;как всегда только соберешься написать человеку а он уже off line;good
22526;а я не смотрела пофиг мне на него на белку вашу;good
22527;были с ребятами на ночном катке очень здорово;good
22528;ща в что где когда военный хор пел гет лаки ахахах им можно хит записывать;good
22529;была сегодня на катке ураураура радости нет предела;good
22530;rt спасибо любимой за вкуснейший ужин;good
22531;милый сказал что у меня отличная прическа и ему так очень нравится;good
22532;да когда прихожу туда уходить не хочется;good
22533;rt встретилась с яной алиной и катей;good
22534;обхохочешься субботний вечер моей мечты просто;good
22535;я не играю в moba игры зачем мне ее ждать;good
22536;rt баляяяяя да нееееет это неееее больнооооооооооо как комарик;good
22537;так ты с нами из за уборки не идешь давай нам нужен четвертый человек;good
22538;rt фильм смотрю сладких снов тогда;good
22539;я всегда буду рядом и плевать хочешь ты этого или нет хд;good
22540;на заправке почти все норм ахахахах пасибки лешке за вечер за всякие проделки особенно d повторим этот поход в лесок;good
22541;нужно же порадовать ваще величество;good
22542;м м м м написала правду то образилааась а як по ншому я не ображаюся на слова людини яку не поважаю;good
22543;не скажу пока ты ж еще не улетаешь а вдруг и останешься а я тут канючу подарки;good
22544;rt ахах та да еля повеселила не кожного вечора побачиш д вчину в л фчику б ля траси d;good
22545;есле ранетки такая хуевая група то хуевую группу в ранетка в саундтрек бы не взяли м;good
22546;ребяяяята вы такие мурняшки;good
22547;ы а мне бадж некромансер выдали на стековерфлоу d;good
22548;а народу там словно вся москва ночью только и делает что посещает икею;good
22549;интересно если снять квартиру кто нибудь согласился бы жить со мной х;good
22550;спят усталые педальки крепко спят;good
22551;какое у вас настроение х ро о а о и ш б е и в;good
22552;с днем рождения тебя всего тебе самого замечательного в жизни успехов во всех начинаниях будь счастлива;good
22553;отличный вечер в узком кругу друзей посмотрели мульт пошли беситься в снегу ностальгия где же наше детство;good
22554;rt это тебе спасибо за столь душевную переписку и спокойной ночи тебе сладких снов;good
22555;дианка обезьянка скайп 3часа 4 минут быстро как то пролетели;good
22556;я ребенок мне нужна забота ласка и всего одна игрушка ты ru ff;good
22557;зачем его вообще пить сок апельсиновый лучше выпить;good
22558;привик по нед лям бути вдома ран ше гуляв а тепер вдома;good
22559;здорово что снег выпал именно на мой д р лучшего и желать было нельзя;good
22560;дорогие девушки берегите своих мужчин пейте за них гуляйте не ночуйте дома пусть они бедненькие на кухне отдохнут;good
22561;любимая моя санечка поздравляю с днем рождения люблю тебя сильно сильно и скучаю;good
22562;rt дома наконец то позади неделя напряженного отдыха;good
22563;как дела как у графина каждый норовит взять за горло;good
22564;rt кому то может показаться по моим постам что idea и maven хреновые тулы да они не идеальны но все другое еще хуже;good
22565;смотреть мультики детства ночью конечно ведь больше заняться нечем вернуться в детство так здорово;good
22566;ахахахах антон як завжди як можна так грати роль щей п яного;good
22567;короче мне срочно нужно в питер меня там замуж ждут d;good
22568;конечно ведь в твоей жизни появилась я;good
22569;дааа бля все жирная просто у меня еще и животные есть помимо тэла;good
22570;мен туыл ан к н ме 2 к н алды;good
22571;привезла звезда в какой то клуб кушать и попросила посадить к мальчикам только к симпатичным мест нет;good
22572;видимо только мы с тобой любим спать утром;good
22573;юля приедет в гости а не приедет в глаз получит d а если приедет все равно получит ddddddddddd удмуртия;good
22574;так хочеться сделать ему больно например да хоть за пятку укусить d;good
22575;rt и я буду есть эти шоколоадки до тех пор пока мне не станет плохо ну не могу я с ними бороться;good
22576;спасибо;good
22577;rt mtvstars 3 seconds to mars все так упорно голосуют мне нравиться продолжайти d mtvstars 3 seconds to mars;good
22578;охереенно d я уж думал там гулянкиконцертыпоездки и блаблабла ахах я тож собираюсь работать но есть и нечто интересней;good
22579;ахахах;good
22580;влезу в беседу и буду тебя ненавидеть из зависти;good
22581;капеец ностальгияяя сашкаа женщинааа и все же я скучаю;good
22582;ну значит твое счастье само тебя найдет жди;good
22583;хорошо два не упомянутых бутерброда с колбасой мы таким образом превращаем в здоровую пищу;good
22584;rt ыхыхыхыхыхыхыхыхы на шару выложили свеженький альбом astralia spiral скоро буду кайфовааааать;good
22585;сейчас еду в автобусе с поездки на конячках слушаю reelroad так хорошо;good
22586;нет это слишком ты же знаешь принципы я потом как нибудь расскажу тебе должно понравиться d;good
22587;тебе спасибо;good
22588;одно радует скоро я буду дома;good
22589;rt ой ну перестань я не думал что я такой обычно я на всех плохо влияю;good
