Num;Review;review_type
40001;и я наверное самая плохая дочь и подруга и вообще мдаам;bad
40002;хочу кушать денег на проезд голодовка;bad
40003;rt нэг банди буудалд хамгаалагч 1 сар хийгээд ямарч охинд итгэхээ больчлоо гэцэн ярьжийсныг сонсоод;bad
40004;мне вообще нельзя нервничать иначе это плачевно обернется для меня;bad
40005;йошики блять какие нахуй наушники где альбом 9 99;bad
40006;как у меня зуб болит а мама на хор отправляет;bad
40007;rt на белорусской дикий пожар миллион пожарных машин;bad
40008;почему я такая самостоятельная и мама за меня больше ничего не решает;bad
40009;rt нэг банди буудалд хамгаалагч 1 сар хийгээд ямарч охинд итгэхээ больчлоо гэцэн ярьжийсныг сонсоод;bad
40010;вчера по моей внешности предположили что у меня армянские корни где о о;bad
40011;rt сезон завершен для артема ворошило вчера травмировался в четверг операция 3 4 месяца восстановление;bad
40012;походу у моей лучшей подруги нет совести чтоб даже написать мне;bad
40013;rt любов гр э як би ж то як брежнэв ахаха ал на малаца;bad
40014;у мамы завтра др а мы не знаем что дарить;bad
40015;ты меня не узнал чувак это же я барри ноу не помню;bad
40016;малолетние дуры не имеющие мозгов вешаются на шею к каждому смазливому личику жалко таких;bad
40017;хотела сегодня пойти куда нибудь но думаю что никто не захочет типа холодно и на фанеру никто не поедет;bad
40018;rt жуткая слабость как меня достала эта жара;bad
40019;вечно больной вечно на таблетках хддд;bad
40020;суки детей грабят прям у метро уже пидоры;bad
40021;rt белорусы стали символом бесправия и трусости udf by новости беларуси у мяне няма каментаро;bad
40022;киевляне зарабатывают себе свободу на майдане а мы лишь пишем твитты какой нехороший пу эх москвичи москвичи испортил вас квартирн вопрос;bad
40023;сижу в штанах и кофте батарея включена капец а я сижу и мерзну просто папа говорил что меня морозит нееееееееееееееееет;bad
40024;если это правда то я буду плакать;bad
40025;весь день хорошее настроение а сейчас плакать хочется;bad
40026;ааа и опять эта одна минута а точнее доли секунды;bad
40027;sochithebest без is ну ок хорошо хоть с the вечные проблемы;bad
40028;вот я как раз на сушке и на диете давай еще открой ее полностью и сфоткай чтоб я тут пальцы кусала;bad
40029;друуги поменяла телефон контакты потеряны буду благодарна если получу от вас смс с подписью;bad
40030;я досмотрела сериал смысл жизни потерян тяжело быть мной;bad
40031;проиграли восьмому классу в стритбол;bad
40032;и слава богу что пропустила ир;bad
40033;так у нас каждую сессию я с тобой;bad
40034;ой как это не просто очень долго буду приходить в себя;bad
40035;дядя сергей звонил я так по нему скучаю хочу к вам;bad
40036;rt выходные закончились;bad
40037;завтра не иду в школу олимпиада по технологии;bad
40038;я понял то что я ебать какой бедный студент;bad
40039;как же я уговаривала врача что бы меня не положили в больницу но через две недели опять в больницу;bad
40040;и не говори у меня пальцы пожелтели от ежедневной чистки;bad
40041;печаль что фотка с нашей святой троицой галимая;bad
40042;ага сно честно говоря мне обиднее всего что элл в группе практически не поет у него ведь такой классный голос перевелатему;bad
40043;интерфейс не показали rt wayray от способно расширить рамки привычных представлений о вождении;bad
40044;эх квн охото новый посмотреть а он только 12 февраля будет;bad
40045;саша ну где ты пропала да да алексеева 3;bad
40046;три контрольные и курсовик боже как мне справиться с вами до 15 числа;bad
40047;я сегодня заебался начальник хотел чтобы я заебался я его приказ выполнил;bad
40048;бумер 2 нормальное продолжение истории жаль только что концовка без хеппиенда;bad
40049;давно так обидно не было;bad
40050;rt иду вдоль родительского дома слева стоянка машина машина машина асфальтоукладочный каток машина o o;bad
40051;после прошедших выходных требуются еще одни чтобы отдохнуть уже от них;bad
40052;поход за подарками успехом не увенчался а в гуме уже;bad
40053;это обычное явление в нашей стране;bad
40054;rt жаль что эта поездка была нашей последней совместной мне не хватило этих дней;bad
40055;парни такие странные ты называешь их аргусом филчем а они обижаются;bad
40056;hello everybody все как то и плохо и хорошоо;bad
40057;мистику тоже люблю политика это скучно;bad
40058;нстроения ваще нету удалил из вк по непонятным причинами еще и на треню не иду зашибись просто;bad
40059;rt мне тож и еще русиш и алгебрушку;bad
40060;у меня нет мотивации кроме того что тренер хороший заставляет да ну не говори так почему;bad
40061;маша держись и вообще это какой то ад других слов нет;bad
40062;надеюсь что нет т к мне олю жалко;bad
40063;rt а у меня школа;bad
40064;rt ааа хочу поиграть в футбоол;bad
40065;rt чувак я тебе сочуствуююю 3;bad
40066;иногда хочется запереться от людей общаться только с книжками фильмами а с людьми бывает как очень хорошо так и очень тяжело;bad
40067;не верьте убунте она вам плохо с дисками сделает не умеет она преобразовывать теперь вот около двух террабайт чистог;bad
40068;изизи а я делаю домаху ибо пропустил много;bad
40069;грустно ковыряю клаву отключен жж;bad
40070;вчера удалили зуб сегодня надо было вести уроки а у меня жутко болели десна этот мир слишком жесток для меня;bad
40071;rt болит живот немного день какой то тупой;bad
40072;бля мне сегодня все таки в зал идти вот это уже плохо;bad
40073;rt сожалею;bad
40074;rt поздно вернусь домой;bad
40075;после завтра трубку пойду глотать бляяяя ваще пиздец;bad
40076;не могу всерьез воспринимать второй закон термодинамики;bad
40077;сама офигелаа хаах 33;bad
40078;печально неужели вообще никогда не бываешь одна о о;bad
40079;по психологии бррр скукоота;bad
40080;маладэц ай маладэц;bad
40081;играешь ли ты на каком нибудь музыкальном инструменте нет;bad
40082;у меня такая же фигня второй уже где то месяц не работает ужасно;bad
40083;rt они уходят в прошлое;bad
40084;а 18или19или2 го или;bad
40085;да я испугалась ее я вылетела из подъезда как пуля;bad
40086;да так проблем много в последнее время поэтому и страдаю;bad
40087;вечно представленный идеал и куча иллюзий все просто разлетелось;bad
40088;вот меня тоже бесит я тут накатаю рассказ а он мне запрещает;bad
40089;вот что интересно когда был маленький уже с ноября начинал ждать новый год а сейчас вообще нет никакого ощущения праздника обидно;bad
40090;странная вещь с chromium на компе когда захожу на роутер приходится 4 раза вводить логин и пароль в других браузерах в;bad
40091;аоаоаоаоа кенсуууууу почему ты такой крутой почему лухаз не такой крутой;bad
40092;как жаль что живу далеко от москвы а то бы с удовольствием забрала;bad
40093;сколько грусти в этом взгляде;bad
40094;и знаете ничего не изменилось;bad
40095;ужасно просто;bad
40096;rt хуево так то;bad
40097;вчера весь вечер называла меня эдвардом о о я его терпеть не могу;bad
40098;ааа как мне надоело по больницам таскаться еще на этой неделе надо в среду два урока пропустить и в четверг вообще скорее всего весь день;bad
40099;и почему это у такого милого создания нет авы;bad
40100;дайаша уснула в зале попыталась отнести ее на кровать нуоо она уже не такая масенькая дайашка которая ушушу она уже девушка блин почти;bad
40101;надо в порядок привести а то у меня в тегах ад какой то;bad
40102;а чо с ним у меня ни одного твита;bad
40103;да мне тоже было бы обидно а что то еще дарят или просто поздравляют;bad
40104;мне не кто не может сказать домашку на завтра;bad
40105;кому продать душу чтобы получить это;bad
40106;монгол hd тв ээр сонгуулийн санал авах машинаар хэрхэн луйвар хийдэг тухай кино гарч бна даа сонирхолтой rt;bad
40107;думаю еще не один золотой пистолет в думе на пол упадет;bad
40108;блина ну хватит уже этого английского сил нет уже его учить;bad
40109;ты опять манго мне не дала;bad
40110;история детка ты меня расстраиваешь;bad
40111;rt дед мороз ну пожалуйста;bad
40112;хам хочет как обычно кинуть весь народ хочет показать свою силу ему нужны не люди а рабы для их заводов не более вромайдан;bad
40113;и родители в курсе всего что ты делаешь о о;bad
40114;если начали покупать теплую и неособо красивую одежду то вы ооочень повзрослели;bad
40115;да но мне уже не надо я не помню логин от своего эппл айди а регистрироваться заново он не хочет;bad
40116;а у миня белая лал но красная я завидую;bad
40117;мало того что мама стала ходить на фитнес сегодня в тренажерку пошел папа о о папа мама я спортивная семья шок;bad
40118;что тебе подсказывает твоя интуиция что все на земле в том числе и я деградируют к сожалению это так;bad
40119;поездка удалась у многих насморк горло болит и температура у меня 37 5;bad
40120;отстой а почему не сказали ладно наличные это привыклий что могут а вот карточная;bad
40121;немецкий 5 той парой поставили я не выживу;bad
40122;rt монгол hd тв ээр сонгуулийн санал авах машинаар хэрхэн луйвар хийдэг тухай кино гарч бна даа сонирхолтой rt;bad
40123;тяжко постарайся успеть посмотреть на большом экране это что то с чем то;bad
40124;они у меня только после сессии;bad
40125;обидно когда теряешь подругу ну что поделать замену мне нашла;bad
40126;ну потому что они не разрешают от туда конфеты брать;bad
40127;о это телефон на системе windows честно уг;bad
40128;кстати при первой попытке открыть ключом дверь и поняв что никак погнула его в 2х местах;bad
40129;зачем я снова ищу это в интернете зачем я опять это читаю;bad
40130;а я хирургов единственные врачи которых я терпеть не могу можно даже сказать что опасаюсь их;bad
40131;ничему его жизнь не учит как можно быть таким наглым;bad
40132;я больна 999;bad
40133;действительно как;bad
40134;пересмотрела сейчас все видео дневники боже как же я скучаю;bad
40135;та ладно о о вы в другом месте это не брякните;bad
40136;няшный хирург дмитрий не хочет покидать мои мысли;bad
40137;зачем я вошла в интернет почитала диагноз и мне стало страшно пипец как страшно;bad
40138;во время поцелуя заехало;bad
40139;rt вайнонка уже летит в индию;bad
40140;мда заболел чтоле голова капец трещит ваще мама заразила;bad
40141;теперь у нас не ташкентская а чыжоука арэна блять;bad
40142;они меня убьют это их территория;bad
40143;воспоминания так и лезут в голову а еще жалею о том что не сделал раньше;bad
40144;внутреннее состояние как в рассказе клиффорда саймака мир которого не может быть;bad
40145;гг давно я не видел выньду 98 комп уныл и сюда ставлю хрюшу уже 2ой час пошел;bad
40146;вчерашний пвд на 15 км оказался полным x x назад ехал под дождем весь мокрый с ужасным ливнем и ветром между полями;bad
40147;про карму хочу теперь такую книгу;bad
40148;rt вот вот вооот;bad
40149;если все закончилось плохо значит это не конец;bad
40150;ужасно холодно именно в нашем кабинете даже не поспать в новом мягком рабочем креслице;bad
40151;мне тоже только в субботу нам еще даже эту работу не выдали;bad
40152;в нашу бы страну да клумбу таких цветочков;bad
40153;вообще не знаю как пробник написала ответы есть а что я ответила не помню;bad
40154;ааааа блин я в град уматываю как раз го на раскатанный в среду;bad
40155;rt убиться ап стену лор сказала нам сидеть еще неделю дома;bad
40156;rt желудок перестань болеть;bad
40157;неделю назад в швеции стартовал 2ой сезон но английских субтитров все еще нет к свежим сериям;bad
40158;ага ну прям вся украина у ваших ног;bad
40159;пони из шаров уродские довольно;bad
40160;как мне плохо глаза красные в сон клонит;bad
40161;ну нав що так п дставлятися почки найбразлив ше м сце;bad
40162;а еще я живу в жопе и ко мне никогда не приедут в гости;bad
40163;я все время думаю моюсь думаю ложусь спать думаю делаю уроки думаю гуляю думаю ем думаю бегаю думаю о будущем;bad
40164;блин пообещала маме сделать уборку но мне тааааак лень капец;bad
40165;q сильно много ему позволяешь забей на него рас не ценит хорошего отношения a;bad
40166;мамуля у нас даже сессии одновременно;bad
40167;rt народ киньте ссылку как в венде модули установить я в шоке от дружелюбия системы;bad
40168;висок разрывается от боли сейчас отключусь хочу домой;bad
40169;для меня это все новое неизведанное поле прямо я всегда боялась слушать на английском и добоялась;bad
40170;я никогда не была его поклонницей но действительно жалко человека;bad
40171;ну жень малоли ты напишешь че нить супер клевое а я не смогу ретвитнуть;bad
40172;надо чаще спать вообще башка квадратная;bad
40173;ты вообще со мной не поздоровалась сегодня;bad
40174;не ну там фигня что я никогда не получу 5 вписы не будет поэтому;bad
40175;сижу в поликлинике жду очередь как же мне херово;bad
40176;блиин все из за тебя не получилось посветить его чему то;bad
40177;я не хочу чтобы ты уходила но малоличегояхочу тебе решать;bad
40178;rt школьной время;bad
40179;у нее даже в журнале не стоит а тетр проверили;bad
40180;даже не верится у нас нет снега и тепло;bad
40181;rt 4 лет назад жестокий стэнфордский тюремный эксперимент доказал прописную истину власть портит человека;bad
40182;очень хочу переночевать дома неделю уже где то шляюсь;bad
40183;папа уже 4 5 часа на каком то пожаре которому присвоили высшую степень надеюсь все хорошо;bad
40184;порвались струны на гитаре теперь все струны менять;bad
40185;а вообще вторую неделю хочу шампусика;bad
40186;когда то смешные слова гены букина теперь более чем актуальны за что;bad
40187;папу попросили завтра срочно сдать кровь для девочки а его не отпустили с работы вот как он после этого может уважать свое начальство;bad
40188;увы без паба с деньгами туго без зарплаты с октября надо экономить;bad
40189;а счастье было так близко;bad
40190;не был у компа 2 дня а тут уже полный завал не буду читать столько сообщений;bad
40191;rt брест потек потек как сучка;bad
40192;без тебя лента скучна блин приятно;bad
40193;как я не люблю когда мама с даней ссорятся;bad
40194;o o как я понимаю это не последняя песня lt 3 еще 5 песен моему счастью нет предела;bad
40195;остальные дети наши уебали;bad
40196;почему никто даже не отсчитывает в юне дни до нг;bad
40197;и тут я вспомнил что на групповую презентацию надо приносить логбук;bad
40198;к репетитору по химии не пошла позвонила наругала с стыдно как то;bad
40199;p s таких проблем с xp небывает но он много занимает;bad
40200;черт черт черт математику жестоко исправлять надооо тройка выходит;bad
40201;я на столько отвыкла ходить вечерами одна что мне кажется что именно меня убьют испугают ограбят и все такое херово еще 2недели жить так;bad
40202;сегодня была жестокая тренировка ко мне внезапно пришел прилив энергии но чувствую что завтра я буду не в состоянии встать с кровати;bad
40203;а кто с филлипом тогда играть будет;bad
40204;тож хочу акк на вафлях а то на торентс ру мало путного;bad
40205;наебалово 8;bad
40206;они просто придурки сами виноваты а нам переделывать сссссс;bad
40207;эхх надо было условие второй задачи записать я и не подумал;bad
40208;тут тупость завтра у меня английский и я не успею презентацию доделать поэтому я не ничего не успеваю и делаю эту презентацию;bad
40209;rt дэбилки отца стебут;bad
40210;rt действительно мне обидно;bad
40211;это такая дилемма смотреть 6 сезон сплетницы в мерзкой любительской озвучке или в оригинале жизньтлен;bad
40212;однажды на аске сказал что он не девушка а парень там начался большой спор где он яро утверждал что это так я тоже так говорил я плохой;bad
40213;человек говно не ожидала от него такого настроение испорчено на весь вечер;bad
40214;cпасибо могло и лучше сама виновата;bad
40215;rt на работе муха который день доебывается гопник штоле;bad
