Num;Review;review_type
21207;завтра в 23 у меня секс а можешь ты встретиться не можешь занят не занят это уже твои проблемы;good
21208;думали что спрячут от меня самые вкусные конфеты кристина все найдет;good
21209;милашкккаааа люблюююю ттттеееебббяяяяя сссиииллльььннноооооооо оооочччееенннньььььь круто тоб аххахахахх;good
21210;я посмотрю как моя родня потом будет тебя выгонять d;good
21211;rt ох люблю когда так ну в любом случаи соседи наши слушаю офигенную музыку;good
21212;вчера весь день прогулял по городу со знакомыми и даже про отсутствие дома рабочего компьютера почти забыл с утра пос;good
21213;нет конечно ты же мой сисястый бро макс lt 3 я тебя жду 9 января сучка;good
21214;просмотр гарри поттера спать для слабаков p s я вообще адекватная;good
21215;не надо я лучше пойду читать дальше d;good
21216;да вот и я как то ну не знаю наверное надо в клуб сходить и сфоткаться в зеркале туалета это магический ритуал;good
21217;но если бы кто то был решительнее было бы круче;good
21218;rt эти акулы уже задрали;good
21219;новогоднее обращение президента медведев 2 1;good
21220;хорошо приехать домой мамочка встречала вкусными творожными рогаликами семья забота;good
21221;да забейте уже ребят мне не нужно ни с кем находить общий язык все ок;good
21222;незнакомый мальчик отдал мне шоколадку спасибо ему;good
21223;лента с фоном как всегда неполадки поставила классику чо там я спать ночи лента люблю тебя о;good
21224;химию мучаю обычное дело в субботу а так все как обычно скучно до невозможного а ты что там;good
21225;rt у меня самый лучшие друзья хоть они полны пошлятины извращенства но поднимают настроение мне всегда;good
21226;вернется непременно я не то что чувствую я уверена;good
21227;что может быть лучше ванны а после лежать в теплой кровате это рай после таких дней;good
21228;парень с которым я работаю и виделась всего два раза отлично бля;good
21229;загадываю желание новокосино;good
21230;я тож сегодня ничего не сделала так что не расстраивайся завтра будешь не одна вкалывать целый деньх;good
21231;никто кроме фогела не поймет что за хуйня творится у меня на аске;good
21232;вроде группа про мишу а пишут там постоянно о коклзе и дестиэле d;good
21233;комарик арррр голос твой мур мур мур мой любимый standup самое классное шоу на свете;good
21234;прочитала 5 глав на немецком на одном дыхании за мин 3 но почему же так не читается мировая лит;good
21235;спасибо вам ребят вы сделали эту субботу не реальной;good
21236;раньше ко мне в подруги метила теперь к другой лезет забавная баба;good
21237;я лягу спать на 1 5 часа а потом проснусь и опять голосовать d;good
21238;я тебе третий прислала еще помидорки полезны просто 3;good
21239;качество ужасное на внешнюю камеру gt lt ну хоть как то amaranthe elise ryd best of the best;good
21240;даже вот эта пустяковая штучка от нужного человека поднимает настроение;good
21241;2 серия прятки с никитой на;good
21242;хорошо что с того значит все на месте подпись у меня теперь есть maya;good
21243;готова;good
21244;загуглила и все равно не просекла фишку;good
21245;воу воу ты апасный спасибо постараюсь не опоздать по мск;good
21246;rt ща я попробую ампекпмаиер;good
21247;хаха нее моя норм даже смотри на шарики и улыбайся;good
21248;да не за что на след выходных повторим;good
21249;с днем рождения оставайся такой же веселой и необычной з удачи тебе и чтобы все что ты пожелаешь исполнялось;good
21250;наверное со своими подружками пиздит пока меня нет вк;good
21251;rt костя dell xps 12 сам такой юзаю штука мега круть;good
21252;и здравствуй челентано это одни собирались в сеньориту ну что же бывает и такое;good
21253;меня кстати офигенно постригли в кои то веки наконец то;good
21254;у человека есть свободное время;good
21255;женщинаааааааа с днем рождения тебя всяких веселостей тебе хорошего настроения успехов в спорте;good
21256;она написала предсмертную записку follow;good
21257;да да да да я хочу уже хоть завтра;good
21258;а мб настал уже тот день главное завтра проснуться с такими же мыслями;good
21259;а как надо граждане на евромайдан е обнаружен туберкулез но бояться его не стоит так чтоли;good
21260;rt у меня такой сексуальный мозг у все ебут его факт;good
21261;happybirthdayjenledger хаха сейчас соседи сверху опять врубили skillet лежу наслаждаюсь;good
21262;я просто сериал про лесбиянок смотрю;good
21263;пишу пост о еде и своему отношению к ней захотелось поесть пойду чая с пирогом съем;good
21264;два дня отличного настроение мб и третий фартанет;good
21265;1 час 29 минут на телефоне с аней вот что я люблю;good
21266;в парке горького шикарнейший каток;good
21267;сегодняшнюю ночь я хочу посвятить фильмам добрым милым фильмам всем снега и доброй ночи;good
21268;да да хуйня черт я пьяная в дрова но мне так хорошо;good
21269;досмотрела лайв стрим little mix все было очень классно они просто красотки а поют офигенно рада что посмотрела;good
21270;так дааа куда ему уходить сегодня летел просто могет;good
21271;развратничество у меня в крови но внешность мне дали неподходящую d следуйзамной;good
21272;кароче видимо в мою жизнь вернулись страдашки привет твиттер;good
21273;знаете что идеально идти по почти пустой улице и петь сплинов отличная прогулка не менее крутая чем вчера;good
21274;rt социальные сети прошлого были лучше;good
21275;вот да ну ги еще овер дофига фандомов но дивергент это уже слишком всю свою группу по дивергенту подговорю устроить бунт d;good
21276;на каждый новый год я покупаю себе вечернее платье и каждый год напиваюсь и сплю на полу может в этом году лучше купить матрас;good
21277;на хорошей машине и по хорошим дорогам ездить одно удовольствие вот только где найти хорошие дороги вопрос;good
21278;если б не моя болезнь то пошли б с горки кататься;good
21279;включил gorilaz feel good курю упиваюсь пеппером смотрю записи выступлений и тренировок морячки без звука мне заебись;good
21280;он уже спит тогда решим все завтра d;good
21281;зачем человек в костюме енота переходил дорогу;good
21282;некоторых и в 25 возраст не останавливает это делать;good
21283;еще и с киева ну красавчик просто;good
21284;rt как приятно было слышать когда объявили поет лучший певец года николай басков;good
21285;rt капрал отправляет в увольнительную гусара на тебе червонец но чтобы баба здоровая попалась с утра ну как еле червонец с;good
21286;зади зади ахахаха красуля оборачиваеться и мы на полу собакабольшеиспугалась;good
21287;ну вы капец девки сидят вместе и пишутся в твиттере d молодцы d;good
21288;rt любимая игра;good
21289;еще никогда не возвращалась с каравана в пол 11 так как ходила и выбирала что то к новогоднему костюму на выступление;good
21290;rt вблизи двери уже не в состоянии эту речь отчетливо воспринять;good
21291;это тот акк на котором можно писать любую хренотень потому что всем плевать ведь почти ничего нет d;good
21292;так то я боюсь больше всего сверхъестественного;good
21293;йоу что бы ждать новые серии сериалов было не скучно я решил пересмотреть все сезоны футурамы и гриффинов 3 а также время приключений;good
21294;омг это так приятно спасибоо за твою любовь lt 3;good
21295;спасибо за поддержку только тебе нужны мои проблемы;good
21296;папа несколько лет жил в узбекистане т к дедушка там служил нет у меня нет узбекских корней d;good
21297;23 45 аня идет домой мокра и уставшая за то настроение на вышке ребят спасибо за вечер давно так не гуляла;good
21298;rt моя кицюня счастлива а значит счастлива и я;good
21299;добровкуснополезного уик энда товарищи;good
21300;rt чего ты меня шлепаешь дашина мама;good
21301;и напоследок michael jackson you are not alone добрых снов;good
21302;основные составляющие счастья это когда тебе есть что делать есть кого любить и есть на что надеяться;good
21303;бля я шел с кухни так ногой ударился зачем да просто блять нога давно не болела и я решил вьебать ею ахахха ильяс;good
21304;нет с викой они пойдут в кино и вика опять за себя будет платить d;good
21305;доктор хаус смотрю на данный момент так отбросы и сверхъестественное т к времени смотреть не так и много а твои;good
21306;некоторые невесты бросаются в своих подруг вот такими букетами и даже попадают однако;good
21307;присылать моей маме вк земфиру и лепса даже для него это слишком;good
21308;ты знал что это было неизбежно gt d autofollowback;good
21309;rt на fight nights очень крутая атмосфера все бойцы кого я представляю всегда побеждают;good
21310;хардкор ыхахаха мне твой вариант с деревьями нравится;good
21311;спрячусь к этому времени спокойной ночи;good
21312;разобралась со сбербанком бегу в маминых сапожках на вокзал за билетами;good
21313;ааа окей буду готова и собрана;good
21314;решили с эльдаром приготовить макароны целый социальный проект оказывается затеяли мы с ним;good
21315;еще не до конца определилась кем буду но остановилась на 2 вариантах;good
21316;кто где а мы в сосенках как же хорошо иметь огромнейшую семью;good
21317;а ну тогда песня любовь и дота 2 для тебя;good
21318;академический ансамбль песни и пляски вв мвд рф очень удивил и поднял настроение исполнив хит get lucky;good
21319;кто то только ложиться спать а кто то просыпается доброеутро ну или спокойнойночи;good
21320;если бы у меня место было то пожалуйста а так у меня комнаты своей нет а у брата есть с;good
21321;уленка спроси она всех гомосекав помнит;good
21322;алла не знала про фильм;good
21323;то что люблю спасибо папе за поддержку;good
21324;засыпать когда тебя обнимает твой любимый превосходно бублик спасибо за прекрасную ночь обожаю;good
21325;аэропарк офигенский и лента отличный магазин уже сделал им выручку чуть;good
21326;катюши любимые с праздником нас хочу чтобы мы всегда оставались катьными иначе жизнь без нас у эти людишек будет скучной;good
21327;1 кг шоколада являются смертельной дозой для человека если я решу покончить с собой я умру именно так;good
21328;rt завтра в дюсш на тренировочку поеду;good
21329;rt ну да киевская русь изначальная и сейчас поведет;good
21330;rt короче друг без друга никак;good
21331;гонсало игуаин это супер нападающий хочу чтоб он забил гол во втором тайме великолепный игрок для меня он лучше самого месси;good
21332;rt за рукой не видно но там белый порш панамера;good
21333;значит все изменится скоро мой юный хоббит;good
21334;rt оля супер зацепило баи рано токи не баи;good
21335;я выразил твои мысли d;good
21336;ахахах это тот кто со мной и с надей тоже хотел поехать в кино;good
21337;люди которые могут быстро уснуть меня пугают неужели у них нет мыслей;good
21338;вопрос про музыку шикарен побольше бы таких;good
21339;когда мне будет лет 25 в комиссионном я куплю кровать на ней я буду лишь спать лежать и мечтать кровать она так нужна;good
21340;ты там на сбои в твиттере поправку делай он сам иногда отписывается я постоянно проверяю и то ошибки бывают;good
21341;для всех желающих обучаться поднимать и приумножать свою капусту есть предложение от которого я думаю вы не сможете отказаться в личку;good
21342;ахах главное чтоб он остался не боялся а так ноль проблем;good
21343;а что ето отдельные личности ставят вдобавок к трансляциям и музыке тег спорт что плющенко опять у кого то на по;good
21344;rt хахах все у софии появился конкурент;good
21345;еще б ты мог d я знала что не можешь но не предложить было грешно;good
21346;ищи лучше х если я сейчас что нибудь скину мой комп опять бомбанет;good
21347;сколько можно уже есть и есть эти мандарины я скоро лопну ахха забериое кто нибудь их от меня;good
21348;не будем прошлое вспоминать я в warface пошла играть;good
21349;натер мозоли блеадь не купили одежды совсем как думали а так впечатлания офигенные но автобус зло;good
21350;ложиться спать с настроением убейте меня и этого придурка ппц как стандартно;good
21351;а мне так нравится твоя планировка видимо хорошо там где нас нет;good
21352;хм устрой дома укрощение строптивого d;good
21353;да лааадно d согласно статистике 98 студентов хотя бы раз списывали на экзаменах;good
21354;да ладно я нежно темболее я девушка ладно ладно;good
21355;доброе утро жуйк на выходных традиционно было не до интернета;good
21356;карина я полностью за тебя аххах;good
21357;нельзя знаки препинания писать в голосовании d;good
21358;замечу у хоббита блин не все идеально изменилось;good
21359;у меня и у все будет хорошо все локти кусать будут захотят все вернуть а нам будет на них посрать;good
21360;у никиты свой метод лишение девственности коленом d;good
21361;опиши мене за допомогою 5 сл в симпатична см шна при мна маленька кароока;good
21362;rt продолжаем в том же духе глядишь кого то отчислят а кому то и поступать никуда не надо будет;good
21363;ооольчииик 3 таааайнаааа дадада;good
21364;три дочки жена и две дочки три жены d жена любовница и дочка d подруги воу воу воображение по легче а вообще любовница это не мое;good
21365;ахаха есть слегка это еще норм я за многое от него выгребаю и это круто;good
21366;а вот еще фоточки с сайта классно же;good
21367;rt хха в колонках играет kitty cat song сразу на ум приходит наш ответ собачьему вальсу вот только чей ответ наш ли;good
21368;представлю что он у меня в кроватке спасибо доброй ночи з;good
21369;порой так интересно спать из за наркоманских снов порой жутковато;good
21370;морально оживи ты нужна мне и детям х;good
21371;днем меня вывел из себя один человек пока он приехал я уже набухался валокордина и так раздобрел что забыл чего злился;good
21372;rt так и есть;good
21373;алексей признайтесь вы симпатизируете юнайтед а уж сомневаться в том что манчестер выйдет в лч это несерьезно;good
21374;прости пожалуйста но в целом это смешно d;good
21375;сижу в бибирево в детском театре брат девушки играет сразу 2 роли;good
21376;я буду в амстердаме с 2 по 5 января поехали вместе;good
21377;люди вы вообще что ли совсем;good
21378;rt нет скайпа регайся в кике я жду;good
21379;кто хочет купить кольца забыла кто их бронировал;good
21380;оо все меня осенило мне нужны гениталии оо да это гениально не часто просветление наступает эрегированное такое;good
21381;rt с тобой как в евросоюзе нет границ;good
21382;вот и с отцом познакомились боялась но ничего страшного не было;good
21383;вечер был весьма полон сюрпризов и более того очень приятных;good
21384;а кого то можно поздравить с ее окончанием;good
21385;этот вечер не перестает удивлять dd;good
21386;очень душевная неделя команда дайте пяяяяять;good
21387;rt теперь от нас с лизуном надо прятать все стаканы;good
21388;дерзааай стасюююк а диана я не помню как фамилия на з начинается с ефимом пела;good
21389;я все больше склоняюсь к тому что отель роботы d просто люди не могут быть такими идеальными полюбому раз в год они меняют микросхемы;good
21390;у советов отдельная кастрюля была с выездными визами я ж говорю почти;good
21391;rt 23 июня дата нашего с любимой знакомства теперь каждый год отмечать будем;good
21392;приветик желаю тебе скорейшего выздоровления радуй всех своей улыбкой и больше не болей;good
21393;она любит хоть как лишь бы со мной тусить;good
21394;капитанфиллипс отличный фильм несмотря на то что я пол фильма проспала;good
21395;вовсе не такой плохой как вы обо мне думаете я еще хуже;good
21396;кто то завтра пизды получит в сугроб нахуй затолкаю тебя лалка;good
21397;папа мне приснилось что ты купил мне маленькую шоколадку если будешь слушаться то тебе присница что я купил тебе большую шоколадку;good
21398;rt я все больше склоняюсь к тому что отель роботы d просто люди не могут быть такими идеальными полюбому раз в год они мен;good
