Num;Review;review_type
47532;жинхэнэ там еертее тохирох хунийг хайснаас еерее хунд тохирч сур;bad
47533;это была геометрия мы писали как могли школа геометрия;bad
47534;rt поссорилась с подругой люди радуйтесь что у вас есть друзья которые помогут в трудную минуту;bad
47535;ну вот ребенок недавно был лишен сладкого до нового года а мне теперь чай не с чем попить;bad
47536;на улице погода стремная прям снег в лицо;bad
47537;на физ ре я не боюсь что эти идиоты попадут мне в голову мячом я боюсь что они попадут в мой телефончик ски;bad
47538;не пришли яшка и цабо мне так одиноко в школе без них вообще нечего делать;bad
47539;почему люди такие глупые ведь видно же что они не безразличны друг другу но все же они не вместе;bad
47540;по дороге на упк надо столько здать не хочу;bad
47541;хорошо если бы можно было стереть из памяти некоторые моменты;bad
47542;rt если сейчас не отстоим останемся в совке как и вы и не верьте про русофобию меня все встречали как родную россию;bad
47543;кто то силен в математике но точно не я;bad
47544;времени нет у меня зачеты;bad
47545;такая жопа нас опять раскидают на классы снова по разным углам;bad
47546;вчера три человека доказали мне что людей по внешне нельзя;bad
47547;блин 2k sports не собирается делать хоккей на пк в этом году с nhl 1 ea прокатило уже нас а 2k sports еще не собира;bad
47548;о о psi что координаты теперь жуйку шлет откуда жуйк узнал где я нахожусь;bad
47549;даже в подъезде уже елка стоит а у меня учеба мучеба не до этого;bad
47550;rt это смайлик шредингера он веселый и грустный одновременно;bad
47551;осталась дома температура это все вчерашние снежки;bad
47552;друзья меня взломали если что то приходило от меня в последние три дня будьте осторожны это не я;bad
47553;как калечат себя нормальные люди ой ай больно кровь а как калечит себя антон о куска плеча нет заживает уже кхм странно;bad
47554;что бля за хуйня кто то взломал страницу в вк и сидит на ней а с телефона не могу пароль поменять;bad
47555;уже который год наши клубы позорятся в лиге чемпионов похоже рфпл действительно настолько убога;bad
47556;rt сканирование гугла на предмет новых сайтов с поддержкой openid ничего инткрксного не дает все теже провайдеры таже ку;bad
47557;да что ты будешь делать то а сегодня ехал с очень милой девушкой в автобусе пришел домой нашел в вк выяснил что она с красноярска;bad
47558;ну ничего себе и ты собираешься дальше с ними иметь дело;bad
47559;столько чуши вокруг этой злосчастной школы взрослые строящие теории держащиеся на 2 гвоздях все больше поражают;bad
47560;жратва вкусная пиво тоже вот только муз сопровождение оставляет желать лучшего;bad
47561;от пилять аськокапец отложился после реконнекта транспорт прицепил всю асю;bad
47562;а што катаклизм разродились новым альбомом о о;bad
47563;у меня сыпь на руках o мне страшно вдруг это смертельно;bad
47564;ну вот опять перенервничала аж глаз задергался;bad
47565;аааааа меня не пустил в вайт лист;bad
47566;вот украина продает китайцам крейсер варяг точно так же она может продать честь совесть все лишь бы платили;bad
47567;statoil в баренцевом море открыл новое нефтегазовое месторождение новости участников подробности;bad
47568;блять терпеть немрогу когда тетя заходит ко мне на страницу и лайкает фото где пью или курю;bad
47569;завтра пробное гиа по математике я не хуяшечки не знаю;bad
47570;ага сели б не товар;bad
47571;блин мой любимый ресурс с радио походу накрылся окончательно тху теперь слушать нечего;bad
47572;пока не было света замерзла и уснула теперь весь рабочий настрой сбился;bad
47573;десятая серия американской истории ужасов выйдет только через месяц;bad
47574;это сердечко я посвящаю тем кто погиб 11 апреля в метро на станции октябрьская;bad
47575;что за напасть такая с все болеют выздоравливай;bad
47576;второй день подряд 24ый не приносит мне ничего хорошего;bad
47577;rt у нас класс должен быть брат за брата за основу взято а на самом деле чет говно какое то 9 9;bad
47578;и мама винт забрала в итоге сегодня не сдам задачи по бу;bad
47579;так себе у самой спина болит поясницу тянет вчера ехала домой 2 часа все время стоя домой пришла поясницы не чувствовала;bad
47580;rt ну и ладно хотя бы подпишу договор купи подлей раньше но все равно еще неделю на машину только облизываться буду;bad
47581;меня тошнит уже от географии сегодня у меня 4 пары только географии;bad
47582;какие красивые малахитовые шкатулки я видел цена только не очень красивая;bad
47583;не могу придумать в какую сферу податься;bad
47584;зато наши дети скоро только такой ужас и будут видеть еще пара олимпиад и это станет частью программы;bad
47585;rt а я хожу с;bad
47586;чтобы учиться в германии нужно закончить два курса в россии в любом вузе;bad
47587;эх весело же должно быть а мне грустно;bad
47588;всем хай похоже я заболела ненавижу болеть зимой сами понимаете почему всем удачного дня и наилучших часов;bad
47589;ээээй ты что опять болеешь полечка выздорааавливай бегом хватит уже;bad
47590;не пошла на пару тк физически не могу встать с кровати;bad
47591;3й или 4й день уже дорожнв работы проводят ночью пидорасы а балкон не закроешь душно же пидоры;bad
47592;как жаль что я поздно его встретила ведь помолвлена с нелюбимым;bad
47593;rt не надо вот про дешевые наркотики они дорогие очень сейчас;bad
47594;на улице холодно а снега нет какой новый год без снега;bad
47595;ходить куда то далеко или возвращаться одному домой без плеера не айс надо было его тогда в карман убирать не потерял бы;bad
47596;бля где нг отмечать с кем бляять вообще все обламывается сцукааааа;bad
47597;ну я вроде хорошо выспалась наконец а что заболел простыл;bad
47598;мало того что проспала так блять еще и парашу получила по физо снова и гисту сегодня я тоже не отработаю ну вот что я за еблан такой;bad
47599;скоро домой а у меня сопли;bad
47600;rt с моими одноклассниками все в мире тюленики вымерли;bad
47601;действительно только факт того что она классухп мешает;bad
47602;два дня подряд валю после четвертого мама меня убьет;bad
47603;просто у него руки побитые а так все норм;bad
47604;p s таких проблем с xp небывает но он много занимает;bad
47605;rt сергеева дразнит меня моей любимой;bad
47606;а нам только предстоит этот кошмар;bad
47607;скааа стас звонил а я не смогла ответить пална не пустила 3;bad
47608;в который раз уже недоступны ваши подкасты;bad
47609;rt ну че за хрень нас если копнуть то обязательно либо жид либо басурманин в родне нарисуется;bad
47610;я не могу больше работать у меня нет сил;bad
47611;сегодня буду знакомить его с родителями сердце уже в пятках валяется superrt;bad
47612;одна фраза в голове не дает мне покоя вот и снова думаю об этом всем доброго утра а сегодня мне приснилось что я собиралось на море;bad
47613;отказаться от всех еврокубков ну вы откажитесь от всех комментарие;bad
47614;играть пойдешь а то выходные игрища урежутся;bad
47615;это после песни эй подруга посмотри на меня думай обо мне делай делай как я о о;bad
47616;rt он все у меня все настроение упало она встанет скажешь;bad
47617;я приличная девочка мама сказала что нельзя я и так спросил у нее о сексен;bad
47618;rt мне кажется я слишком внушаемый;bad
47619;и я скучаю очень съездил в больничку сказали нечего особого нет но их там опять что то беспокоит;bad
47620;реально что ли в кофеине кофе дают за рассказанную статью конституции я вчера упк зря учила;bad
47621;rt сегодня разбилось любимое зеркало ветер бяк спасибо блин;bad
47622;ну вот и посмотрела последнюю серию отбросов;bad
47623;в голове одни маты что же с этим делать;bad
47624;больше всего боюсь что он сейчас уйдет и не напишет мне спокойной ночи;bad
47625;3 за административную по химии она простейшая я лох зато за олимпиаду по химии 5 это норма;bad
47626;c enhf yt gjgfkf yb d jlye vbye ltym elfkcz а нееееет не удался;bad
47627;бесит когда тупо сидишь в твиттере и не знаешь чо написать;bad
47628;rt слушать юра шатунов минорные аккорды;bad
47629;опустошил су 26 78 опыта при преме 16к денег но мы слили;bad
47630;опрос снимок сделан инопланетянами вромайдан ки в либерастов на ножи или в печи важно;bad
47631;у подруги кошка родила я тут зубами стол грызу лишь бы не сорваться и не взять котеечку;bad
47632;блять настроение под ноль и думаю все понятно почему;bad
47633;иногда ваши новости напоминают сводки с линии фронта;bad
47634;сколько интересных событий я оказывается пропустила;bad
47635;задумка о том как написать что бы оно работало провалилась;bad
47636;а я так не думаю я в печали;bad
47637;когда ты не можешь сидеть ровно на жопе и тебе надо что нибудь делать бляя gt lt ели дотерпела;bad
47638;rt у кого то автомат по сопромату а у кого то козерожий хуй;bad
47639;депресс сегодня какой то жестокий дела делаю как то бессильно и отменить ничего нельзя че делать то с этим состоянием;bad
47640;rt конституцию знают многие а вот с пониманием беда деньконституции;bad
47641;как то слишком пасмурно и дождливо на улице а одеваться и идти за хавчиком наааааааааааааааааааадо;bad
47642;точечные коррективы промывание мозгов с самого верхнего уровня;bad
47643;мне даже слова не сказали о том что я бомж сегодня уже будут фоткать на биометрию;bad
47644;да да да так скучаю;bad
47645;айаккаааааа тулуйарбыттан ааастыыыыыым;bad
47646;прости да начала я но виноваты обе же я тожее скучаюю;bad
47647;попытка проснуться пораньше не увенчалась успехом;bad
47648;обновил хром он мне теперь постоянно предлагает установить флешплагин;bad
47649;мразь точно сказал бандит таких в ссср оборонями в погонах называли а сейчас в президенты идут у хохлов вор зек а у нас оборотень;bad
47650;rt мне вас будет не хватать персы lt 3;bad
47651;утро совсем не доброе когда рпзбудил не он а будильник злое утро;bad
47652;сейчас они на вас ринутся бешенной стаей держитесь мой дорогой у вас есть мы;bad
47653;на носу сессия я каждый день умываюсь а она не проходит;bad
47654;меня начинает заебывать что по воле начальника я занимаюсь пустыми расчетами по тем данным которые есть кристально;bad
47655;эх еще неделька так быстро учеба прошла;bad
47656;а мне только пишут что я долбоеб;bad
47657;ребят спасите меня от одиночества умоляю совсем не с кем ехать к 18 в политех на вручение ну поставьте мне компанию пожалст;bad
47658;rt почему у меня гифка не работает а у одного чувака работает победительпожизни;bad
47659;когда ты приедешь я уже соскучилась;bad
47660;вадяшик наш ногу порезал швов много наложили;bad
47661;кто то сейчас смотрит нового хоббита а я думаю как дожить до 18 декабря потому что ждунемогу и ломает ужасно;bad
47662;ммм как же я этого хочу скорей бы лиза где ж ты мать твою;bad
47663;дома збс одному по крайней мере фильмы смотреть одному иногда скучновато;bad
47664;блин я неудачник подорвал попкорном микроволновку;bad
47665;rt слежу за враньем по твиттеру прямой эфир миня убъет;bad
47666;ну то есть они пролазят через инстаграм я просто в этом абсолютно ниче не понимаю;bad
47667;да они волки позорные просто издеваются над родителями;bad
47668;rt а что делает президент он должен защищать народ а не кучку долбанутых предателей;bad
47669;ну как так то последняя серия отбросов просмотрена прощайте любимые я буду по вам очень скучать;bad
47670;аааааааа нахера так много денег сжирать было 1 р на балансе я поговорил 5 мин остался 1р;bad
47671;перевели отбросов конечно что то не очень;bad
47672;двойная доза пользы с утра дается очень тяжелооооо;bad
47673;вот именно как будто я в зеркале не могу на это посмотреть 9;bad
47674;канешна в классе никто нихуя не выучил а спрашивают меня я победитель;bad
47675;этническая мафия путин теперь тоже фошист;bad
47676;вообще не грузится видео какими то урывками слышно;bad
47677;вспомнила твои засосы на шее и печеньки;bad
47678;rt тупой пиэкк после задания которое нам по нему задали так глаза болят больше часа в командоре просидели;bad
47679;rt скоро еще и новый год ебучий;bad
47680;бесит когда что то не получается все в жопу пиздец;bad
47681;rt это смайлик шредингера он веселый и грустный одновременно;bad
47682;блиин на 1 уроке было так весело а сейчас так скучно;bad
47683;очень печально что они еще и врут;bad
47684;п а т а м у ш т а я н е к р а с и в а я;bad
47685;rt скоро 21 а я не смогу досмотреть кино;bad
47686;ну грю если негде зачекиниться то всякий смысл пребывания в этом месте как бы теряется;bad
47687;моя тупая привычка приезжать на вокзал заранее на много замерзла капец зато в поезде теперь тепло;bad
47688;аааааа сижу на скучной паре понимая что впереди еще одна не менее скучная пара хочу есть спать и новый год;bad
47689;да что такое то опять с утра выбираю и анализирую что лучше joomla drupal или php fusion;bad
47690;ааа нет пока это невозможно еще электронную форму не утвердили;bad
47691;у алексия коленки как шпиль ааа ну е мае больно было;bad
47692;как катастрофически не хватает времени не могу уже 2 недели просто полежать в ванной вечером мечтаю чтоб сессия закончилась;bad
47693;все плохо;bad
47694;и снова седая ночь и только ей доверяю я ты знаешь седая ночь ты все тайны привязалась;bad
47695;rt звук на ютубе у меня куда то бежит вперед на остальных видеосайтах все отлично;bad
47696;rt семь уроков тухнуть в школе;bad
47697;обращение президента рф президент путин простыл матушка;bad
47698;учу математику а она не учится;bad
47699;все это гавно стоит в офисе;bad
47700;блин в универе футбол не с кем даже обсудить;bad
47701;вобщем не хочет никак соединяться нетбук с арчем к вайфай точке на получении ip адреса спотыкается другие устройства;bad
47702;имхо на 1 место можно было поставить htc one а не блевотный g2 он жи вообще никакой;bad
47703;сегодня утром точнее днем проснулась от того что родители ругались боже как они уже достали;bad
47704;rt и как я обновление проспал на свой iphone 4s уже 6 1 2 и не успеешь за всем;bad
47705;на больное надовила хахаах в;bad
47706;rt это смайлик шредингера он веселый и грустный одновременно;bad
47707;rt а это яя з;bad
47708;когда очень хочется кушать думать о чем либо другом не получается;bad
47709;с днем конституции рф даже она старше меня;bad
47710;rt вот моя стенка вся не поместиласьо;bad
47711;rt он мне так нравится я уже не знаю как начинать с ним разговор просто на последнее мое сообщ он не ответил а писать как;bad
47712;rt ззз;bad
47713;мы пока ничего не знаем;bad
47714;встретили знакомого из 32 ой вспомнила его имя только тогда когда он назвал меня зая хд саша чтоб его это моя зайка;bad
47715;rt это смайлик шредингера он веселый и грустный одновременно;bad
47716;они сейчас съедят все сушки как дальше принимать задачки;bad
47717;про меня говорили смеялись ну типа хаха смешная проблема у меня на работе еще кружка с джи была я пить из нее не могла;bad
47718;ругаться матом и материть женщин разные вещи согласитесь он незаслуженно оскорбил огромное количество людей и продолжает;bad
47719;rt хочу жрать и не толстеть;bad
47720;мхм сийлбэртэй модон шонгууд ч бил мартчихаж хэдэн жилийн мн л очиж байсан;bad
47721;rt чтоб я еще раз компилировал gcc в виртуалке так эта скотина еще и неправильно собралась;bad
47722;эй каким образом xcompose не работает в chromium o o;bad
47723;надеюсь это не я его испортила;bad
47724;вчера проходила мимо теремка и вспомнила как в том году с каталась на санках;bad
47725;блин и все же почему мне обнова тви не пришла;bad
47726;нужно думать о сессии работе в конце концов о чем то полезном а я только о нем;bad
47727;rt ну как так отписалась;bad
47728;ударила ногу очень болит и кровушка идет;bad
