Num;Review;review_type
25001;добрейшее все будет хорошо;good
25002;куда вчера уезжали из школы я вас выдел в metro на выступление;good
25003;сыну 3 года он впервые попал в баню с отцом папа какая у тебя писька большая твои бы слова да маме в рот;good
25004;урааа наталья борисовна теперь снова наша англичанка ярадаа;good
25005;хочу подругу друга как джейми оливер ону маны астыы астыы дьоннору ынырар наьаа учугэй буолуо этэ;good
25006;на улице все так мягкои беленько что нг ощущается по настоящему;good
25007;я тоже как же я люблю воскресеньееее хд;good
25008;rt мне нравится музыка когда она в бешенстве;good
25009;ну не знаю что то не улавливаю настроение;good
25010;отлично вчера сегодня погуляли позитивная ночка с не менее позитивными людьми;good
25011;какой у тебя телефон iphone так;good
25012;настроение какое то ленивое;good
25013;доброе воскресное утро солнышко светит настроение отличное всем добра;good
25014;если я не сплю никто не будет спать;good
25015;да режиссер люк бессон пфайфер там бесподобна;good
25016;голосуем и болеем за тебя ты очень душевный человек велике дякую;good
25017;яахав дээ хаалтын гэрээтэй байдаг олон юм яриад байж чаддагг й тэгээд л арга ядахдаа;good
25018;rt уснул в автобусе через пол часа кондуктор разбудил уже приехали удобно;good
25019;утро хорошо началось надеюсь что день будет таким же;good
25020;rt успевайте на дактилоскопию пока бесплатно и добровольно;good
25021;все таки у меня руки из жопы растут относительно бисквита вкусно но сука не тоооо;good
25022;сделал обложку как в gta для своего факультета вечером выложу может понравится;good
25023;с днюшкой принцесса желаю пофигизма и чаще ездить в доминикану мог бы пожелать достойного мужчину но конкурентов не терпим;good
25024;rt а завтра с девчонками собрались в школу нашу зайти учителей с днем учителя поздравить;good
25025;rt до нового года осталось 25 дней;good
25026;для одних я пойду на край света а для других даже к телефону не подойду;good
25027;rt мне совсем не нравится то сколько мы общаемся ну да ладно хороших снов айеро;good
25028;rt интересно а за месяц активность вулкана снизится или отпуск фтопку;good
25029;типо так и денег платить не надо и валера покормит;good
25030;rt делай легче делай играючи кайфуй кайфуй;good
25031;rt вот что значит лучшая дружба;good
25032;встретил ту самую тогда 1 влюбись в нее но не говори ей об этом 2 если она тебя не любит бей ее 3 когда выйдешь из тюрьмы добей ее;good
25033;не сомневаюсь уж d но какого хрена надо было ехать в эту мск;good
25034;погуляла под дождем теперь в банк зайти стыдно а надо;good
25035;поехала с бабулей по магазинам домой прридууу на радостях с покупкааами урааа;good
25036;rt мляха прикольно играть в ассоциации на форуме с древовидными комментариями d;good
25037;вспоминаю вчерашний разговор с ваней и денисом что они вообще имели ввиду конечно ужасно хочется у лизки узнать но я буду молчать;good
25038;папа надеялся разбудить меня своим звонком а так то я не сплю он очень любит когда я рано встаю;good
25039;спасибо за список обожаю lt 3;good
25040;хаана тэр нээрээ wifi юу болж бна;good
25041;ооуум удачи lt з да ничего проснулась недавно;good
25042;сыграл в футбол утром щас дома с маленьким монсторм;good
25043;rt если третий день подряд не хочется работать то сегодня среда;good
25044;а утро началось со вкусного завтрака доброе утро;good
25045;еще чуть чуть и снова будет весна;good
25046;еоое нэг эмээ хандраад байх юм яаж байна намайг дагасан чинь буцаж дагасан байх юм;good
25047;нашел очень интересные лекции по истории литературы xxв лектор такая лапочка завидно прямо сижу смотрю обожание просвещение;good
25048;rt не помню буду смотреть сериал новая серия вышла;good
25049;хаха уих ын гишууд сонгогдсныхоо омно болон сонгогдсныхоо дараа гэнээ хуурамч хаха;good
25050;пфф плохой знак в апреле родиться вчерашний день спасибо d;good
25051;сегодня ходил отрабатывать два пропуска по физре первой парой и третьей вобщем в конце первой пары препод сказал а должники остаются;good
25052;варя с ребятами играют в переходе я подпеваю выходит круто;good
25053;может их обнести колючей проволокой и повесить табличку лагерь военнопленных ну что бы два раза не бегать;good
25054;спиши ру ну как же без тебя родненький;good
25055;омг я теперь понял как делаются настоящие дранники а еще у моей девушки замечательный отец надо записать его сотовы;good
25056;зато ночью пока не могла заснуть моя голова придумала гениальную идею к подарками;good
25057;снятся сны которые по соннику значат только хорошее это очень радует;good
25058;на входе на территории у метро гаш купи купи гаш да уж привет родной политех;good
25059;rt дождались официальный трейлер иван царевич и серый волк 2 смотреть всем толи еще будет;good
25060;было лето я чуть руку не сломала;good
25061;поскорее новый гооооод;good
25062;ой что то знакомое там виднеется;good
25063;rt поскорей хочу новый год и праздничное настроение;good
25064;rt купила пяни и чипсы сижу в макдаке присосавшись к розетке и вайфаю хорошо быть взрослой;good
25065;rt и кстати жрать в три ночи на пару с любимой тоже круто;good
25066;у нас один знакомый есть он поможет;good
25067;когда мне грустно я беру в руки любимую игрушку и от его слов чего не улыбаешся видешь ты мне нравишся мне сразу становится веселей;good
25068;rt bibizika скучная отписываемся че;good
25069;rt как сообщает в пендосии открыта лечебница для интернетозависимых линк;good
25070;rt ну наканиц уу юп поменал;good
25071;аа ну я так и поняла а что они про рашу говорили;good
25072;ахахаххахаха классная ава у тебе в твиттере;good
25073;прекрасно я не знаю ваших кривляний ff follow;good
25074;rt и как там выборы мне из выборга не видно;good
25075;сегодня у меня доброе утро с mark nopfler погода отличная 1 и легкий снег;good
25076;купила новые вееещи встретилась в портике сейчас довольная поеду доомоой;good
25077;ненавиижу просыпаться с больной головой доброго позднего утра и вкусного дня всем такого же как у меня;good
25078;rt поздравляем с днем рождения любимую актрису алису фрейндлих присоединяюсь;good
25079;я замуж выхожу о о за кого я еще не выбрала между президентом канады и сашей;good
25080;моя кошка ходит по квартире словно по навигатору сделает круг и потом дальше по прямой идет;good
25081;контора дюжит дюже эффектные видео штуковины визуальщики хуевы;good
25082;самая лучшая жена будет только у моего мужа;good
25083;настольгия блять неизвестный парень с днем рождения я спасибо но мы знакомы нп иди нахуй тебя это не касается;good
25084;сегодня у нас дождь замечательная погода бодр и полон сил;good
25085;а я иногда ностальгирую по здоровому образу жизни;good
25086;yyyy шнайдеродрочки;good
25087;мобилка дурилка трещалка пищалка будилка звонилка и деньги сжиралка;good
25088;как как ты могла увидеть я же все удалила;good
25089;rt типичная долбышева лучший комплимент d;good
25090;почему в россии всегда умели делать ракеты а автомобиль сделать не могут;good
25091;видели что нить более милое;good
25092;rt им нужно напомнить gt d instantfollowback;good
25093;сходила в дк и купила билеты на волшебный мир древних звуков подарок родителям;good
25094;ааааа сессия закончись скорей дай вздохнуть спокойно;good
25095;на улице такая красотища доброе утро;good
25096;воскресное утро nastasiyail придуманное мной;good
25097;эта зараза мой двд как знает что я диск вставил только вставляю сразу лоток закрывает;good
25098;rt доброе утро тви хорошего всем дня;good
25099;обещают на неделе снег и минусовую температуру как раз для;good
25100;выпрями спину и убери левую руку от лица;good
25101;понравилась фраза из полученного техзадания протокол обмена осуществляется с помощью протокола обмена;good
25102;rt что то меня на арахис пробило купил две банки по 125гр одну уже заточил;good
25103;что то неодин клиент на мобили не хотит дружить с твиттером ну его нафиг тогды буду юзать джуик любимый;good
25104;rt турнир для подписчиков все ближе подпишитесь на и получите билет взамен на твит подробности здесь http;good
25105;влад передает что он рад что тебе понравилась эта суббота воскресенье d сладких снов приходи на торт;good
25106;ну что такое засмущали девушку она тут теперь и не появится;good
25107;зачем романтика если кончится все коооойкой ахахах d;good
25108;посмотри несносный дед вообще ржачный;good
25109;rt любимые однокурсницы с вами я улыбаюсь;good
25110;сидим выбираем с бро какие найки взять аир или данки d он аир заказал уже возьму себе данки;good
25111;нашел в старом проекте 8454 строк пхп кода я тогда совсем не умел программировать;good
25112;сегодня она была без своих быдло типов;good
25113;я уже перестал считать часы своего сна потому что всегда мало но всегда высыпаюсь и почти всегдв в отличном настроении;good
25114;суженый по мнению некоторых это в понимании суженый совсем худой;good
25115;а снег все идет и идет с такими темпами скоро в валенках бегать начнем;good
25116;rt зима наконец то пришла в москву;good
25117;и тут путяра подгадил где правоверный скотландский уиски или на худой конец львiвска горилка;good
25118;если только так там вроде лучше были d;good
25119;rt осталось 15 батареи я сижу в первом вагоне и под шум дизеля пью нескафе классик и жую казенаки пока все хорошо смо;good
25120;да но на фотке это жесть щас цвет нормальный стал коричневый а вчера я коричнево зеленой ходила d;good
25121;хаха забирай его я как нибудь переживу поплачу конечно первые несколько лет потом забуду;good
25122;сегодня празднует 38 й день рождения российский актер артем михалков поздравляем;good
25123;уже восьмое число а я все еще в ожидании;good
25124;спасибо ты то что собираешься делать у тебя сколько времени сейчас;good
25125;допишу и почитаешь d если я вообще его выкладывать буду ихи с;good
25126;кому нужна работа день ненормированный отпуск 52 дня 2 раза в году зп 75 8 т р сообщите будем искать вместе;good
25127;девушки которая знает что такое турбонадув и прямоток афигенны;good
25128;rt о да антош день у нас хороший;good
25129;вроде кричали сала украине героям сала;good
25130;ну все они точно приедут d;good
25131;у меня в аудиозаписях идеальная музыка d;good
25132;rt как то вы с ней похожи d;good
25133;мы таки купили билеты туда и обратно алйоны и енотики должны порадоваться;good
25134;rt песня года 2 13 1 и 2 января во всех телевизорах страны;good
25135;неа наоборот четкая коммерческая позиция меня фаустов слил за бабки так что я теперь ор тоже только за бабки;good
25136;rt для тех кто ищет новый дом;good
25137;ну тааак кто же примет меня в гости каникулы планы dream;good
25138;так забавно будить мою соседдку я уже 15 минут произношу ее имя а она проснется посмотрит на меня и переворачиватся на;good
25139;в италии мне очень нра но там хорошо с теми средствами которые мы берем с собо врачам там сложно подтверждать диплом;good
25140;все отлично вот видео смотрю у тебя как дела;good
25141;rt это не козюлька в носу это капля росы;good
25142;а лето пахнет дымом от мангала малиной морем проливным дождем черешней спелой кремом от загара и отпуском которого я жду;good
25143;из всей ленты только я тебе нужна d;good
25144;желаю всем отлично провести выходные;good
25145;судя по моему хитрююющему выражению лица я хочу напакостить;good
25146;получилось взрослый разряд по спринту такое и в самых смелых снах не снилось помню только глаза тренера и друзей после финиша люблю;good
25147;дожили сала не хватает в украине в европу придут бургеры оставшееся отберут;good
25148;селезень сколько можно хомячить этот сахар;good
25149;читаю фпк тоже все в шоке от ора пак орет что аж глаза выкатываются смотреть неприятно не то что слушать цветок из 2х зол меньшее;good
25150;rt дождались официальный трейлер иван царевич и серый волк 2 смотреть всем толи еще будет;good
25151;rt ойы рел ж йл с з к ркем а ындар т р б р нен б р ткен ж г ттер рухтанып алайы шы тем ртаудан табаны тозып жеткен;good
25152;поэтому в италлии я могу только чаще отдыхать;good
25153;мне кажется у сестры талант талант аниме рисование;good
25154;класс блин теперь я вообще работать перестану;good
25155;утро доброе холопы князь проснулся ахахах;good
25156;гыы занесите в винде семерке окошко за верхний угол и оно откроется на весь экран удобно;good
25157;три года учишься на отлично а потом требуешь пакет марихуаны и всегда грустишь d;good
25158;только не в том случае если они не будут в хоре;good
25159;кстати углеводы лучше именно и только утром;good
25160;и то правда просто сегодня должна была быть аниме ярмарка но из за метели ее отменили с;good
25161;рубец свиной вчера нам кинула фотки своей малой а у нее такие большие глаза как будто она все понимает;good
25162;отличный вечер люблю дему повеселились с сестрой;good
25163;сходили с мамой в магазин митя набрал вкусняшек 3;good
25164;включила музыку из своего любимого фильма чтобы не забыть что он скоро начнеться teamfollowback;good
25165;rt ахахахах ита твая мичта вермишель;good
25166;офигенный день день позитива бегал как идиот целый день танцы офигенны хоть я и ракал но мне очень понравилось;good
25167;вобщем мы весь вечер на нервах все ужасно предсказуемо всех посадили убили и главные герои снова вместе и она беременна и счастлива;good
25168;хороший аноним ишь какой я знаю кто это спасибо юль;good
25169;ох скоро моя первая олимпиада волнуюсь немного;good
25170;rt дождались официальный трейлер иван царевич и серый волк 2 смотреть всем толи еще будет;good
25171;папа собирается в школу футбольного арбитра будет учиться на арбитра;good
25172;в кои то веки разговоры о погоде не просто из вежливости ломка стереотипа страна объединяется общей бедой;good
25173;главное не бери его шампунь его он до хорошего не довел как мы видим;good
25174;понимаю боюсь мы скоро по скайпу с друзьями будем праздники отмечать;good
25175;первая пачка документов приишла на почту работать;good
25176;нормально я сейчас на следующей поняла что остановку проехала;good
25177;спи хорошенький мальчишка ласковый как плюшевый мишка добренький как маленький щеночек спи малыш доброй ночи;good
25178;rt кинула человеку песню все уже намеки видит как вот так жить можно;good
25179;спасибо а ты чего подскочила так рано;good
25180;сегодня неужелиии до сих пор не верю увидимся скоро я знаю я знаю я знаю;good
25181;тимати ты когда в фильме жара снимался у тебя жопа не потела;good
25182;ас астаан дьиэ хамыйан баран пираты карибского моря керебун;good
25183;да до победы мне не хватило всего 6 голосов;good
25184;ментам понравилось шмалять в людей комсомольские прострелили бедро семьянину учившего женушку жизни болгаркой по комсомольски все;good
25185;как куда мне теперь девать уже нарезанные овощи разбитые яйца в мисочке отмеренный стакан муки;good
25186;только мое утро раньше вашего будет;good
25187;еще заданий 1 по всем предметам и можно ехать на день рождения ненавистная сессия хочу 24 число и последний экзамен;good
25188;подписывайтесь название игры aion;good
25189;как же классно там было улететь бы сейчас на недельку;good
25190;я вся такая легкая такая воздушная такая неземная такая смелая неотразимая короче пьяная я сегодня;good
25191;да с данилом мы уже давно в разводе так что мне все равно;good
25192;офигенное утро зная что сегодня воскресенье а завтра понедельник;good
25193;вид из окна;good
25194;rt новый год с классом будем праздновать у отлииично;good
25195;в подслушанно добрая половина вобще далеки от деятельности актива а рассуждают так об этом про выделяемые деньги это пиздец узнали бы хоть;good
