Num;Review;review_type
20001;rt писать упоротые стихи в упоротой беседе могем блин это настолько упоротая беседа х а потемкина обжирака с;good
20002;в том то и дело что всем это какой то уже тренд которые ни к селу ни к городу забей минутка негодования;good
20003;пользуясь последними минутами этого дня хочу еще раз поздравить c днем рождения спасибо всем за такой замечательный вечер;good
20004;не верьте это от зависти и тупости в россии большинство вас поддерживает и надеется на вашу победу;good
20005;rt живой коридор;good
20006;если тебе плохо иди и танцуй после танцев всегда хорошее настроение спасибо вам за это;good
20007;кухня сериал просто супер ахаха смеюсь целый вечер то вечернийургант то кухня классно;good
20008;rt между прочим нажав на ретвит ты помогаешь шоу;good
20009;ахахаха d где ты сейчас у дедушки мне не это интересно а что место кровать;good
20010;та не за что как кстати он прошел 3;good
20011;любовь это жизнь по крайней мере для меня без любимого никак нельзя;good
20012;rt забавно возвращаюсь с занятия по ирландским танцам а по телевизору матч россия ирландия 3 пойду посмотрю;good
20013;ахахаэ хорошо с лучик встретились поржали от души d;good
20014;пойти гулять потом поиграть в снежки поваляться в снегу сделать ангелочка покататься на льду умыть друга снегом выходной удался;good
20015;rt фраза дня заинстаграмь еще твит вконтакт;good
20016;ну сейчас будет 12 и настанет 8 декабря и все оф;good
20017;rt 6тысячный твит ушел на ретвит о культурном воскресенье значит оно того стоит;good
20018;rt иван царевич и серый волк 2 идем в кино премьера 26 декабря;good
20019;серьезный коробков о о твиттер не будет прежним;good
20020;ага а пот м вони з нами п шли тупо всю дорогу мовчали;good
20021;ахаха чего почти он же такой миленький 3;good
20022;мы тебя порадовали откликами;good
20023;rt ну вот пересобрал всю генту надо бы научиться ставить стейдж 1 и 2 обживаюсь понемногу интересно;good
20024;хочется положить хуй на учебу но понимаю что не могу супе е ер;good
20025;ночьвластелина это о фильме но я подумала о комиксах с афроамериканцем d шутка минутка;good
20026;погуляли сегодня вечером с отличный вечер провели однако;good
20027;полуночный бред для х;good
20028;говари быстро указ указуказуказуказуа материшся гадость даже джентельмен такого бы не сказал ахахах димаа;good
20029;ну да сан саныч серьезный мужчина как эстафета прошла удачно;good
20030;rt иван царевич и серый волк 2 идем в кино премьера 26 декабря;good
20031;теперь станем счастливой нг на носу емае d;good
20032;да ребята было весело;good
20033;q перечисли всех кто был у тебя и чем каждая запомнилась a;good
20034;чтобы как можно подробнее переписывать титры я научился писать глядя на экран 3 follow;good
20035;ну я думаю этот твит не уйдет в забытие;good
20036;и ни один из них не сказал ни слова правды о том где они были ff follow;good
20037;когда не хватает аргументов переходят на личности смешно;good
20038;люблю старый но на нем много параши всякой которая меня компрометирует ахах d;good
20039;да тоже ноль полный все стали ходить с короной;good
20040;на улице первый снег а вернее первый град севастополь;good
20041;ну чтож подведем итоги дня фарма ты просто чудо когда я тебя понимаю после пар вкусные пироженки и замечательный вечер круть;good
20042;rt уже второй десяток лет так бывает;good
20043;быть в активном поиске это как бегать по улице приставая к мужчинам с просьбой ну влюбись в меня ну пожалуйста;good
20044;rt ты это ретвитнул ты в край ебнулся;good
20045;rt вромайдан запрошую завтра погуляти з мною буде ще м льйон;good
20046;она так быстро прошла что не услышала;good
20047;rt соскучилась по своим телочкам вечер у артамоновой в гостях охуенен;good
20048;через 2 года сегодняшним буду поражаться;good
20049;rt вот так сидишь спокойно никого не трогаешь и тут узнаешь что сегодня твои именины и день сразу как то лучше стал;good
20050;ахаха это чисто совпадение между прочим отлично вышло;good
20051;злой хомяк не любит баварские сосиски;good
20052;в том то и дело что у тебя лежит все даже что не нужно d;good
20053;а у кого то пополнение в семье увы не у меня но почти у меня;good
20054;rt все збс мне все нравится хорошо даже отлично общаемся d;good
20055;ку ку всем наконец то нашла чуток времени написать сюда за это время оч много чего изменилось но как сказал один человек это все к лучшему;good
20056;rt теперь все видели группу луиза в действии dddd;good
20057;серьезная литература расскажешь потом очень крутая книга;good
20058;в письме татьяны 78 строк их нужно выучить ко вторнику параллельно с другими уроками;good
20059;ааа все теперь понятно спасибо ну вы когда поедете одессу не разбомбите;good
20060;все же есть какая то приятность когда у человека регулярно в статус транслируется песня которую ему скинул именно ты;good
20061;rt сегодня с утра об диму ударилась до сих пор челюсть болит;good
20062;пока сегодня сидела в очереди к стоматологу мне предложили чай или кофе о за два года в первый раз d;good
20063;ползая по пк случайно наткнулся на диабло 2 затянуло;good
20064;все спят и я такая пробираюсь на кухню за мандаринками и соком;good
20065;наноконтрол модный контроль твоего веса также на facebook худеем быстро эффективно и модно;good
20066;rt спасибо лен благодаря тебе меня решили все одновременно поздравить и типа так от души от сердца ахах ну спасиб всем;good
20067;люблю моих и иру за сегодняшнюю реакцию обе просто одинаково;good
20068;так завтра с меня благодарственный пост всех кто принимал участие в а сейчас пора спать спасибо всем кто с нами;good
20069;не развернув картинку полностью подумала что мой политех и немножко охуела а потом до меня дошло d;good
20070;по улице ходила профессор с гамадрилой она она не замужем была;good
20071;я только по инету и заказываю ибо в магазинах дорого;good
20072;rt словам пересмотреть и one piece тесно в одном предложении;good
20073;блин предлагаешь каток у тебя дома заливать;good
20074;болею всегрустно но надеюсь на лучшее береги себя твой друг;good
20075;ахах нет меня уже разлюбил давно;good
20076;спачибо вроде как в 4 3 сбор а ехать примерно час час тридцать с;good
20077;себя занять я могу d и так времени ни на что нет;good
20078;какая любимая группа группа ван ди а так ловато форевер;good
20079;rt мудак болотный волков походу не понял что окончательно похоронил своего друга и соратника навальнера;good
20080;ээээ это скорее оладушки но выглядит гуууд ъ ням ням mtvstars 3 seconds to mars;good
20081;на мнение а то что фильм хороший и без нее ясно всем;good
20082;пытаюсь молодежь научить уму разума но она не хочет и брыкается;good
20083;цитировать что то про умных и глупых чрезвычайно опасно самонадеянно считать что ты то точно среди первых;good
20084;за один объектив 25 грн а мне три за 8 dd дааааа;good
20085;мужчины на удивление нелогичны твердят что все женщины одинаковы и постоянно меняют одну на другую привет;good
20086;макияж маникюр эпиляция эх а в детстве чтобы стать красивой достаточно было повязать на голову бантик;good
20087;rt дождались официальный трейлер иван царевич и серый волк 2 смотреть всем толи еще будет;good
20088;о дааа и он бегает слюни пускает на мое бухло отвали холоп не дорос еще;good
20089;еле передвигаюсь сегодня ноги не гнутся совсем дикая боль в мышцах но на фитнес пошла купили маме карточку ходим теперь вместе;good
20090;рома желудь пронзительно поет мунсун на 4 43 dd;good
20091;может у него три платья неношеных в шкафу как у мамы дяди федора надо выгулять;good
20092;таки я это сделала конечно выглядит и не потрясно но я рада turkey food cook;good
20093;спасибо огромное за столь нужный мне твит и за поучение тоже;good
20094;ахахха как всега красуется перед камерой и кушает наблюдать за тем как ты кушаешь можно вечно;good
20095;спокойной ночи чятик было приятно тут сегодня первый раз посидеть;good
20096;понял та звиздец и не говори а вдруг оно однажды решит наружу выбраться и завладеет ее телом и армагедон блять;good
20097;ну перечисли не хачуууууууу;good
20098;с саньком создали сайт открываем свой бизнес скоро проставимся кто хочет купить тубаретки пищи нам dd;good
20099;ееуу все дружно упоролись 3;good
20100;d и у тебя отлично выходит что б на поржать xd;good
20101;rt да чего же аж 9 я буду скучать по даррену d;good
20102;шикардооооос просто шикардос вечер я бы повторила след фото будут;good
20103;22 53 сейчас у меня будет второй за сегодня ужин буду кушать овощи;good
20104;прошу проголосуйте за 4 аватарку заранее спасибо;good
20105;я реву а у нее внутри все переворачивается и она тоже ревет да она сестра моя по крови d;good
20106;rt какая прелесть;good
20107;я дальше спать спок а с этим недоразумением разбирусь завтра;good
20108;rt класс мне все понравилось настюха молодец не сразу узнала отплясала шикарно уютный культурный вечер;good
20109;нагло сбежала домой с причинами малибуувидемсязавтра;good
20110;так мы и гуляем я его 14 лет знаю мы в одном классе учимся и в один сад вместе ходили d;good
20111;все так хорошо сейчас ходить с лерой к дедушке зимой и пить чай уже традиция d lt 3;good
20112;rt очень жаль что этот день закончился зато осталась память палевные фотки нашей банды и видео;good
20113;и ни секунды не сомневалась что мой сын способен на что то ужасное instantfollowback;good
20114;круто я быро выписал даты по истории осталось ток пару письменных заданий;good
20115;rt хей хаа ночные снайперы релизнули новый альбом называеццо армия 2 9 ну чо я могу сказать это все те же снайпер;good
20116;36правилклавишника 35 по этому не удивляйтесь если увидите клавишников в кино с чехлами;good
20117;пойду ка я картошечки жареной забабахаю все равно жрать нечего а мама придет опа а на плите картошка;good
20118;rt дядька в кепке с надписью humboldt;good
20119;rt так тебе и надо козлина будет он еще мою терехину обижать;good
20120;вроде не сильно разбила а становится больно эх;good
20121;rt это очень мило и приятно;good
20122;если бы сезон был круглый год то не важна какая пора года на улице в дождь да и в слякоть;good
20123;ну тк кто то по субботам отдыхает а кто то я с я же победнище по жизни d;good
20124;rt взаимно;good
20125;ой ну развел тут разборки прям нам можно p;good
20126;чего жиры сразу симпотичные секси бочка d;good
20127;а ты уже планируешь где будешь встречать новый год;good
20128;очень часто сегодня идет снег;good
20129;ахаха но тогда получается что не на мой др а 22 го;good
20130;спасибо пора бы уже чуду случиться;good
20131;поживем увидим доживем узнаем выживем учтем;good
20132;как мы могли потеряться прийти к автобусу сесть пожрать курицу но потом додуматься что все наверно уже пошли на шоколадную фабрику ахахаахах;good
20133;rt наоборот я дома давно выложить забыл;good
20134;стоило 3 часа провести у плиты чтобы мои друзья были счастливы;good
20135;ахахаха я тут поняла что кому то идет быть взрослым нет ну честное слово;good
20136;rt мы ели торт который валялся на земле;good
20137;rt сын решил что пора;good
20138;rt этих не исправишь они не хотят понять очевид е можно было тогда задрать на все цену былоб;good
20139;сладких снов сделавшая этот ответственный шаг;good
20140;да нормально как настроение что делаешь;good
20141;тритатушки три та та веселый и отличный вечер с;good
20142;сидеть в горячей ванне и пить холодное пиво ахуительно;good
20143;но не кто не сказал что я не могу кинуть ссылочку d;good
20144;все очень плохо потом поговорим меня выгоняют щас уже;good
20145;олифер такая олифер спасибо за настроение даже на расстоянии даришь мне его;good
20146;мляха прикольно играть в ассоциации на форуме с древовидными комментариями d;good
20147;я тебе могу вк кинуть там отдельная съемка;good
20148;люси говорит что гийом кане мой брат интересные у нее взгляды;good
20149;что то видимо осталось от твоей прошлой жизни dd наверное внутренняя память мозга помогает не забыть;good
20150;я пошла на утренние медитации в центр йоги да тут не торгового центра но есть центр йоги;good
20151;моя творожая запеканочка просто пальчики оближешь да да самое время;good
20152;немного преувеличиваешь;good
20153;только вошла в дом как ушла в час то пришла только в 11;good
20154;кому ходоно кому жарко а кому и то и другое;good
20155;настроение хорошее можно засрать ленту кому то например не серчай;good
20156;rt 287675 его нету там защита от вирусов;good
20157;да уж нихрена не понимаю я в етом языке малоуважаемая зебра ddd lt 3;good
20158;оооо ну ложись спать то тогда выспись дорогой;good
20159;хотел потыркать на твои нервы в жопу пусть мою потыркает ddddddddddddddddddddddddddddddd;good
20160;наконец то все решили и выяснили кто есть кто;good
20161;привет не знаете про lte мегафона на айфон скоро будет;good
20162;надо же себя как то развлекать d;good
20163;баканева и басараб пьяные в пизду нам все похуй ахахах;good
20164;ааахаха а нееет всем бухла и шлюх у нас с мишкой патихард до 5 ночи ехууу;good
20165;у меня были подобные фото надо будет потом поискать;good
20166;летиииим в одессу надо загран паспорт d;good
20167;да есть такое дело все зависит от настроения;good
20168;rt дададададааааааааа а когда я ржу ну норм болтал по длинным волосам тайлера жирный пудель роберт;good
20169;сегодня весь день провела за прочтением хороших книг просто спасибо и тебе хорошего настроения;good
20170;rt даа d я тебе больше скажу я русский дирик парень d;good
20171;хиддлс всплакнул на сцене девки потекли этолол;good
20172;эээх ну и ладно все равно буду в снежки играть;good
20173;бля вот она ебанулась конкретно пиздец я в ахуе с тебя;good
20174;да я прекрасно это знаю за 1 5 год как я в группе на 14к людей она увеличилась вы знаете с чем это связано;good
20175;возможно эта поездка не такая уж хорошая идея 8 instantfollowback;good
20176;спасибо за потрясающее путешествие ахаха пободительпожизни;good
20177;забавный вечер зато плод плодотворный то какой объявляю благодарность за проделанную работу и потраченное время;good
20178;нет не все такие везунчики как вы;good
20179;ну вобщем за оффтопный срачь в камментах пардон;good
20180;ахах точно сказала ахах я до слез просто ржала;good
20181;или наоборот хотя да дозировка важна точнее угол зрения;good
20182;честно прошла и набрала 78 кулачные бои и прорубь это уж совсем для отчаянных;good
20183;есть повод собой гордиться собой бухая в дрова ничего ему не пишу;good
20184;вика моя мне шариков розовых подарила и розового тепла все прилично;good
20185;rt а в конце нас убила кристина d бандитолетные;good
20186;еще раз с днем рождения дорогая счастья тебе любим тебя очень;good
20187;только запомни бери вторую версию первый перевод не бери а то моя самооценка упадет ниже принтуса;good
20188;он говорит что у него пустует место в постели не будь дурой скажи пусть купит себе кровать по меньше ff ru;good
20189;пишу в аське анастасия возьмись за мозг ответ убил а что за повод;good
20190;я люблю тебя d p s диана d я тоже люблю тебя но учти у меня есть парень d;good
20191;rt прикольно на диване смотреть что где когда;good
20192;понеслись безпонтовые вопросики на аске про волейбол d;good
20193;я понимаю все время там сидела привязалась к нему думаю у тебя немало воспоминаний с ним связано;good
20194;rt хорошо прогулялись замерзлииии гыгы твердая шоколадка дноо;good
20195;rt дождались официальный трейлер иван царевич и серый волк 2 смотреть всем толи еще будет;good
20196;и как обычно у нас не готово все х горбатого могила исправит но к фесту то успеваем;good
20197;друууг с тобой сегодня 7 лет и 3 месяца со дня нашего знакомства я рада;good
