Num;Review;review_type
26152;q я так то не в этом смысле спрашивал ты поняла не обманывай a;good
26153;на воздушный шар похожий шел по улице прохожий;good
26154;я тоже не люблю но смауга надо видеть в 3d;good
26155;яна нестол й нас уже чекають;good
26156;я сочувствую всем кто там собрался d;good
26157;c сегодняшнего дня мама меня кормит с утречка кашкой это так круто а еще полезно и очень вкусно всем советую;good
26158;rt продолжение банкета в старом добром академе татарпати все эти вещи;good
26159;из вчерашнего диалога на нг буду ебать все что движется а ты что будешь;good
26160;вот кто может завести публику наргиз закирова smells like teen spirit;good
26161;рыбок пугаешь музыка играет патихард на sbsum;good
26162;спасибо ленча;good
26163;ахах ц меня обычно там перекати поле d и 1 5 пауков различных видов куча моих волос и штукатурка d;good
26164;я хочу выйти на улицу днем по магазинам просто погулять;good
26165;веселие шутки приколы крутой вчера был вечер сппсибо куме;good
26166;бабуля доебалась до водилы как он поедет он бедный чуть на ходу не вышел d;good
26167;я вообще не понимаю что тут происходит d;good
26168;17 летний мальчик учит тетю владу тому что такое зло мило;good
26169;rt жарко а я намазалась кремом с мятным маслом мерзну теперь;good
26170;ее я прошла тайного покупателя на 1 премииия;good
26171;спасибо большое за приятный вечер в теплой компании катюшу люблю рада что она у меня есть;good
26172;в магазинах типа красного яра есть стенды с продукцией велком;good
26173;по крепости самое то не кислит молодец хорошая пропорция и какое то ореховое послевкусие;good
26174;блин где машину припарковался не помню;good
26175;белочка ну ты то знаешь кого кто нас приписывал отписывал вот и я отписалась;good
26176;rt божееее я тоже тебя люблю малышкаааа;good
26177;чинь нэнч хайраа балганд г юу рийн амьдралаа ш н р сольсон тул чи ш нийн охин м н;good
26178;поздравляшки з понравилось я тоже хочу на концерт с;good
26179;а нам все дети нам все дети нам все дети нам даже дети то что вам не дети а если вам не дети что нам дети идите к детям;good
26180;нор у меня нет сил ее осуществить вот кто такие эти аж четыре сережи;good
26181;rt отличный день спасибо кате;good
26182;репетиция перед выступлением;good
26183;вот теперь я доооома в гостях хорошо а дома лучше dd;good
26184;rt мое зеленоглазое чудо;good
26185;спасибо миллион пуховиков вчера перемерила пока нашла то что надо;good
26186;ответить твои слова в переводчике перевожу я нормальная ахахах это норма;good
26187;ну что пока пока я пошла сестра уже едет надеюсь будет весело у них большущий дом и ильясина моя придет;good
26188;бла бла бла;good
26189;в хабру сто лет не заходил под своим аккаунтом обычно только читаю даже комментарии не оставляю но письмо уведомление отправили же;good
26190;надо воспользоваться его советом гей порн ин зе монин гей порн ин зе ивнин гей порн афте лааааанч эх пойду воспользуюсь d;good
26191;какую вы пишете причину изменения имени в контакте а то я уже поэмы писала а они не меняют;good
26192;посмеялась мамины слова дочь а может я сама вам водку куплю а то что то так дешево что я за вас боюсь нас уже ничего не возьмет;good
26193;rt ты со своим карповым уже достала да он вообще ахиренный;good
26194;доброе утро щас поедем покупать мне и мелкому коньки потом пойду кататься на коньках;good
26195;больше не повторится;good
26196;картинамаслом зима идетснег ворон сидит скучает;good
26197;rt happybirthdayianfromrussia спасибо ему за замечательные роли в сериалах;good
26198;ваш девиз невозмутим возбудим и не дадим наш девиз еще мудрей не дадут возьмем блядей;good
26199;ахахахах я бля была вторая на олимпиаде по англу в районе;good
26200;в маршрутке у водителя на лобовом стекле кубики красно белые не просто так;good
26201;интересно а некоторые люди вообще помнят о моем существовании очень приятно конечно;good
26202;какие интернет сайты наносят вред человечеству не в курсе за такие тонкости;good
26203;ахаха я увидела его у входа как заходил сразу поняла что к вам;good
26204;родители постоянно выбивают из меня дурь но я знаю где взять еще;good
26205;опять добрался до dojo на сонную голуву выспамшись как то не тянет;good
26206;ну надо же какие откровения я пропустила;good
26207;rt 8 декабря день сериаломана это наш день детки;good
26208;о этот момент когда ты находишь кучу крутых песенок;good
26209;завтрак в постель ммм как же я люблю жить у родителей;good
26210;нужно провести конкурс на лучшую подпись к фото belleolias foto;good
26211;rt приветик желаю тебе скорейшего выздоровления радуй всех своей улыбкой и больше не болей;good
26212;заходит пъяная телка в клуб и говорит бармэну мне отвертку пласкогупци и вон того сантехника;good
26213;сегодня у нас открытие лыжного олимпийского сезона как же я ждал того состояния приятной усталости и переизбытка кислорода;good
26214;q я не ломаюсь я киса задаю вопрос сколько лет тебе a;good
26215;наконец то раздал больше чем скачал;good
26216;талантлив во всем посмотрите как хорошо разговаривает по польски;good
26217;rt доброе как спалось;good
26218;ну у меня тоже пока все отлично складывается ихи жаль только что рано встал ахах чем занят;good
26219;сегодня моей малышке уже 7 месяцев как быстро летит время;good
26220;мляяяя золотой орех братьев запашных заставляет задуматься;good
26221;rt дима поздравляем с премьерой ты талантище;good
26222;такой вот отвратительный театральный язык прогоны репы крайние спектакли и манты;good
26223;только недавно заметила что мой пес когда переходит дорогу смотрит сначала налево а потом направо;good
26224;жуйк можно ли вывести пост в не создавая комментариев а чисто рекомендациями проверим;good
26225;нашла свою шапульку з и плевать на лицо girl lol funny winter happy nice december mimimi;good
26226;rt бывает d;good
26227;у нас никто бы не пригласил доброе утро наташа;good
26228;rt happybirthdayianfromrussia хэйхэйхэй сегодня же день обаяшки йена с днем рождения милый;good
26229;rt здравствуй дима после твоей содержательной лекции хочется прямо сейчас идти за медом на твою пасеку в магаз по;good
26230;даже не помню чтобы я встала в воскресенье хотя бы в 8 3 но сегодня исключение;good
26231;rt уже в отделении полицаи стебутся не меньше нашего;good
26232;rt в финале встретятся два самых аморальных ублюдка будет мясо с кровью;good
26233;не верю что так может повести есть планы на новый год будет великолепно;good
26234;rt дк темп начало в 1;good
26235;не распускать сопли вы настолько круты что можете записать подкаст даже посли амнезии;good
26236;н а я не люблю когда ты говоришь ясно понятно я понятно ясно н ну теперь обосраться d;good
26237;если собрать с крышек кока колы 2 баллов то мне дадут мишку;good
26238;rt хорошо что делаешь;good
26239;rt непослушные детишки;good
26240;я готова сколько еще вам осталось я успеваю;good
26241;ахах d во такой я обломщик;good
26242;вчера посмотрел отбросов и понял почему ты была ракетчицой лолка у тебя жирная жопа;good
26243;теперь я буду сочувствовать тебе по 8 мартам;good
26244;rt дождались официальный трейлер иван царевич и серый волк 2 смотреть всем толи еще будет;good
26245;хах вот что авто заграничное с людьми то делает хех;good
26246;повышеная концентрация анатолиев на квадратный метр сосед по палате анатолий ординатор анатолий;good
26247;ничего страшного просто у меня была но удалил а сестра и мама просят док во d;good
26248;в процессе исследования greasemonkey обнаружил что я сегодня ровно год как на жуйке это ж юбилей типа d;good
26249;rt приготовил пилотную версию картошки с курицей в духовке посмотрим что скажут мои на это;good
26250;rt это не козюлька в носу это капля росы;good
26251;и то ощущение когда тебя целуют с только почищенными зубами в твои непочищенные прелестно и похер что все это случайность;good
26252;играем в красно белой форме spartak наростов;good
26253;покажи киску с помощью;good
26254;мне сон намного хуже и страннее приснился сегодня d;good
26255;если вспомнить др то мои аргументы более веские чем ваше нихуяяяя;good
26256;тебя выгоняют из меда ла ла ла ла ла ла d d;good
26257;россия московская область г егорьевск 6 микр н д 16 кв 88 лежнева мария анатольевна индекс 14 3;good
26258;не права иметь незамужних очень даже замечательно ага бггг ой;good
26259;носочек я не спал сегодня какие планы на выходной;good
26260;с лучшей подругой на роликах двойной ржач и отбитая жопа d;good
26261;сегодня видимо все будут с утра подходить к окну и офигевать как красиво по крайней мере мы с родителями так сделали;good
26262;специально хотели раньше встать чтобы сходить на игру но в итоге решили спать дальше;good
26263;rt та ладно я не буду тебя трогать раз ты так хочешь ddd;good
26264;марк рассказывает о своем превращении в хулио иглесиаса;good
26265;и только сосед сверлит перфоратором в стенку;good
26266;я и говорю что нам с тобой не отвечают;good
26267;rt родственница ван дамма;good
26268;vixx хочу вторую награду и еще одну саранхульку от vixxleo;good
26269;я танцую у тебя майкла джексона случайно там нет;good
26270;rt аха желательно во время сессии аха но мечтать не вредно;good
26271;rt для я стала кумиром ахах d;good
26272;у меня был 1 вар самый прикол что для аргумента я вспомнила притчу из кадетства ахахах это капец d;good
26273;после художки решили пофоткаться;good
26274;доброе утро пришла пожелать d;good
26275;ты ооооочень странная d зато на меня пялиться великое множество девушек d;good
26276;я уже хочу как можно скорее нарядить елку и смотреть на огоньки в темноте;good
26277;rt спасибо ленооок;good
26278;блин у меня такой забавный ящик что на граватаре его уже зарегали похоже;good
26279;день начался просто замечательно хожу и улыбаюсь как дура ахах;good
26280;скинь фотку кто лайкнет задай тот же вопрос с;good
26281;если вы проснулись в воскресенье а голова не соображает хлебните кофейку;good
26282;а вы машину водили вообще а то я не в курсе есть у вас права или нет;good
26283;ходила на фильм голодные игры 2 вроде отстой лучше бы на мультик пошла;good
26284;выходные еще не закончились а я уже жду следующие d;good
26285;недавно тест прошла в журнале какая вы рыба мля я оказывается пиранья d как мне теперь с этим жить;good
26286;rt дождались официальный трейлер иван царевич и серый волк 2 смотреть всем толи еще будет;good
26287;rt никаких соплей только жесть только мясо;good
26288;доброе утро хммм воскоресение хах завтра всем в школууу а мы с тимурам не пойдем ухууу;good
26289;3 твит;good
26290;доброе утро не переживай папа с помощниками справится и ты будешь как огурчик;good
26291;какие твои любимые магазины таак хэппи молл триум молл и граффити;good
26292;мне так приятно когда об этом говорят чужие люди сразу к себе по другому начинаю относится спасибо;good
26293;а завтракать бабулирыми блинчиками так клево настроение 1 5;good
26294;доброе утро все выспались утровыходногодня msknitwear knitwear clothes;good
26295;жанне привет не ну есть еще олимпийский и военный городок за мэтро вы в центре ага;good
26296;только таким образом мы оба избежим ненужных осложнений b ff;good
26297;готовила вечером мороженое;good
26298;приятно получить с утра хотя бы такую мимимишность d ярькаа;good
26299;не знаю пока;good
26300;gt gt gt via танд шинэ жилээр юу тохиолдох вэ lt lt lt гэсэн дээр дараарай;good
26301;rt спасибо вас за вчерашний день было классно реально;good
26302;вот оно счастье пусть так быть не должно и ничего больше не будет пусть я ничего не успеваю пусть меня осуждают все равно это счастье;good
26303;танюшечка с днем рождения;good
26304;с днем рождения дружище d счастья тебе здоровья пусть все что ты хочешь у тебя будет вообще всего всего с праздником;good
26305;уджас зайчатки разума пейсатель плюс адын ff follow;good
26306;если у тебя есть деньги пошли в кино d;good
26307;на блоге смотрю что нужно подправить;good
26308;rt на остановке сидела кота просила кушать купили ей сардельку поела чуток видимо не понравилось;good
26309;да щито ты говоришь скопировала ты все;good
26310;rt ну у меня тоже пока все отлично складывается ихи жаль только что рано встал ахах чем занят;good
26311;не могу говорить был договор о неразглашении информации с тренинга;good
26312;глупость сила воли и кетанов а вообще думал дотерплю хотел попасть к своему врачу он только в понедельник принимает;good
26313;rt ты со своим карповым уже достала да он вообще ахиренный;good
26314;ну вот утро только настало а мы уже убрались во всей квартире благодаря d;good
26315;капец тут столько тушенок d в футбол вообще играть не умеют;good
26316;мб вас не d;good
26317;зашла вчера на спрашивай а я подписана на 694 человека вот что значит не заходила 9 месяцев отписалась и удалила страницу d;good
26318;rt happybirthdayianfromrussia хэйхэйхэй сегодня же день обаяшки йена с днем рождения милый;good
26319;сначала уроки потом 2 часа счастья 12 минут радости 72 секунд незабываемых мгновений а потом третий день сноуборда теперь уже на песках;good
26320;моя кошка любит меня тогда когда ее надо покормить;good
26321;rt удачи на slovo;good
26322;думаю что ты была рада меня увидеть d ахахаха ее выражение лица ахахаха;good
26323;затеяла уборку нашла игры из детства морской бой и автодорогу с рулем еще любовное письмо кажется подростковых времен а в комнате срач;good
26324;с моей фантазией можно нихуевые порно фильмы снимать d;good
26325;rt вот что мне прислали вчера мои звездочки люблю их lt 3;good
26326;привет папочка dd привет дочура как ты;good
26327;лежу болею мама тоже заболела вооот он праздник;good
26328;мы уже говорили что я буду первой во всем d;good
26329;rt на улице офигенная погодка обожаю снежок;good
26330;rt играем в красно белой форме spartak наростов;good
26331;rt дождались официальный трейлер иван царевич и серый волк 2 смотреть всем толи еще будет;good
26332;мне сегодня наконец привезут видео которые я жду уже 3 месяца доделаю свой клип;good
26333;в советских учебных кино по физике играет офигенная музыка на заднем плане d смотрю видео про асинхронный двигатель ибо электро завтра;good
26334;ни чего себе я тоже люблю наш город но питер мне больше по душе;good
26335;просыпаюсь от звонка своих красноярцев прибывших в мои байкальские края ох как же повеяло домом;good
26336;rt я только сейчас поняла что 2 14 год лошади а это же ведь год пони;good
26337;день катка походу d еще другие люди зовут на каток;good
26338;джимма моррисона с днем рождения а остальных с добрым утром;good
26339;rt ахахахах тощняк ну фроша у нас автографораздаваемый лал;good
26340;порвала джинсы пошла в магазин и купила юбку сапоги гетры с оленями и классные колготки с оптимизмом по жизни;good
26341;под дождь попадет разбухнет телефон расплющит;good
26342;сегодня жду всех и каждого без исключений;good
26343;я не в этом смысле d отпишись да и все d;good
26344;rt оригинальные окна в одном из домов позитивныйдагестан дагестан дагестан52 дагтви любимый дагестан;good
26345;как парней звали илья и ваня;good
26346;самое интересное недалеко от нас саркисяны живут dd;good
26347;яживувдругоммире d гоу после обеда или учеба;good
26348;rt твит с джастином для;good
26349;ну ешкин кот я же ходил на ее сольник в лужниках несколько лет назад очень круто не то слово;good
26350;поеду сейчас кататься всю ночь на роликах а потом прыгать на джампах d;good
26351;rt желаю няшнейшему всего всего самого кавайного;good
26352;rt мы с тобой на карусельках катались и целовались норма dddd;good
26353;блин жуйк win7 на 2часа сокращает время работы нетбука неужели макро офт всех наипать хотел;good
26354;ну здесь вроде про серебряные ничего не сказано;good
26355;ахах в цоде в это время наверное никто не спит;good
