Num;Review;review_type
42507;не смогла переписать матан только потому что в аудитории не было лишнего места ну что за дела;bad
42508;я не могу нигде его найти скачать;bad
42509;у меня денег нима шоб атветить;bad
42510;о нет на меня сейчас польется тонна калла меня ритвитнул какой то бот бмзх;bad
42511;щас лягу спать устала на репетиции ужасно;bad
42512;rt dell все вы не подскажете проверенные временем сервисы компьютерной помощи в харькове которые работают на выходных;bad
42513;не нравится ни коллектив ни сама работа я там зрение только порчу и невроз;bad
42514;серег я не говорю что он крутой чел большинство трезвых да честных были в стороне этот помог им и теперь в тюрьме;bad
42515;rt никогда не думала что учителя плачут но жизнь не договор и в нее не пропишешь пункт о форс мажоре;bad
42516;получу нового мама на собрание пошла очень много ощущений я получу;bad
42517;на меня нагнали из за картинки про дохлого сына толерантные сучки да реал слишком;bad
42518;закапали глазные капли почти ничего не вижу;bad
42519;rt ну я все понимаю но зачем ломать памятники как не крути это наша история а людям холодно вот и страдают ерундой я против ва;bad
42520;но ведь белибер однажды белибер навсегда;bad
42521;ты че меня и там и тут игноришь;bad
42522;такое состояние у меня раз в пол года обычно я как лошара пою;bad
42523;в малайзии произошло самое дорогостоящее дтп в истории первый канал с помощью вооооот люди долбоебы;bad
42524;мини тихий час и пед тех сегодня до 3 сидеть не получится вставать раньше завтра;bad
42525;выдалась очень смешная физкультура гимнастка из меня никакая;bad
42526;ни фига эти сцуки не хотят я пробовала;bad
42527;в первый раз экрана ipod classic не хватило для видео это были учебные ролики по мелко;bad
42528;оставшиеся дни этой недели обещают быть тяжелыми;bad
42529;так не ловко чувствую себя перед мамой;bad
42530;пытаюсь сконструировать на js нечто вроде своего датагрида пока получается так себе;bad
42531;rt оу ну тогда ладно хд тебе я доверяю хд о;bad
42532;все съемки ллойда закончены интересно как это было в последние годы застаю только новости о том как шинго заканчивает сниматься;bad
42533;ужасно не люблю платить людям за воздух;bad
42534;rt все просто;bad
42535;rt пытаюсь заставить rnq работать с аськой не получается;bad
42536;у меня такое ощущение что я не на 5 курсе а на 2 че то все так сложно;bad
42537;rt раньше боялся стоматолога а сейчас больше боюсь цены за лечение зубов;bad
42538;уахха аьаатым эээ бл э жоско аччыктаабытым тииспин онотторор боллум тугу да ылбат боллхатарына и миабын толуом;bad
42539;у меня еще в четверг по геометрии к р;bad
42540;в кач собираюсь короч пожелайте мне удачной трени а;bad
42541;отжиматься на кулаках как то весело но почему то болят кисти;bad
42542;а что если бабушка не найдет мне работку;bad
42543;и этот хочу себе того же мартакиса;bad
42544;настя есть такая поговорка та же мучка да не те же ручки так в каждой профессии и в медицине тоже печально но факт;bad
42545;неужели придется бросить свои вредные привычки;bad
42546;rt и вообще сегодня часов 5 поспала что такое хочу домой и ни куда не выходить до лета;bad
42547;можно поиграть в бету starcraft 2 жаль нету на чем;bad
42548;rt расслабитесь нас с вами всех расстреляют еще к 2 2;bad
42549;вчера по моей внешности предположили что у меня армянские корни где о о;bad
42550;после хардрезера и переустановки fring он тут же подцепил все сервисы значит он смело хранит у себя все пароли bad;bad
42551;просто я целыми днями ничего не делаю привыкла спать днем и время проходит быстро именно поэтому я думаю;bad
42552;дайте сил даже есть не хочется от такой нагрузки;bad
42553;в кинотеатре был случай ходили на сумерки брееед но запомнился момент когда елла и эдвард на поляне солнце еще;bad
42554;я не люблю тупых баб с такими ну просто не интересно и таких до хрена;bad
42555;кажется кому то срочно пора на каникулы;bad
42556;стратегия 2 3 с барселоной и миланом объединят цены мечты мечты с помощью;bad
42557;как наснимала вверх ногими так и показывать вам буду я дебил;bad
42558;котики то что мне с вами весело это отлично но из за разного часового пояса я не сплю нормально уже 2 суток отпустите;bad
42559;rt в первый раз экрана ipod classic не хватило для видео это были учебные ролики по мелко;bad
42560;это плохо не болей сейчас такая погода ужасная выздоравливай;bad
42561;вот ведь гады насильно перестраивают;bad
42562;я сейчас пощу 1 2 твитта в сутки но ведь вижу сколько мимо носа проплывает заданий это сильно портит настроение;bad
42563;сибирь красноярск середина декабря близится а снега нет;bad
42564;блин как же я не хочу завтра идти на учебу;bad
42565;новогодняя w рождественская вечеринка с сотрудниками будет 4 декабря o o такие дела;bad
42566;rt гады заблокировали вк в италии даже ссылки не открываются;bad
42567;что там с майданом сегодня загружен;bad
42568;rt жуйк подскажи команду для вывода всех загруженных so и сколько памяти они занимают помню была такая но забыл;bad
42569;что случилось не плааач дорогая;bad
42570;rt никак не могу пройти 12 й уровень в epiphany;bad
42571;rt воу а хотя у нас таж парочка иболанов в тви есть но они такие иболаны шта пристрелить хочиться;bad
42572;ваапще не люблю разницу во времени у меня подруга из америки так у меня уже 1 часов утра а у нее вечер моего вчера;bad
42573;не знаю живот прихватило сильно;bad
42574;лол защелкал в варке овцу она взорвалась сцуко я не знал что они динамитные о о;bad
42575;нет не успела времени все не было проверю обязательно;bad
42576;о да какой то супер сонный день;bad
42577;и снова я сижу дома без света мне это уже не нравится до 16 числа весь день сидеть без него;bad
42578;мы слишком легко отказываемся от своих мечтаний хотя вселенная всегда готова помочь нам их осуществить пауло коэльо;bad
42579;да жалко что у нас нет машины времени;bad
42580;когда было выше нуля повязка тоже справлялась;bad
42581;rt ну вот опять все тоже самое;bad
42582;ну почему родители так делают почему в последнее время так много всего плохого;bad
42583;хочу скачать книгу но не могу найти помогите;bad
42584;солнышко а утром очень холодно было;bad
42585;вот мне тоже можно буде присваивать кадастровый номер если я еще раз буду есть суп в четыре утра;bad
42586;очередная ужасная новость бедные мальчики;bad
42587;я и утром то 3 часа ехала сейчас вообще не знаю;bad
42588;жертвуют больным как правило только те кто сам пережил похожую трагедию в семье а эта категория у нас сильно малоимущая;bad
42589;сопливо простыла я совсем у тебя;bad
42590;вита сказала подождать чуть чуть кажется она уже забыла зачем я пришла;bad
42591;rt самое ужасное время это ожидание результатов егэ;bad
42592;опоздал на 1 минут;bad
42593;rt с раннего детства мечтаю увидеть северное сияние а сам живу на юге;bad
42594;но впереди еще репетиторы даже нет не так репетиторы много катянеумеетделатьвсевовремя;bad
42595;стооолько домахи задали просто ну оочень много;bad
42596;такой ужасный ветер что страшно на улицу выходить;bad
42597;не говорите ниче я хочу в туалет но мне лень вставать;bad
42598;да вот же пол утра удалял;bad
42599;я не знаю как это называется но всякие мысли крутятся в голове и они очень ужасные;bad
42600;выпилил powerpill и perl xyne arch из своего арча разработчик отказался от их поддержки а жаль archlinux;bad
42601;лучшие подруги как же даже и не поинтересуется и плевать никогда не умела выбирать правильных людей;bad
42602;да короче машину тренер не может найти дорогие все;bad
42603;вечерком ок а то я бегу уже на допы;bad
42604;бляяя до завтра не зайду на свою стр ппц;bad
42605;так хочу сегодня с милом увидится но увы;bad
42606;69factsaboutme 46 у меня накаченный пресс правда кубики пока неочень видно;bad
42607;хоть это утро и началось у меня в обед почти но таки оно оооочень не доброе;bad
42608;началась самая жесткая неделя придется хорошенько поботанить чтоб получить автоматы по зачетам и экзаменам;bad
42609;утро начинается с поиска работы партизанский пр т 23;bad
42610;у конкурса 4 участника артем надежда павел и полина;bad
42611;вчера познакомилась с парнем он такой хороший красивый добрый но есть одно но он наркоман;bad
42612;я еще в сугробах поваляться не успела у меня уже во дворе снег чистят;bad
42613;как можно извиниться перед парнем чтобы он ахерел;bad
42614;прииивет;bad
42615;чертовы часовые пояса при любой их смене не могу засыпатьвставать нормально;bad
42616;не люблю разговаривать с мамой она меня абсолютно не понимает;bad
42617;ооодьэээ маман туох да диэбэт да наьааа кыьыылаах дии;bad
42618;rt не прошло и двух недель с момента изучения блога м калашникова;bad
42619;rt у а я же в субботу на детский день варенья иду то есть на дачу косить кусты за пиво я не поеду;bad
42620;помогите написать рецензию на детскую книгу;bad
42621;rt вот странная неприятность с компьютером один из жестких дисков завел привычку самовыключаться очень неприятно;bad
42622;короч мы ни когда так не решим где нг справлять;bad
42623;юр верни свой прежний образ;bad
42624;решил сегодня читать сообщения всех типов которые присылают треки или впаривают свои биты еще ни одного нормального;bad
42625;rt зачем придумали чс если все равно чел появляется;bad
42626;практику придется отрабатывать так как и завтра дома просижу болеть отстой 3;bad
42627;лолитон соскучилась по кристинке очень;bad
42628;прогноз на неделю обещает много снега неееет;bad
42629;и ниче делать не хочется и сна ни в одном глазу;bad
42630;я тоже так думаю но пока что на практике не подтверждается;bad
42631;кто нибудь кроме меня засыпал на республиканской олимпиаде по английскому я хочу поговорить об этом;bad
42632;бибагадаа сайн бсан охинийхоо араас дагаад явж бсан чинь негее охин эргэж хараад чи намайг дагаад бгаму би засс зайла чамшиг матрыгуу;bad
42633;чтобы забрать машину из труднодоступных ебеней нужен конечно самый холоднющщий день;bad
42634;моего скоро вообще кастрировать будут бедный мой котик;bad
42635;решил бублик съесть откусил а внутри ничего нету;bad
42636;дружить со мной нужно иначе могу и отравить на лабе такие замучаные;bad
42637;у меня какая то фрустрация я тоже хочу чтобы меня с ручейка и игры на тазике перло;bad
42638;не в глаза пробовал просто вдыхал аахахах;bad
42639;обломали нас сегодня без фока оставили;bad
42640;я сдаю гиа а все почему да потому что я победитель по жизни;bad
42641;даже живя рядом с работой я все равно опаздываю;bad
42642;ну хуууули я же мужик и саам согласился рабооотать так что не нооой тупая шлюха gt;bad
42643;ну они раньше закончились мне их больно одевать;bad
42644;принимаем извиняйте больше так не будем;bad
42645;вижу единорога в линта а он миня нит обиднаа;bad
42646;я уроки делать np hypnogaja kill the humans;bad
42647;хочу обраааатноо на год назад;bad
42648;сегодня все занятие болело колено витя заразил меня больным коленом;bad
42649;настроение тратить деньги а деньги все под учет;bad
42650;светлана борисовна и как же теперь;bad
42651;я хочу домой miss home dearhome mydog;bad
42652;поставил firefox 3 5 шрифт какой то ужасный поставил opera 1 и тут со шрифтами накосячено;bad
42653;весь день в школе без планшета это такая печаль беда;bad
42654;мои индусики плачут что у них не течет вода ну что я сделаю;bad
42655;когда у нас был англ в коридоре кто то играл на гитаре и пел красиво и грустно;bad
42656;rt дай ладошку;bad
42657;rt все время совершаю необдуманные поступки;bad
42658;и мне стыдно но хорошо никто не увидит наверное;bad
42659;твит для;bad
42660;rt прикован к этому электронному миру что зовут интернет;bad
42661;чай больше не доставляет пью воду на работе help;bad
42662;решил заступиться за девушку а в него стреляют жалко парня очень боксером был;bad
42663;в автобусе стоит красивая девушка только она прыщавее меня;bad
42664;больше всего мне на линуксе не хватает 3 х вещей фотошопа айтюнса и лингво;bad
42665;меня учеба уже заипала домой еле прихожу вчера вообще в шестом часу пришла а так в пятом обычный день твой;bad
42666;ну ты даешь во сколько последняя пара заканчивается у тебя завтра;bad
42667;как страшно влюбится в человека с которым гуляеш и прието у него есть девушка;bad
42668;я так хочу сидеть в тви но у меня совершенно времени нет;bad
42669;ее родители заявление написали уже;bad
42670;у меня таже история где и когда неизвестно;bad
42671;облом 9 серия выйдет походу только в феврале печальбеда;bad
42672;снега нет 1 у тебя как че делаешь;bad
42673;аллергия на апельсины и мандаринки я их так люблю аромат нового года;bad
42674;из за тебя у меня теперь в голове стереотип качек гей;bad
42675;надо твитнуть а то забуду хотя я и так забуду;bad
42676;бля по любой у меня опять дохрена 3 выйдет;bad
42677;фу я хуйня столько иметь двоек в течении второй четверти фу какая фу быть такой;bad
42678;rt привет хваленой европейской демократии;bad
42679;17летнее что простите фу фу фу фуу это же ван пис ну бля;bad
42680;но зато я сдал другую практическую на 5 и он меня своими дополнительными вопросами завалить не смог;bad
42681;малыш вставай почему я хочу обнимашки но гарри я действительно устал пожалуйста;bad
42682;взаимно только со снегом трудно представить хочу лета;bad
42683;но блин я соскучилась хотя они там пока я не играла одну из моих любимых зон подожгли да и из гильды почти никто не играет но хочу;bad
42684;хочу поехать в ашан а со мной не кто не едет;bad
42685;андроид такой молодец я заказал инторнет пакет на 2 мегабайт а он сразу полез обновлять яндекс карты;bad
42686;упал очнулся штраф за хулиганство;bad
42687;rt обновил огнелиса дык firegestures отвалился ну чо за ебтваюмать кто нить столкнулся с таким;bad
42688;извини я в россию больше не отправляю;bad
42689;у всех моих дноклассниц члены бы были больше моего;bad
42690;у меня есть все кроме падме и р2д2;bad
42691;кому то не хватает денег власти а мне не хватает времени;bad
42692;в определенных кругах грят что ярче маляса домашнего но мне его не разрешают типа ваще никак нельзя;bad
42693;солнышко не греет холодно очень;bad
42694;ребята кто знал александра книгу прошу вас незабывайте его так как его уже нет снами фото его есть у меня в альбоме;bad
42695;ааа а у меня группа змеиное тупое логово бесит;bad
42696;rt сегодня на физике пришла смс физик отнял телефон прочитал и сказал теперь будешь делать уроки тебя парень бросил;bad
42697;вот хоть иди и покупай лазерный принтер для разводки плат;bad
42698;rt сука походу заболел вовремя;bad
42699;прошу прощение за спам был взломан аккаунт и не могу найти как удалить все сообщения сразу;bad
42700;и так 8 грузовиков;bad
42701;rt некогда объяснять просто спасибо;bad
42702;а я там дальше стояла и меня не напечатали;bad
42703;за окном такая погода мороз и солнце день чудесный эх я готова обсуждать что угодно лишь бы не учить политологию;bad
42704;rt вот так всегда только все хорошо и тут кто то косячит у всех так;bad
42705;на кураторском психолог пичкал хуйней на уровне первого класса моя младшая сестра прочитав 1 книгу по психологии и то лучше рассказала бы;bad
42706;вот так с но я все равно щас пойду в музыкалку потому что я не могу не играть на гитаре;bad
42707;ездил к стоматологу зуб сверлили пломбу ставили поеду сегодня первый раз к нему ходила именно на счет зубов а то так на счет пластинок;bad
42708;rt зашел на рпод поглядеть найти чего новенького и достойного а там сегодня рулят подкасты синтезатора 9 из 1 ти это ч;bad
42709;идти в магазин надоо за см ой лентой не охото и уже темнеет;bad
42710;зашел на совершенно безобидную страничку само;bad
