Num;Review;review_type
48553;rt как быть если не могу его забыть и как быть если продалжаю любить и;bad
48554;джеймс франко вечно засирает ленту в инста какой то херней не надо так;bad
48555;rt хоть одного упыря дезактивировали;bad
48556;rt дурында ты чего удалилась;bad
48557;rt ты с ума сошла;bad
48558;его лицо прям передо мной стоит будто вот вот смогу прикоснуться;bad
48559;как же меня заебали бессоные ночи хренеть как же заебался я от такой жизни;bad
48560;большинство людей вообще не понимают для чего нужны распределенные вычисления жаль;bad
48561;ну вот сегодня последняя серия молодежки придется ждать второй сезон;bad
48562;эх как же мой любимый челябинск меня подвел;bad
48563;ряску безвременья перевели как мантию террора;bad
48564;rt встал в метро еще и интернета нет;bad
48565;с утра болит голова и не проходит до сих пор;bad
48566;ипать опять температура похоже видимо придется завтра звонить на работу и отменять смену хорошо пар нет но долги же;bad
48567;обидно будет если у нас в городе не будет катка;bad
48568;нашла в плове волосы шеф повара первый раз столкнулась с такой ситуацией что;bad
48569;rt последняя серия молодежки сегодня жизньболь;bad
48570;одновременно в омске хоронили активиста избежавшего статуса узника совести а в москве продажные правозащитники пили вино с путиным;bad
48571;не знаю что то сегодня со мной не так такой день долгий и скучный вроде и норм день но даже погода не радует;bad
48572;хотел купить перчатки а нам нельзя в таких спарринговаться типа убийственные;bad
48573;седня у нас было задание написать 6 прав ребенка мы с челом списали с интернета а другой неужели нельзя такое легкое самим написать тупые;bad
48574;блин не хочу из яз переводить там много;bad
48575;я в рост пойду весной цветком или сосной а сейчас я мерзну;bad
48576;ставлю антиспам в адиум достали за последнюю неделю;bad
48577;вот знаю ведь что интуиция меня еще ни разу не подводила не хватает еще того чтобы кинули;bad
48578;просто супер у нас в классе осталось 5 челочек не доучимся мы до 9 класса;bad
48579;вообще не говори с ним бы школа процветала;bad
48580;выводы нам предстоит делать всю жизнь;bad
48581;одно единственное слово и человек уже никто для тебя;bad
48582;вот только сайта или программы где теги эти можно было бы найти не нашлось;bad
48583;у меня эта история творилась еще с первой версии этой чудо проги;bad
48584;может завести нового воображаемого друга и придумать ему имя а то безымянный наверно из за того что у него нет имени обиделся прости;bad
48585;кто знает не дорогие кофейни в самаре поделитесь пожалуйста именно кофейни не чайные не кафе с кофе и именно не дорогие если они существуют;bad
48586;антивирус ну блииин ну хоть раз утеш меня ну хоть разочек скажи что комп без вирусов;bad
48587;rt большой облом узнать что статуси про любов твоей девушки посвящены не тебе самый;bad
48588;я повернула голову и оттолкнула ее;bad
48589;я ленюсь готовить только для себя;bad
48590;rt я толстая в масштабах этой удивительной вселенной нет;bad
48591;заболела много таблеток пить надо из за них еще и голова болит;bad
48592;уже завтра в 13 продвигай хэштег юургу7 и получай сувенирную продукцию студенческий цент;bad
48593;антимайдан за что люди мерзнуть в мариинском парке абзац 11 12 2 13 через ценесм шно;bad
48594;пропуск аннулировали типа был оформлен на мертвую душу сказали идти куда то там писать че то не приду завтра скажу не пустили;bad
48595;семестры еще хуже удачи тебе;bad
48596;недостаток click to flash не работает не видно где надо кликнуть;bad
48597;завтра уезжаю к друзьям и к бабушке на выходные так что в тви с пятницы по понедельник меня не будет;bad
48598;но я посмотрела только 4 части модератор охамел и не стал выставлять 5 а там как раз все решается хотя матч уже закончился;bad
48599;как всегда я делаю че то не так зря я отказалась от поездки в воронеж теперь уже поздно;bad
48600;я загадала вчера желание в 14 15 но толку нету вообще не сбывается;bad
48601;симба меня ненавидит вырезала ей колтун и поранила случайно конечно вертелась постоянно теперь мы враги точнее я враг номер раз;bad
48602;rt хочу тату;bad
48603;санкт петербург горки не такие как раньше;bad
48604;усердно надо готовиться к проверочной по химии;bad
48605;rt опять споткнулся на грабли pthread при использовании std thread;bad
48606;сигна для;bad
48607;rt какие на острове поганые молочные продукты а несчастные творожки даниссимо стоят полсотни за штуку вот лажа;bad
48608;еще телефон разряжен ничто не скрасит мою жизнь;bad
48609;rt ах эта ипаная правда такиживем;bad
48610;а зря нужно кушать днем чтобы не хотелось вечером но кто бы говорил;bad
48611;конченый мастер не захотел подписывать дневник придется завтра снова ехать на завод;bad
48612;всю неделю без маськи скучаю;bad
48613;чуть опоздал и не досталось никакого сэндвича в перерыве descamp;bad
48614;опять у россии какие то проблемы не дадут спокойно котят пофотографировать;bad
48615;да уж повезло холоднющий ветер и мороз на улицу выходить даже не хочеться;bad
48616;я чувствую себя виноватым на английском в конкурсе угадай мелодию я перепутал ac dc с led zeppelin позор мне благо дело выручили;bad
48617;увидела в видеочате иисуса а этот говнюк не говорит по русски;bad
48618;ладно пойду посплю 1 5 и буду писать курсач;bad
48619;ходили в бассейн и ангелина порвала шапочку пришлось отдать свою;bad
48620;только хотела написать человеку она удалила меня из друзей;bad
48621;может быть и хорошо что не остается денег не будет обидно когда они сгорят;bad
48622;краткий анонс просмотренного мною трейлера;bad
48623;что правда то правда;bad
48624;rt да уж это просто отвратительно ощущение;bad
48625;58 лет исполняется уже такая не молодая не хочу чтобы она старела;bad
48626;эт фигня ток машины залединели скучаю по волжской степи по волгоградским пробкам мимими;bad
48627;хотел поиграть по сети в битву за веснот пишет ошибка синхронизации что делать;bad
48628;ура курсач готов осталось только защитить;bad
48629;уроды как так можно шубку бедная женечка;bad
48630;серость и унылость и эти невыносимые пробки;bad
48631;а у меня жопа всю неделю и завтра продолжение жопы;bad
48632;глаза мои глаза;bad
48633;завтра иду в школу и маму вообще не волнует что у меня болит нога;bad
48634;да но он не успел блин мне обидно до слез что жизнь не дала ему дожить;bad
48635;я почему то думала что ты меня младше о о;bad
48636;выбила палец на правой руке я проосто лох;bad
48637;я тоже sadplain только я сейчас опять уйду;bad
48638;rt что хоть у них эта дата особенная что ли o o;bad
48639;елки палки бедные попугайчики;bad
48640;libre fm не хочет принимать скробблы 68 штук;bad
48641;вот это жопа 23 января в 7 утра самолет 23 января в 11 утра экзамен ну ахуеть;bad
48642;4 серия боже смотрю ее забыв как дышать неужели последняя закон всех сериалов сделать 1 сезонов;bad
48643;не знаю когда зайду в вкшчку я такая занятая чика;bad
48644;rt хочу тату;bad
48645;мама назвала кошку проституткой кошке год с лишним домашняя не траханная несправедливо;bad
48646;до меня только сейчас дошел смысл первый раз увидел это на аватарке год назад;bad
48647;совмещаю несовместимое стивен кинг и трэп круто получается но мне пора на театралку;bad
48648;звук на ютубе у меня куда то бежит вперед на остальных видеосайтах все отлично;bad
48649;поездка за границу откладывается все деньги я просру в дроп дид;bad
48650;в упор смотрит какой то мент блять вдруг напомнила ему какую нибудь преступницу;bad
48651;звучит очень грустно поправляйтесь скорее;bad
48652;ужасно болит голова да еще и глаза слезятся ощущение будто умираю;bad
48653;ну бля почему именно когда зашел прижирок меня папа решил согнать с компа;bad
48654;rt о посмотрю как я второй астрал хотя мне и первый то не очень;bad
48655;а ты в ответ его бортуешь жестоко;bad
48656;счастливчик у меня тестовые приходят главное а так нет;bad
48657;няша перешла в самонетранспортабельное состояние стал умирать стартер;bad
48658;охохо как много нужно еще выучить до нг;bad
48659;нихренасебе помылся пришел к компу а жукобот навалил овер 4 сообщений о о;bad
48660;да все хорошо вы как я завтра уезжаю сейчас пенза уехала я так рыдала что завтра будет не знаю;bad
48661;сука у него прекрасно получается давить на жалость даже как то жалко стало;bad
48662;зашла в старую свою школу скучаю по ней;bad
48663;оу фак надо же отрывок из евгения онегина учить всетлен;bad
48664;посмотрела последнюю серию отбросов успела поплакать;bad
48665;родственницу в автобусе увидела а она меня нет;bad
48666;ох а я как же ты будешь занимаешься делом а я сидеть и смотреть ну нее мне скучно станет;bad
48667;rt вскрытие мышки не осилила жалко мышку;bad
48668;в какого ты такой ленивый бро;bad
48669;хер знает ехать завтра в бассейн или в спорт зал;bad
48670;та ну и хуй с ним с у меня еще 19 пальцев с;bad
48671;только домой пришла и опять на учебу надо идти;bad
48672;сегодня била контра по экономики такая тяжелая;bad
48673;ахах часов в 8 это будет жди моих слез в твиттере;bad
48674;как мне это развидеть скофилд в гробу перевернется;bad
48675;погулял я рук не чувствую ног не чувствую;bad
48676;блин загадили как киев ужас;bad
48677;уже дома короче дэбилизм оставалась 2 минут урока и в не выдержала спора с тупыми людьми и вышла;bad
48678;rt пока ира спит я потихоньку таскаю ее печеньки стыдно но будить не хочется;bad
48679;меня оо где почему я тебя не видела;bad
48680;хочу какое то платье;bad
48681;тренер опаздает на пол часа где мой партнер я не знаю зал закрыт одиночество;bad
48682;почему то обидеться на долго легче чем просто простить;bad
48683;эвакуатор еще дождаться надо да и в любом случае на всех не хватит да и сделают один раз а потом снова забудут;bad
48684;завтра химия уце жопааа как мне лень все учитььь;bad
48685;ага кучи дерьм в мариенском парке сам вступил;bad
48686;седовласый инженер сказал что удары током это вовсе не удары током а всего лишь статика и купи серебряные наручники я тебя заземлю;bad
48687;я болею и меня сейчас вряд ли выпустят из дома;bad
48688;я к ней стараюсь подкатывать а она ниразгаваривает со мной что за нах;bad
48689;завтра не приду в школу а значит не кого не увижу завтра целый день дома целый день;bad
48690;блин дома вроде не холодно а ножки ппц мерзнут;bad
48691;rt о о я тоже думала что у меня их 2 но их 222 твою ж мать 222;bad
48692;rt хочу тату;bad
48693;чистая правда крайне тяжело и что самое неприятное долго т е завалить можно кучу кого но за счет хила;bad
48694;ну вот и все последняя серия началась;bad
48695;ну нахрена надо было изобретать велосипед sdm теперь из под генты с msdn фиг чего утянешь;bad
48696;лето закончилось и снова мы появляемся в аське после обеда;bad
48697;я как узнал и осознал что в hs есть билды перестал играть;bad
48698;кот он чо пидар штоли а я на его концерт ходила такое надо на билетах писать попробывал бы он спеть в мичете;bad
48699;оооо нееет андрюшка обиделся на меня похоже;bad
48700;мне нужно написать еще 33 страницы для диплома;bad
48701;а я сегодня так и не долетел нас развернулись через 2 минут в воздухе;bad
48702;бляя что за неспроведливость;bad
48703;черт опять чувство потерянности хочется чтобы выслушали близкие друзья есть но слушать все равно никто не станет уж слишком я их знаю;bad
48704;мне сегодня снилась лига и опять в новых образах отдельно расскажу об образа стива и марка риса не было o o;bad
48705;меня заколдовали грязные ведьмы;bad
48706;жаль что я дашу закрыла;bad
48707;мою любимую часть пляжа разрушают что бы строить что то;bad
48708;купили найту строгий ошейник так жалко его;bad
48709;если папы не будет то не приеду;bad
48710;как же меня мучает жаба не могут микроскопические затычки стоить столько же сколько акустическая система от logitech;bad
48711;припомнила своих драконов вечности ну все блт я оказывается типичный моб камикадзе;bad
48712;пересмотрела фотографии на старом телефоне прослезилась;bad
48713;ладно ладно считать танкетку освоенной было плохой идеей мне еще учиться и учиться набивать и набивать мозоли;bad
48714;пора идти на работу опять тащить 5кг тротила;bad
48715;хуйня уроки алина педро и там еще где то 3 4 человека;bad
48716;я себя ужасно чувствую а мне еще на алгебру;bad
48717;посмотреть трейлер фильма с шивоном расстроилась хочу посмотреть этот фильм в кинотеатре но только у нас не покажут;bad
48718;досмотрел dance in the vampire bund концовка никакая благо в собственно процессе было что то интересное ну и мина;bad
48719;ну заебись а 16 ноября они выступали у алика в победе оказывается;bad
48720;q ведь эта правда причинила очень много боли a;bad
48721;и тут пришел лесник и всех разогнал а эксперимент получился бы интересным;bad
48722;похоже нейрохирургия будет самым тяжелым отделением для всех нас;bad
48723;я пишу с ошибками которые проходят через спелчекер;bad
48724;rt ну кааак заставить себя готовиться к экзаменам;bad
48725;ууу может завтра у меня пара в 13 2 начинается;bad
48726;привет лента извиняйте что я так мало сижу ибо неделя загруженная какая то;bad
48727;8 серия misfits великолепна невероятная игра актеров даже не верится что 5 сезон подошел к концу;bad
48728;никакого постоянства я либо в истерике либо в облаках а сегодня я в реальности;bad
48729;меня узнал по голосу чувак который в посл раз меня видел и слышал года 3 назад o o;bad
48730;хотел было вдуть но она уже тетя как быстро женщины стареют сегодня тетя завтра глядишь уже мамаша а после завтра;bad
48731;и мокро и грязно у меня ботинки вообще промокли;bad
48732;а потому что не готовы и сценарий сырой короче кошмар;bad
48733;че ты мемчиками говоришь;bad
48734;я же еще недавно спрашивала у бабушки уверенна ли она в том что вика так не поступит и она ответила что уверенна;bad
48735;о да и завтра у нас родительское собрание точно нечего хорошего не скажут ахахв;bad
48736;куда ты подевалась красотка наша без тебя в ленте какая то невосполнимая дыра;bad
48737;оо нифига а ты его часто роняла я вот недавно тоже свой уронила ровно блин на кафель gt lt и боюсь теперь за него;bad
48738;капец в субботу собрание а у меня оценки плохиее;bad
48739;rt еду домой одно опасение не подтвердилось но зато спина все таки;bad
48740;а мысли все о ней о ней о курсовой;bad
48741;rt я только пору часов тыкаю xsl xslt и уже хочу изнасиловать создателей;bad
48742;нашел парку своей мечты но 2;bad
48743;покупать за бугром станет дороже печалька чего только почта россии не протолкнет чтоб не работать;bad
48744;завтра последний денечек но на 2 работы;bad
48745;ооох милости мои остались без привета;bad
48746;что так в январе то приедешь;bad
48747;блин я тож хочу чтоб для меня ктонить песню написал;bad
48748;тоже норм я ужасно замерзла у нас сильный ветер и снег что делаешь;bad
48749;вово я как то погуглил и охуел;bad
48750;нет ее сегодня все видели;bad
48751;rt предел одиночества это когда подарок на новый год покупаешь сама себе;bad
48752;мы еще не обсуждали с ним это;bad
48753;rt эххх жалко что даже я не смог с ней поговорить;bad
48754;rt страшно заебали милые парни из эстонской elisa третью неделю тащут мне инет;bad
48755;rt билайн дисконнэктинг пипл уйду от них;bad
48756;оу так же все ничего не изменилось ну это очень плохо с;bad
48757;а я болею еклмн на 13 можно и дуба дать;bad
48758;вообще никак если бы я щас дома не сидела не болела она бы отпустила а так нет сказала будешь на уроках сидеть;bad
48759;хочу кинуть три фоточки но не могу придумать подпись которая бы на 1 отразила весь смысл моей тончайшей мысли и едкой шутки;bad
