Num;Review;review_type
46303;rt ресторан у могил или чем удивляет индия самые интересные места энциклопедия путешественника;bad
46304;rt недостаток обнимашек в организме;bad
46305;вот поэтому наша страна и разваливается потому что каждый хочет спиз ть а не заработать;bad
46306;паробайк велосипед на паровой тяге 8 чувак жжот чесслово;bad
46307;пипл ху донт фоллоу бэк 13 один литал меня любит родненький мой;bad
46308;rt прости меня десять раз еще это напишу;bad
46309;ты же не умерла а дядя леня по твоим словам коньки то отбросил;bad
46310;целый день хочется плакать и жалеть себя ну а кто если не я меня пожалеет;bad
46311;фу фу нобель отговорки в пользу слабых не ожидал от вас научитесь держать удар будьте мужчиной а не нойте на всю страну;bad
46312;уже настроилась завтра буду плакать последняясерия молодежка;bad
46313;даже свитер меня не греет;bad
46314;бриться или не бриться с одной стороны лень а с другой стороны не красиво;bad
46315;жить без всяких там чувств кому либо довольно скучно если честно даже не повыносить мозг подругам;bad
46316;rt так налажать в задаче по математике могла только я обидно когда знаешь как решить но делаешь расчеты неверно;bad
46317;rt прощаться с ноготками так грустно;bad
46318;rt ты не один я тоже такой;bad
46319;rt тупая алгебра тупая физика тупая химия все блядь тупое;bad
46320;проспала сегодня до 9 вечера не высыпаюсь жутко потому что опять спать хочу;bad
46321;у некоторых людей такая сложная жизнь слушаешь и мозги кипят и все началось с банальной ссоры из за whatsapp в итоге измена и развод;bad
46322;сегодня разревелась на остановке потому что там лежала собачка и мерзла;bad
46323;та это вообще бедажизнь я расстроилась капец очень хотела вас видеть;bad
46324;ох я не заметила ничего из перечисленного вот переоделась бы мужиком;bad
46325;как же грустно что я сама не знаю что хочу на новый год;bad
46326;так ты со мной общался только ради потрахушек;bad
46327;яб термос принесла но його нема;bad
46328;ахахахах завтра опять к первому поспать нам не дают;bad
46329;так как инет не работает слушаю музыку на компе а она за 2 8 2 11год это срака полная;bad
46330;не у меня если первую передержу заносит со второй стартую заносит надо где то на 1 переключать;bad
46331;мамулечка затемпературила выздоравливай побыстрее;bad
46332;как оказалось зловеще и страшно и жутко а еще свистел родители не хотят его выкидывать;bad
46333;все равно придется менять;bad
46334;бля боже мой это так смешно я думаю всем ну это наверно правда смешно а меня выворачивает не могу я уйти и все но я так хочу что корючит;bad
46335;ну что там не будет никакого кипиша;bad
46336;бфу бфу так начать и так закончить игру basketball bfu;bad
46337;завтра самый драматичный день и что мне делать после 21;bad
46338;ну когда я перестану любить бывших чувствую себя мудаком а ведь все равно люблю;bad
46339;не хочу чтоб мамочка плохо себя чувствовала;bad
46340;что за херня блять никогда раньше не было такого;bad
46341;тибя не оставлял я заболел и страдаю а ты мне не пишешь и я в печали;bad
46342;rt к концу выходных на дороги выезжают пидарасы будьте аккуратнее;bad
46343;сегодня ревела на моменте когда вазген защищал девушку;bad
46344;вот так вот все печально;bad
46345;в яндекс календарь есть список дел но он неудобнее чем задачи в google;bad
46346;потому что в это время у меня урчит живот не норма;bad
46347;очень хочу себе машину планирую в течении зимы себе ее купить;bad
46348;это нормально что у меня непонятно с чего уже несколько дней в мозгах верится тема воланда из сериала мастер и маргарита о о;bad
46349;тебе же хуже я хоть что то попыталась сделать;bad
46350;даа но такова наша тленная жизнь просто она чудовище которое говорит что занято а само сидит в инете а я набиваю;bad
46351;rt 5 причин почему книги лучше людей 1 книги умные 2 они не предают 3 всегда с тобой 4 не прихотливы 5 ими мо;bad
46352;нам сегодня пиратов прислали 4 монеты из серебра ручной работы мы на них только полдня успели полюбоваться;bad
46353;этим ничего не решишь умрешь а все рыдать будут;bad
46354;похоже на мои беседы с одним гражданином;bad
46355;ну хотя на врятле мы видится будем;bad
46356;хах жуйка не понимает многострочные статусы;bad
46357;и еще скучаю по твитам арбузовой в ленте вечно кого то не хватает;bad
46358;курсы хуюрсы как насчет в кино на холодное сердце в полпятого;bad
46359;новости в международный день гор оон напоминает о роли горных массивов в устойчивом развитии радио оон;bad
46360;она сейчас полностью ушла в инстаграм;bad
46361;дождусь окончания полугодия пока переходить смысла нет;bad
46362;rt аа бедный макеев вот уроды;bad
46363;лондона о о rt главная елка города ну;bad
46364;конференция блять жюри блять а я грущу;bad
46365;rt хочупровестиновогоднююночьвместес;bad
46366;rt завтра последняя серия молодежа;bad
46367;блять вырвало пиздец и еще сердце болит щас умру нахуй;bad
46368;как некоторые люди находят силы чтобы почитать перед сном мне бы зубы почистить и до постели доползти;bad
46369;тогда может ты просто ответишь мне и мы все забудем как хочешь короче мне надоело;bad
46370;да пиздец какой то я как капуста сейчас;bad
46371;ага в ворота шайбу затолкать праздник а больше двух забросить сенсация очередной унылый сезон это ответка за пана;bad
46372;у меня вечер воспоминаний;bad
46373;мое детство закончилось тогда когда меня позвали не кушать а готовить;bad
46374;тараскина зашла в твиттер с кристинкиного компа;bad
46375;ахахаха сука но я так люблю ее;bad
46376;мдаа куда мир катится всеее это финиш;bad
46377;не хочу хочу чтоб сбылся сон;bad
46378;и как дальше жить заключительнаясериямолодежки;bad
46379;ахахаха ты заметила эту свэг жопу в бум юсла ахаха почему никто не отреагировал на эту сочную задницу кроме меня;bad
46380;женя о я ничего весь день от скуки мучилась;bad
46381;завтра последняя серия блиин что же мне теперь делать по вечерам;bad
46382;rt утро ты заебало приходить в 6 вечера;bad
46383;температура головная боль красное горло да здравствуй зима как я скучала ненавижу болеть;bad
46384;об дно;bad
46385;у меня началась зима того года это очень печалит это именно то чего я очень боялась;bad
46386;вспомнила наши рассветы с лагодой;bad
46387;rt завтра заключительная серия;bad
46388;2я страстная ночь с конспектами 5 работы;bad
46389;дад я уже сдала 4 перездачи и еще 3 надо завал и мне еще 3 стиха тож рассказать надо;bad
46390;rt не судьба мне быть отличницей в этом полугодии мама расстроилась не люблю ее огорчать да и у самой нет настроения;bad
46391;пока что я не верю в счастье;bad
46392;работы нет мобилы нет денег нет пришлите пару тыщ к новому году или пожелайте самому справится со всей этой хренью;bad
46393;тоже спать уже пора батарея садиться с компьютером что то неладное так что вообще ужас;bad
46394;да уж шантаж и унижение основа политики режима азарова януковича;bad
46395;rt завтра к уроки не сделаны сумка не собрана в чем идти в шк хз оценки говно хочу спать а так все заметил;bad
46396;ну где никита где лера где настя ну почему все ушлииии;bad
46397;rt завтра последняя серия молодежки печально;bad
46398;не могу слушать музыку из гли потому что хочется рыдать;bad
46399;клименок вот как так то а;bad
46400;кроме джастина у меня мальчика нет а о нем я и так всегда думаю но причем тут сон у меня не получается уснуть просто;bad
46401;q cрочно зaйди на стpaницу ib 1734274 caйта b koнтактe это касается тебя и иры a;bad
46402;rt самая точная подборка выражений лица которые я использую каждый день;bad
46403;вот так вот но вроде весной обещают второй сезон;bad
46404;ну да трезвое как стеклышко хе мда;bad
46405;не сфотала свой зимний лук в примерочной чувствую себя неполноценной;bad
46406;как то все поменялось все за эту неделю;bad
46407;аххаха жалко такое редко быват я б сегодня посмотрела во сне еще что нибудь упоротое 3;bad
46408;rt воувоу полегче;bad
46409;и я очень люблю маму и не хочу ей причинять боль но телеф был на без звучке;bad
46410;прими мои соболезнования;bad
46411;ааа грохни пожалуйста мой первый камент с длинной ссылкой адресом ошибся;bad
46412;вопрос о ремонте решился сам собой в америку не едем;bad
46413;rt мне просто нравится мальчик и я боюсь ему признаться;bad
46414;rt все равно обидно за восьмерку;bad
46415;тупой желудок так больно прям как иголкой;bad
46416;позвоните мне не могу уснуть без разговоров перед сном;bad
46417;rt ты бы никогда не предположил что это тот же самый мужчина который мастурбировал на сцене перед тысячами;bad
46418;а призеров в 8 9 и 1 классах все равно нет;bad
46419;так то оно да люди меняются на глазах;bad
46420;минск одна большая деревья где все друг друга знают;bad
46421;все у меня плак плак почему я дуб в физике и математике я бы сейчас не ныла самый замечательный чел которого я знаю ааааа;bad
46422;rt я не могу поверить то что завтра я последний день смогу насладиться молодежкой;bad
46423;за маленьких норка замолвите слово много страшных картинок из жизни норок мну опечален до невозможности;bad
46424;я тоже люблю такие моменты лол rt круто когда понимаешь о чем пишет таня даже когда это твит о о хд;bad
46425;началось кто то и соседей начал сверлить плачет ребенок;bad
46426;волна ретвитов от неуровновешенных баб прошла;bad
46427;я ненавижу когда ты грустишь это передается и мне;bad
46428;оу нет завтра последняя серия молодежки;bad
46429;меня ирина михайловна отвлекла и я не загадала;bad
46430;как обычно у меня на столе бардак;bad
46431;rt ска завтра по нем яз будем писать диктант и здавать зачеет епт а слов так много я нечего не смогу выучиить;bad
46432;аааа я не загадала желание все эта русская литература;bad
46433;глобальный черт возьми мир в англии забастовка на почте и где теперь мой товар а;bad
46434;я в этой школьной форме на какую то секретаршу похожа;bad
46435;такое чувство что все что я учила просто растворилось голова вообще не работает;bad
46436;я вчера смотрела и испытывала отвращение ко всем кроме хрусталева и его семьи и все оказались конченными кроме него;bad
46437;да я к нему даже не подхожу почти он первый меня бьет;bad
46438;rt в анапе выпал второй снег о о;bad
46439;бля как то и шпоры не читаются к кр я вообще не готова;bad
46440;опять ты объявился в моей жизни и зачем так все хорошо писались с тобой только ты на писал одно слова так все сразу как отрезало;bad
46441;пришла домой около часа назад до сих пор согреться не могу;bad
46442;переезжаю впервые я не хочу уезжать от сюда;bad
46443;ох а я свои грабли люблю прыгаю с разбега;bad
46444;блин вот это дааа успокоится не могу бедный губка боб;bad
46445;завтра последняя серия отбросов черт пойду поплачу что ли если они убьют руди или джесс я убью их misfits finalepisod;bad
46446;rt не могу поверить что уже закончила школу и у меня уже был последний звонок выпускной и больше уже никогда не будет как то бы;bad
46447;rt а комсомолка за тридцатое аж;bad
46448;чувствую слееез завтра будет ибо завтра заключительная серия молодежки;bad
46449;у меня дома тепло у романтика холодно;bad
46450;rt еще раз на бис спец для вас тупость и зависть некоторых людишек неистребима;bad
46451;что за напасть со страшной силой болит живот и но шпа не помогает;bad
46452;rt сегодня разревелась на остановке потому что там лежала собачка и мерзла;bad
46453;а вася теперь в 2х часах езды от кости и не уговорить женю проплыть к косте в гости;bad
46454;блиииин только не забирай меня боль на эти дни;bad
46455;просто встретились взглядами и проехали мимо а могли бы вскоре жить в одной квартире;bad
46456;rt просто есть те с кем забываешь обо всем;bad
46457;в садик и на работу пора;bad
46458;я вообще в шоке;bad
46459;азаза затралил 9;bad
46460;rt на счет три открой глаза и увидишь рядом с собой спящего луи;bad
46461;нуу я не плачу но все равно жутко обидно что фильм не покажут в наших ср ных кинотеатрах;bad
46462;это пипец стооолько выучить надеюсь она садить не будет;bad
46463;можно я просто буду верить что на настроение так сильно влияет зима которую я просто терпеть не могу;bad
46464;почему то не мое стихи сказки и т д;bad
46465;rt я думал что мне все равно мне же не все равно как же больно теперь он с другой сама ви;bad
46466;особенно это относится к я так рад был видеть ее в ленте;bad
46467;зай прости что провожу с тобой мало времени ты очень нужен мне но сейчас надо подналечь на учебу пойми меня люблю тебя очень сильно;bad
46468;rt как же их жалко а я сначала и не поняла курьеры оказались глухонемые парни деньги зарабатывают их понять можно;bad
46469;rt а кто мне объяснит почему в украине священники на стороне народа а в рф на стороне царя;bad
46470;що трапилось з limp bizkit;bad
46471;вот это да не могу вообще без них теперь;bad
46472;тяжело а близких мне людей рядом нет придется плакаться подушке;bad
46473;я все же думаю еще один вариант ей предложить поритмичней та песня ничего но честно сама ритма не слышу;bad
46474;рома предъява почему анонса не было пропустил;bad
46475;rt просто чудно захотел сутра поесть а хлеба нет в доме все ближайшие магазины закрыты;bad
46476;боже что твориться в стране мне стыдно;bad
46477;rt слушаем с владой нервы какая же ностальгия;bad
46478;как же иногда хочется начать жизнь заново изменить все свои промахи ошибки;bad
46479;rt а вот это врятли власти это понравится;bad
46480;rt найлушу тебе в постель 3 пхпх;bad
46481;скучаю с каждым днем все сильнее и сильнее;bad
46482;не хочу завтра в шкооолу сложный день 2 химии 2 зарубежки геометрия физика и сверху еще право о неееет;bad
46483;дааа я приеду в дортмунд и марко даже не посмотрит в мою сторону;bad
46484;rt и ниче делать не хочется и сна ни в одном глазу;bad
46485;ээээх почему нас тогда с ивановой не было дали бы жару кискам;bad
46486;отправляющихся в киев львовян инструктируют как выжигать беркут;bad
46487;вот блядь в одном моменте моего тизера вероника сделала крутейшую звуковую фишку но она никому не нравится кроме меня;bad
46488;передай что я по вам обоим соскучился;bad
46489;есть такое подсаживаешься;bad
46490;а еще я сегодня забыла загадать гребаное желание жизньболь;bad
46491;я тоже вроде и неплохие же люди;bad
46492;сделай пожалуйста и для меня пиар а то меня игнорят;bad
46493;а я надеялся что комп в мое отсутствие много всякого хабара скачает и раздаст;bad
46494;rt блин я тебя не могу читать;bad
46495;да но я там только один вечер была недолго;bad
46496;жизнь боль когда в палате бабулька храпу дает моя последняя ночь в больнице;bad
46497;нахуй мне сдалось в 12 3 ночи уйти спать;bad
46498;я не могу хочу в лс один день и я бы поехала обидно ааа;bad
46499;иногда замечал что сгоряча находясь в гуще событий легко бросаюсь в бой а потом вижу что зря;bad
46500;rt завтра заключительная серия молодежки бедаа;bad
46501;завтра у саши турусова др прости;bad
46502;приз смогу получить только с чеком ну конечно же мама его выбросила однако я реально лох по жизни;bad
46503;я на пипу тут похожа лучше бы вторую скинула где ты на пипу похожа ухахаха;bad
46504;в твоих словах сейчас я вижу слова другого человека;bad
46505;это еще надо как то выучить;bad
46506;нее когда ногами ахахах когда ахаха честн не помню я тебе завтра в шк покажу как меня прикона пиздят;bad
46507;главное чтобы завтра в больницу не положили иначе накроются все планы;bad
46508;я могу ретвитнуть все но почему то твое не могу;bad
46509;я каждый день задаюсь этим вопросом и ненавижу себя за то что мы до сих пор не встретились но знай я о вас вспоминаю всегда lt 3;bad
