Num;Review;review_type
23731;я правильно же понял чьи это две палки на заднем фоне;good
23732;практически вообще без сна около двух дней а вообще мне нормально вполне;good
23733;почти десять часов а на улице еще темно с добрым утром красноярск;good
23734;rt мне сегодня приснилось что у подросла доча варя и была маленькая валя надеюсь он когда нибудь будет ве;good
23735;гулять d я тебя сюка 2 5 месяца не видел lt;good
23736;это были отличные выходные продолжим завтра в чердаке;good
23737;rt занесло сегодня лентой на вконтактике такой вот шедевр сурковской пропаганды;good
23738;rt дай бог счастья каждому подписчику спасибо;good
23739;сегодня снилось что я взяв банку милкиса полетел вообще пиздец а ваня в меня кидался мячом баскетбольным что за жесть ахаха;good
23740;ага не спишь до сих пор это очень вредно;good
23741;rt я никогда не забуду эту ночь у костра d lt 3;good
23742;rt manyaнезаметно супротся подкралась d;good
23743;rt хотела позвонить и сказать что соскучилась но взглянув на время подумала не стоит до завтра трудяжка;good
23744;единая россия огласила о том что они готовы вступить в коалицию со справедливой россией таким образом у тварей 63 мандатов;good
23745;rt куплю подарки новогодние в иркутске и;good
23746;just completed a 7 16 km run куала лумпур 3 тыс джоггеров и бегунов хорошо runkeeper;good
23747;гаишники ходят в бронежилетах на плече сумка с противогазом с чего бы это;good
23748;забавно как люди в возрасте удивляются входящим звонкам на мобильник;good
23749;как же я все таки люблю наши фильмы и наших актеров вот сижу смотрю елки 2 и наслаждаюсь;good
23750;тошетий сегодня упал со стула и не дай бог ты напророчил ему что то плохое тьфу тьфу у меня три кошки и крыс и все отлично;good
23751;дружить со мной ты не должен дружить с головой d;good
23752;штольц укрылся белым одеялом;good
23753;спасибо друг починилось теперь aspell проверят и русский и английский красота если что то вот рецепт;good
23754;пипец как вы не путаетесь в этих жуйкоских командах ничего все выучу;good
23755;мы в своей жизни хоть раз делали то что могли бы прокомментировать видеообзорщики;good
23756;я не буду мстить я просто изменюсь и все охуеют хорошо сказал;good
23757;лал мне было весело d;good
23758;о всемогущий гугл найди мне любовь;good
23759;любимый друг женя человек который значит для меня многое жень с тебя лайк если ты вдруг;good
23760;rt стояк ты не похож на сайрус ты линдси лохан;good
23761;раз живем неужели я себе по молодости не могу позволить глупостей;good
23762;поздравляю всех с днем св валентина а особенно мою самую любимую вторую половинку я тебя люблю;good
23763;тэр олон хар юмнууд суужихад х е аанхаа гээл тээл чи танихуу даа хаха d;good
23764;кто то просыпается а спать пошел спокойной эммм на хуй знает;good
23765;это книга просто потресаная это глава просто мммм нет слов;good
23766;про футбол футболисты клуба канзас сити стали обладателями кубка mls спорт футбол;good
23767;немного о футболе футболисты клуба канзас сити стали обладателями кубка mls спорт футбол;good
23768;это конечно хорошо но надо как то спать всем сладких;good
23769;разлюбила проебала не нашла разъебала подъебала наебала и ушла d;good
23770;впрочем у меня не было таких возможностей ff follow;good
23771;альтернатива акции coca cola с крышечками собери 1 люков и получи п зды от жкх;good
23772;я чувствую как я горю у меня температура класс;good
23773;отдам готовый блог о путешествиях;good
23774;нафиг конец света у меня воду горячую на 3 недели откляючили это куда похлеще будет d;good
23775;так выглядишь как будто прививку в детстве намочил;good
23776;rt зима у нас короткая но красивая;good
23777;м как я его обожаю особенно когда мы прощаемся всегда спрашивает зая любит заю;good
23778;ночь скайпа и смеха 4 утра самое время идти спать доброй ночи всем че;good
23779;отхожу от компа на диван но не спать но все же спокойной ночи;good
23780;rt дождались официальный трейлер иван царевич и серый волк 2 смотреть всем толи еще будет;good
23781;ммм это просто непереодаваемое ощущение когда все хотят твоего парня а он только твой;good
23782;бы не хотели утром в туалет мы бы спали вечно d;good
23783;гадагшаа л гэсийшд худлаа хэлжилдээ d;good
23784;надо быть твердым как лимонов и четко знать где твоя позиция;good
23785;сестра подсела на sonic unleashed демку третий день не может пройти;good
23786;помнишь мою историю про депрессию и 6 раз в день душ;good
23787;что может быть приятнее чем наблюдать растерянных полицейских которым не удалось на тебе выполнить план и получить премию;good
23788;одиночество это когда ты шугаешься звуку входящего сообщения в асе;good
23789;на самом деле я в шоке с того что происходит;good
23790;что тоя сегодня очень много успел сделать но не того вообще бывают такие дни когда работается а бывает когда даже;good
23791;уф тренировка заряжает чем то хорошим пока не приеду домой и не начну думать о чем нибудь;good
23792;всю ночь напролет на морозе один заебца;good
23793;вромайдан я им предлагал гуманитарные бомбардировки так лаются как псы;good
23794;по следам красноглазики анально огородились пукнули какашкой и сидят радуются как мало надо убогим для радости а;good
23795;нет рано утром очень тяжело встать если тебе никуда не надо а если надо еще тяжелее;good
23796;тут сказали что россия умом славится мы все умные тут поняли;good
23797;rt если серьезно то мак мне нравится все больше и больше осталось решить 2 а вопроса и будет вообще щастье;good
23798;рахмет бару а тырсамын й саба ын о ан дей н жасп тастап;good
23799;скоро будет свежий релиз maxsite cms теперь кэшировать можно хуками;good
23800;самая лучшая люблю тебя зая моя с днем рождения;good
23801;неужели вы думаете что это действительно какой то пиар ан нет да и с проблемами домовых территорий несколько не по адресу;good
23802;rt циничный привкус богемная вязь и беспросветный гламуррр;good
23803;хожу по квартире в майке и в трениках вокруг бардак я истинный мужик;good
23804;ну и я как добрая душа простила эту нелепую выходку;good
23805;вечер замечательный но таких мудаков свет еще не видовал;good
23806;таксь дома на ноуте все слишком красиво стало пора на раоте красиво делать d всем утра;good
23807;вон та старушка никак не найдет нужную платформу о;good
23808;rt ребят че делаете тихо ты мы спим ааа кошечки и зайка мимими коты кош;good
23809;улыбка вещь непонятная ее надо уметь понимать всегда нужно учитывать ту примесь с которой она подавалась;good
23810;я хоть с кем то нормально поговорила и да он любит элвиса d;good
23811;rt минут 5 диктовал мыло по телефону девочке секретарше;good
23812;надоело все возьму веревку найду ветку покрепче и будь что будет сделаю качели и буду кататься;good
23813;мне почему то казалось что вы не могете матюкаться и алкашничать не знаю даж почему забавно так;good
23814;нет не очевидно наоборот провокационно загадочно вот я и копнул немного;good
23815;добавлю немного ванили для девочек вобщем маленький хомяк;good
23816;rt ну що москаль вромайдан ua укра на украина евроинтеграция майдан;good
23817;поможет нам сосед на экзамене d;good
23818;хотя по идеи сегодня очень тяжелый день в смысле с утра с 8 утра вот только не ясно когда этот тяжелый день у меня начнется;good
23819;ха а у меня традиция на каждое 1 июня кушать торт а у вас;good
23820;обращаюсь ко всем кто мало ест и плохо спит не парься запарь лапшу d;good
23821;меня мама сердитым снусмумриком называет d;good
23822;byetwitter стефани скотт с днем рождения надеюсь ты хорошо проведешь его райли;good
23823;и на десерт человек всегда недооценивает количество идиотов которые его окружают;good
23824;паричок и марина вы мне фото свои не отправили еще поэтому буду валюшу пока делать;good
23825;возможно будет уже поздно возможно просто торопясь скажу вам лента осторожно желаю счастья и удач;good
23826;rt хочу жить хрен пойми в какой квартире в крае зато весело было d;good
23827;rt сегодня я вне зоны доступа просто сеть в счастье не берет;good
23828;вспомнила твит о том что он не годен и решила сказать ему что он негодник;good
23829;ходила сегодня папу встречать с работы в 9 утра госпоодии как же классно на улице хоть и холодно иней на деревьях красиво до ужаса;good
23830;rt они посимпатичнее то принца не могли найти такой уебищный это который блондинчик;good
23831;rt сильное сочетание и успокоится можно и мультики посмотреть;good
23832;как же радует отсутствие понтов при наличии здравых амбиций хотя отсутствие понтов всегда радует;good
23833;rt сегодня наконец увидел почти четыре месяца не виделись лол;good
23834;rt да пора сладких снов моя маленькая шлюшка о это была ахуинная упоротая ночь ddd;good
23835;помню когда я только начинал выполнил пару заказов заработал денег оттянулся follow;good
23836;кароч у меня через 4 минуты лента начнется а я в халатике еще дома сижу так что ну нахуй не пойду никуда;good
23837;эс билигин да крутой киинэ же про динозавров;good
23838;ну как всегда все только встаю а я ложусь спать конечно это же я;good
23839;rt твиттерчид заал авч байна анх удаагаа очлоо дажгvй шvv;good
23840;что поделать ошибки то нет другое дело что не все умеют к месту применять такие обороты;good
23841;с денисом переезжаем в норвегию берешь пример с нади она тоже в норвегию переезжает;good
23842;все будет главное не отчаиваться;good
23843;но поскольку тебе придется видеть этого человека снова follow;good
23844;посмотрела темный мир русский фильм этим все сказано зато музыка неплохая в фильме;good
23845;я настолько хочу играть в silent hill 4 что смотрю по нему летсплеи d все вируалки что есть у меня не работают;good
23846;блин соскучилась я по этому дебилу хоть имя такое же и то прикольно и не одиноко;good
23847;елки 3 елки 3 елки 3 скоро;good
23848;rt приехали на гостинный двор в первотег град тут затусовались вассерман поташев выиграть шансов мало;good
23849;на концерте ляписа 7 декабря в стереоплазе ляпиструбецкой концерт stereoplaza;good
23850;полярная ночь темно настолько тихо и спакойно и только снежок под ножками хрустит мм;good
23851;после померяшек членами в керсах меня ничего не удивляет х;good
23852;er nalim с какими то бомжами на аматорке гамал;good
23853;jotaro p s прошу прощения за вброс накипело просто;good
23854;быстро оторвались от интернета и поехали со мною в лето быстро оторвались на краю света где то там даже зимою лето;good
23855;rt круто побит небольшой рекорд на одном моем небольшем проекте 4 уников за вчерашний день;good
23856;сегодня по каналу нвк в 19 3 начнется битва стилей интересно кпц;good
23857;элина красотка моя школа сама бы втащила что самсону что габозу лошки недоделанные;good
23858;rt жуйк чем ты пользуешься для копирования dvd video дисков на жесткий диск;good
23859;позвони мне позвони я теперь ведь х й отвечу ff ru;good
23860;rt а я вот сделаю свой openid для себя любимого;good
23861;должен уходить из дома с полным желудком и пустыми яйцами;good
23862;ахаха уже утро пиздец доброго всем не ложился еще не помню когда в последний раз такую ночь не спал и проебал экскурсию;good
23863;доброе утро всем кто просыпается сообщаю на улице отличная погода;good
23864;ололо жуйк не дает ответить на свой пост пока сам себя не добавишь в белый список;good
23865;ахаха воду не вытерли и две сразу подскользнулись d у второй падение эпичней;good
23866;где тебя носило говорили родители а она летала в облаках победителем статусы взаимныйфолловинг;good
23867;с появлением контакта стало сложно встречаться с двумя парнями одновременно;good
23868;я честно говоря не рассчитывал попасть в призеры;good
23869;я сцуко не убиваем когда я собирался то не нашел ни одного целого носка и тут я увидел степлер;good
23870;у русского рока есть огромная сила эта сила лечит мою душу follow;good
23871;сегодня ходил отрабатывать два пропуска по физре первой парой и третьей вобщем в конце первой пары препод сказал а должники остаются;good
23872;офигеть пацан крутой если любишь стихи подходи завтра на автобу свесса шостка я тебя встречу ххахахахахах ржуу романтик епт;good
23873;офигенный день день позитива бегал как идиот целый день танцы офигенны хоть я и ракал но мне очень понравилось;good
23874;она встречаемся в 7 вечера там же и если кто то из нас опоздает он то я подожду teamfollowback;good
23875;работники метро не обнимаются им нельзя прижиматься;good
23876;а до шестого класса все шли на красный диплом d;good
23877;rt навеяно недавним обсуждением такие девушки тоже бывают и они не проститутки;good
23878;пишу другу еще дуешься а он мне нет уже лопнул убило d autofollowback;good
23879;я только дома появился сижу жду сообщение любимой что она доехала вечер было день рождение семы был потрясающий;good
23880;да все останавливается планета ускоряется;good
23881;солнышко я тебе кисель приготовлю и кашку сварю;good
23882;доброе утро всем сегодня в ростове стартует школастудвесны встречаем участников;good
23883;вот бланк твоего отца он вам понадобится для паспортного стола o teamfollowback;good
23884;всем сладких снов пусть завтра будет такой же чудесный день;good
23885;случайно прочитал вывеску купля продажа недвижимости как купля продажа ненависти эх жуйк что ты со мной сделал;good
23886;родители постоянно выбивают из меня дурь но я знаю где взять еще;good
23887;аххаха а почему он взорвался а аргумент дай а изза чего все проихошло а какая проблема у тебя ахахахахахха;good
23888;rt разве это не прекрасно проснуться с человеком о котором постоянно думаешь обожаю эту жизнь полную тайн интриг и неожид;good
23889;не удивило что украинский националист еврей;good
23890;дико хочется спать но я заставила себя встать с дивана и поехать в трактор делать добрые дела вот такое воскресенье;good
23891;rt не увеличивая картинку скажите что вы на ней видите мб это уменя глюки но я очень долго втыкал что именно тут нах;good
23892;rt однозначно я погнал на встречу счастью;good
23893;лучше мальчика для гармонии;good
23894;вот и свершилось чудо мне надоел интернет надоели компы надоело все хочу учиться;good
23895;rt а вот не купить ли мне еще одну точку доступа с блэкд блин с 8 2 11n и usb;good
23896;камрады у меня скоро день рождения 8 марта да есть желающие меня поздравить пришлите мне открытку в конверте по;good
23897;я тут налево и направо пинки раздаю может и тебе парочку сорок второго кюхеновского d;good
23898;а я люблю его он мне нравится и хрен кто догадается кому это посвящается;good
23899;я бы не отказалась от чего нибудь сладкого и побольше побольше;good
23900;у меня ноги короче чем у твоей новой девушки нос d;good
23901;никогда не знаешь кто твои друзья 8 autofollowback;good
23902;rt я на паре как дельфин сплю с одним закрытым глазом;good
23903;что ты делаешь смотрю сериал и убираюсь;good
23904;rt сегодня по каналу нвк в 19 3 начнется битва стилей интересно кпц;good
23905;я ведь не собирался этого делать autofollowback;good
23906;авиаколлапс в англии что это предвестник гибели империализма;good
23907;только выражение услышал паршивая овца в бочке меда;good
23908;я через 5 дней в норильске буду и нг в там будет нь я про него ни разу не думал еще поэтому и спросил правда не понимаю;good
23909;он предложил выйти за него замуж а ты какой на фиг муж у меня до сих пор глаза горят при виде ледяной горки;good
23910;rt фэс жиргээнд их том том яридаг н хд д амьдрал дээрээ ихэнхдээ б рэг зожиг аймхай х м с байдаг гэнэ ш;good
23911;если мне нравится запах человека то неважно как он выглядит нуууу не совсем неважно но он подходит;good
