Num;Review;review_type
28752;вот ппц что творится мне кажется мне тебе лучше все открытки и няшности дарить лично а то на почте все с ума сходят d;good
28753;самое смешное что все это с удовольствием подхватили теперь дорогие часы не покупают не потому что нет бабла а потому что это типа не модно;good
28754;ахуенно и пиздато только чипсы улетели d;good
28755;я смотрела половину фильма и твиткам каждый день любимые моменты смотрю;good
28756;ничего особенно в них нет только циферка 13 на рукаве;good
28757;хоть порадовались на 1 месте тыщу лет не были;good
28758;прости меня я несмогла ответить папа с работы пришол и мне приготовить еду как ты там закончила с уборкой милая;good
28759;мои друзья записали новый трек очень классный слушаем;good
28760;блин а он сам отправляет я и не знал вечером бежим;good
28761;rt усатый фотопривет;good
28762;rt то что есенина убили и без этих шарлатанов ясно и зачем даже смотреть это дурацкое шоу;good
28763;rt сидим у даймона бесплатный концерт агдама;good
28764;как ты любишь проводить вечера весело;good
28765;давай не будем письками сейчас мериться что у кого есть и что у кого нет речь сейчас идет о другом;good
28766;rt молодец лукашенко;good
28767;за выходные сложилось впечатление что мы всегда так и живем втроем покупаем продукты вместе учимся неплохо так то;good
28768;бял через какие то полгода максимум они про это забудут и начнут их обсирать атвичаю;good
28769;а в москве 2 и снег in moscow 2 and the snow is falling;good
28770;у меня те же ассоциации только народ держит лысого карлика в руке;good
28771;только купила вайййййййй и уже все стены обтирает;good
28772;23 дня осталось до нового года ждем с нетерпением;good
28773;если родители ушли и не загрузили тебя работой значит они ушли не надолго;good
28774;на тви свой посмотри мы с михалычем враю в турции рай а и не знал;good
28775;пришло письмо что у меня читатель в твиттере классные треки однако;good
28776;rt вот то что развеселит любого юзера контакта это прикол разошли друзьям;good
28777;о боже т9 что ты делаешь со мной какая картошка кариока;good
28778;мы с катей за день до этого спали 2 часа а до этого 5 часов и норм;good
28779;огромная черная гнилостная опухоль атеперь дыра в зубе;good
28780;rt мое др через 3 месяца d mtvstars justin bieber;good
28781;сегодня ходил отрабатывать два пропуска по физре первой парой и третьей вобщем в конце первой пары препод сказал а должники остаются;good
28782;а может твиттер не обрусеет будучи не просто словом а названием;good
28783;девушки забирайте все по своим ценам мне надоел склад в шкафу пиите будем обсуждать ваши цены;good
28784;ну вот и зима пришла у нас тут снегопад красота;good
28785;удалить из друзей из за того что парень появился d вы уже совсем все ебанулись d;good
28786;просить подыграть ради того чтобы я поверила да конечно игра удалась мне то что;good
28787;всех с др не поздравишь конечно не все равно двери лучшие;good
28788;а о кстати к сапогам вчера был куплен спрей для замши с наночастицами серьезно там так и написано d;good
28789;научилась делать переворот вперед и качалочку ура;good
28790;я вообще бодряк все хорошо покушала вот сейчас дак вообще хорошо теперь у тебя как самочувствие;good
28791;нет;good
28792;желтопузый цыпленок опять засмеялся и результат не заставит себя ждать улыбнуло читайменяаятебя;good
28793;ну что сказать победитель по жизни;good
28794;завтра контролтная по органике а я ниииичееегооо не знаю нииичеееегоооо пойду поем d;good
28795;за амралтын д р жаахан инээж л жиргэе дээ ахиад л н г муу эмэгтэй улсруугаа хандуулав энэнд нэр г р й хха;good
28796;тренер человек суровый сказал 4 раза в неделю ходить в зал буду выполнять;good
28797;теперь как раньше по воскресеньям одна единственная задача 1 вывозить;good
28798;еще не предпоследний может эфир юрмалы мы когда нибудь дождемся;good
28799;сегодня дополнительные по рисунку нах d захади дарагой;good
28800;пусть не забудется ночь никем я вас люблю родные;good
28801;артурика домой отвезли потом с заей в затоне в снежки играли d;good
28802;увидела папу в молодости теперь поняла что мама в нем нашла ааха;good
28803;rt ахахахах даааа уносит всеи вся d;good
28804;пошел на каток всем как всегда отличного вечера;good
28805;он просто прекрасен это судьба мы встретились с ним 2 раза;good
28806;ребят у меня та же фигня d;good
28807;а да точно невнимательная я какая сначала глазки посслрились потом ручки странные и не стороны как же как же;good
28808;да 3 я по ней скучаю ну и по вам конечно d;good
28809;rt жуйкопипл петербурга а когда вы сходку планируете;good
28810;вообще все его книги тяжело читаются для них нужен особый момент в жизни;good
28811;когда дочитывала книгу меня не вспомнила;good
28812;когда мне плохо я всегда слушаю музыку она меня успокаивает;good
28813;да отличный способ заставить себя пить воду;good
28814;таир бауырым осы к й нен тайма ел м зд болаша ы ойлайтын сен сия ты жастар азаймасын ризамын;good
28815;все замечательно никто ничего про меня не говорил покрайне мере пока он был там;good
28816;достаточно пообщаться с нужным человеком и загоны как рукой сняло;good
28817;как ты любишь проводить вечера с ним но никак это пока не выходит а так за книгой или за историей;good
28818;доброе утро проснулась от звонка луки сказал что выпросил выходной сегодня потом посмотрела на телефон 12 пропущенн;good
28819;дьээрэ дьээрэ завтра или после завтра ну короче в эти днии;good
28820;вообще то это мне как модели только что сделали выгодное предложение приди во всем готовом а мы твои фото в фотобанк сольем;good
28821;оригинальное решение питер;good
28822;красавицы как две сестрички люблю;good
28823;врачи все странные в крутой клинике мне всегда говорили надо резать обратился в попроще рассказали даже как хроническую вылечить;good
28824;now от и ребят слишком хот d;good
28825;любимый спасибо за любовь которая длится на протяжении полутора лет я знаю что она буд;good
28826;рай он для всех уже смейся со своих приколов;good
28827;rt никогда не грустите а то писюны и сиськи не вырастут;good
28828;rt я один запинаюсь об один и тот же предмет несколько раз d;good
28829;самая красивая женщина это беременная женщина;good
28830;россол с утра отличная вещь после бурного вечера;good
28831;дача и любимый это прекрасно pernatye;good
28832;я имею в виду беседы с обсуждением недели общества и истории;good
28833;давай на чистоту ты была под метом и не знала чем заняться;good
28834;очень сложно следить за агентом фбр который следит за мной d;good
28835;вот и закончилась вторая сессия базового курса подготовки сказкотерапевтов;good
28836;мне безумно плохо щас к вам на щи поедем;good
28837;все сидят дома и фоткают из окна какая крутая погода вам не кажется что здесь что то не так;good
28838;сегодня я еще смотрю их ох это просто фильм детства помню показывали на нг его всегда и вся семья смотрела;good
28839;все утро сегодня слушала an cafe любимая песня у них hatsukoi;good
28840;приятно вас читать еще бы фото вашего замечательного воскресного стола в бане;good
28841;мимимишку принесли вместе с подгузниками;good
28842;бумажку что у нас все путем соответствует исо;good
28843;хаахаахха я не помню его лица кстати gt;good
28844;какой же я лохматый жуть с лохматостью соперничает только небритость;good
28845;мне странно то что я хочу сделать его отцом своих детей он будет просто отличным папочкой а что странного надо расслабиться и меньше думать;good
28846;ну ничего все бывает в след раз сходишь;good
28847;старая гвардия в маф клубе showtime игра мафия в москве mafshow ru;good
28848;цыц не мешай моему педагогическому процессу;good
28849;время идет а девушка ждет если ты не перезвонишь мне через 1 минут отцом моего ребенка может стать кто то другой;good
28850;да не это то правильно вопрос в том как добираться это даа;good
28851;господииии дашуль какая ты худая иди кушай быстро типичная бабушка;good
28852;добрался до simadmin ru ржу прям как на работе блин;good
28853;споры ругань ссоры не самое лучшее для хорошего настроения бывает;good
28854;шедевральное лицо витали а иоланда покопангивает;good
28855;rt охренеть вы не поверите кто меня за фоллоувил сам медведев привет медвед;good
28856;ты главное от кошака береги наушники и прочие проводочки а то миллионы денег будут съедены d;good
28857;сильная женщина;good
28858;rt хаахахахахахах подьебмастер;good
28859;да это стеб я на выезд с дохами поехал за компанию потусить и мне сказали что я это до не пройду я расстроился;good
28860;rt у всех нормальные друзья а у меня кот и тер d;good
28861;ахаххахахах откуда почему я не видела;good
28862;принципы мужской психологии согласитесь а женщинам стоит контролировать негативные эмоции а хорошие усиливать;good
28863;rt внка по фейтоте упарывает меня все сильнее;good
28864;rt жду не дождусь когда в прокате появиться хоббит 2 осталось 1 дней;good
28865;rt и котлетки из щуки;good
28866;rt жду не дождусь когда в прокате появиться хоббит 2 осталось 1 дней;good
28867;канцлер это премьер министр у любой федерации есть президент;good
28868;артемис фаул х а вообще сколько много книг;good
28869;такто круто во вторник еще алинкуу прихвачуу;good
28870;вот на этом красавце я сегодня рассекала по арье а потом проснулась пока что самый лучший сон за последнее время;good
28871;rt жду не дождусь когда в прокате появиться хоббит 2 осталось 1 дней;good
28872;rt ему накрашиватся не стоит;good
28873;rt жду не дождусь когда в прокате появиться хоббит 2 осталось 1 дней;good
28874;rt жду не дождусь когда в прокате появиться хоббит 2 осталось 1 дней;good
28875;rt жду не дождусь когда в прокате появиться хоббит 2 осталось 1 дней;good
28876;маленькая радость с утра пришла моя блузочка схожу на почту и порадую себя;good
28877;хахаха ты забыло про то что мы на улице еще пить будем хаха в стаканчике хахаха ну ты поняла;good
28878;rt и вам веселой радостной зимы и дальше потому же плану;good
28879;rt жду не дождусь когда в прокате появиться хоббит 2 осталось 1 дней;good
28880;вот когда надо ставить bolgenos rt в windows 7 starter внимание нельзя поменять обои рабочего стола ааааа к;good
28881;rt жду не дождусь когда в прокате появиться хоббит 2 осталось 1 дней;good
28882;rt у них тур по так что ты успеешь еще яза билет всего 6 рублей отдала;good
28883;rt смотрю орел или решка эх от такой работы я бы не отказалась;good
28884;из за кого я смотрел то d;good
28885;через 15 минут у меня н з в юной леди жду с нетерпением;good
28886;сегодня день рождения happybirthday с днем рождения;good
28887;сегодняшний вечер должен быть просто шикарным уже жду не дождусь;good
28888;rt жду не дождусь когда в прокате появиться хоббит 2 осталось 1 дней;good
28889;уже даже посвящение в бурумщики проводится;good
28890;rt лыыысыый сднююхой щастья здоровья билетов наконцерты ивсе такое исполнения желанийо я люблю т;good
28891;а это савичева разнылась на концерте больше ничего интересного нет d;good
28892;привыкай жень отныне так будет каждое вс;good
28893;rt ооо аня спать свалила вот сучка;good
28894;rt спасибо вам;good
28895;популяризация культа идет полным ходом утро воскресенье отличное настроение едем с любимым в царство пипок и вагин;good
28896;даже не буду спрашивать кто тебе сказал;good
28897;щас нашла дома коробку разных киндеров игрушек вспомнила как мы с девчонками раньше менялись ими играли и еще у нас были семьи d;good
28898;пришло время писать санте внесем в жизнь немного волшебства и сказки письмо отправила санте вчера сейчас пью какао и буду украшать комнату;good
28899;ты просто на нему женилась это на всю жизнь;good
28900;помиритесь еще не надо истерить;good
28901;гчилэн буулгавал шинэ цуврал нэвтр лэг их сайхан болжээ маш чухал асуудлыг х нд ж байгаад баяртай байгаа ш гэсэн бн;good
28902;доброе утро милая рома уже не тот что раньше мир перевернулся;good
28903;это офигеенно о я за тебя рад а где заказывал;good
28904;еду в автобусе как же я соскучилась по всем этим улицам везде воспоминания;good
28905;rt мамуля стала частенько баловать нас своими пирожками славно;good
28906;rt жуйк а посоветуй чо нить послушать;good
28907;rt называть людей баками как смысл жизни;good
28908;rt мафия 2 очень даже замечательная игра получилась сохранили атмосферу и вообще рекомендую;good
28909;rt 11533 твитт хоть и в последнее время мало общаемся но все же я не забываю про тебя я скучаю по тебе;good
28910;девочки родные мои круглячка моя;good
28911;не знаю не интересовался но помоему дорого 2 25 руб наверное;good
28912;rt моя любимая сегодня едет встречать своего дембеля я так рад за них целый год в разлуке;good
28913;а почему бы и нет ты же тот пермский рокер который сидя движения на вписке наводит dd;good
28914;для парней намеки то же самое как для меня алгебра;good
28915;happybirthdayianfromrussia любимому 35;good
28916;девушка жжот самый первый прыжок с парашютом это жесть прикол смешно ппц;good
28917;у сестры был пацан леша но его называли микита она на др подарила ему трусы с надписью микита специально сделала охуенный подарок d;good
28918;rt нет он не хороший он просто шикарный ddd;good
28919;я знаю что понравятся но блин так жаль с первым было расставаться;good
28920;свето звуковую систему поиска в женской сумке;good
28921;rt дизайнеры желающие но стесняющиеся мне что то подарить смелее я не кусаюсь;good
28922;у меня в комнате идет снег d лол кажется я упорот з;good
28923;ну у нас в 2 8 2 12 же тоже был президент;good
28924;ахахах иду около талина а на встречу мне кучу пацанов в шапке барсы d;good
28925;а потом генрих птицелов отправил в будущее своих супер рыцарей и рашке все равно кранты в 2 43 м;good
28926;борода бляяяяяяя куда не прийду везде хвалят мою бороду ну или просто обсуждают ее;good
28927;очередных соплей и моего обычного ужасного настроения больше никто не увидит и не услышит легкость во мне;good
28928;нет ничего лучше чем кофе печеньки и breaking benjamin;good
28929;ааа сорри тупанул подумал о флешке d;good
28930;у папы на репетиции он прям настоящий дед мороз;good
28931;current зашли перекусить и тут профессор достала тетрадку с санскритом лингвистическое воскресенье;good
28932;это было что то офигенные ребята блиииин нет слов одни эмоции рок рулит;good
28933;иногда чтобы быть красивой досиаточно просто надеть на голову колготки и убедить всехх что это волосы;good
28934;у него я прочитала код ангел и демон сейчас дочитываю инферно интересные книги питера пена закажи;good
28935;rt меня вынесло dddd;good
28936;rt мусюсечка;good
28937;ахахах но ведь были и другие карточки львица;good
28938;очень интересненбкая олимпиадка ничего не написала;good
28939;слово дня смелость сегодня она мне ооочень нужна;good
28940;страница с треком на баттле слушаем оцениваем качаем комментируем;good
28941;ура моя работа хоть что то я уже выполнила;good
28942;да пиздец то он везде я просто вот тут думала видела и остановилась на педагогическом или на дизайнера;good
28943;отпишусь пожалуй президент германии лучи юпитера терпение лопнуло читайте больше;good
28944;сообщения не отправляются не читаете вы меня;good
28945;сегодня приснилось что меня взломали в твиттере но сон точно не вещий потому что у меня надежный пароль да и кому я нужен;good
28946;ааа вкусняшка привезите мне мне сейчас как раз не хватает кофе;good
28947;rt вааау у тебя новый парень нет я стираю его лаской;good
28948;привет по моей традиции мишу тебе;good
28949;оцени свою новую школу по шкале до 1 баллов 8;good
28950;rt всем доброго утра;good
28951;такие слова вдохновляют работать и дальше сухое голодание сыроедение анна якуба;good
28952;я не верю что ты придешь вовремя;good
