Num;Review;review_type
27330;ну если на голову то тут не только нг и даже не один сам факт выброса мб признан хулиганством и нарушением общ порядка;good
27331;нет они всю ночь в мск сидели до первой эльки вот почти в 9 приехали;good
27332;вполне удачный фильм в принципе он меня ни чем не зацепил но что то в нем есть пошла на него только из за маши паши и макара;good
27333;это не у меня это у папы от известия о визите в рашу;good
27334;rt твит с лиамом для;good
27335;он может уже не сниматься всем все доказал уже;good
27336;воу а у меня с открывается сонных глаз;good
27337;как же хорошо просынаться дома в своей постельке со своим любимым котяркой;good
27338;а я алгебру сделал ахахп;good
27339;такую моя больная голова не знает d но это забавно;good
27340;сегодня я прям в огне постирал постельку куртку брюки джемпер да я прям фея мойдодыр блять;good
27341;спасибо сашенька кое кто преувеличивает gt;good
27342;апхапхапха dоооо дааа я подкинул тебе ведьменский мешочек теперь ты всегда будешь есть d;good
27343;ты еще просто не знаешь какой комп у сашки;good
27344;ууу я начинаю бояться;good
27345;rt правильно не надо болеть 3 приятного;good
27346;да вот только за ноут села ахах а ты;good
27347;rt максимальный репост вромайдан;good
27348;rt не за что пей таблетки витамины кушай фрукты и теплее одевайся;good
27349;сегодня идем на чижовка арена роберт будет оттачивать навыки катания на конечках заценим новую арену;good
27350;я смотрел близких друзей а потом с 5 до 6 жрал d;good
27351;зайка моя ты же знаешь что я легко так могу сказать;good
27352;как ты любишь проводить вечера в обнимку с эндрю за просмотром фильмов или готовкой с ним ужина;good
27353;rt безудержное dd;good
27354;твит с лиамом для;good
27355;люблю что всегда когда я прихожу домой меня встречает пич;good
27356;не был в зоопарке с самого детства и как вы думаете куда я сейчас собираюсь двинуть;good
27357;rt с добрым утром друзья;good
27358;надо бы к руслане сходить на коррекцию а то я девушка брэжнев;good
27359;rt теперь я буду называть ваньку сусленком;good
27360;меня назвал котей шикарное утро;good
27361;я тобой не давно гулял мм я знаю кто ты;good
27362;даа мне тоже дарси нравится он очень смешная ddd;good
27363;пизда так они кричали в этом автобусе или куда их там посадили d;good
27364;кто нибудь откопайте мою машинууууууууу ее под сугробом не видно;good
27365;да вы что и что у вас с характером;good
27366;rt как все начиналось вечер 21 го ноября еще не до конца понимают что творят историю вромайдан евромайдан;good
27367;rt каждый день проверяю исходящие заявки в друзья в вк вдруг кто то удалил а я как лох у них в подписчиках висеть буду ид;good
27368;все кто хочет въебать подъезжайте ждуууууууууууу;good
27369;зеля не понимает ее любят если бы я всех анфолловнула у меня бы уже давно было бы хдд;good
27370;заснула вчера в 1 вечера вот проснулась сейчас ребят я наконец выспалась d;good
27371;а от меня нет mtvstars 3 second to mars;good
27372;agibalova irina 8 ч назад приятно черт побери спасибо май;good
27373;радислав вы вроде грамотный человек и что то непонятно это просто стэб с вашей стороны или вы действительно этого не знаете;good
27374;в планах на 2 14 год работа с маркетологом европейского уровня выпендривается посмотрим что из этого получится;good
27375;у нас тоже они на выезде из города все это маркетинговый ход;good
27376;вооооот согласна ну действительно как можно настолько себя не уважать щас напишу те в лс;good
27377;rt азахазхз я ржала как истеричка хотя почему как dd;good
27378;rt а потом я ее трахну когда она спать будет;good
27379;этот ролик смотрели такие люди как режиссер галилео лысенков сам себе режиссер журналисты ну и т д это таак здорово;good
27380;rt если голосуешь то ты обязательно встретишь ван ди mtvstars one direction;good
27381;более того детишки качают мышцы грифом я всем остальным;good
27382;смотря для чего если для качественного просмотра двд одно слушать фоном бубнеж по выходным совсем другое;good
27383;кароч я тусила с кириллом василевичем и максмом лысенко йоу;good
27384;rt подписывайтесь на мой фейсбук;good
27385;ну мы как бы соседи с с межгорья как спалось;good
27386;погода сегодня хорошая маленький снежок и мороза не чувствуется в этом году ялюблюзиму;good
27387;rt а я с гузик самые последние домой пришли;good
27388;rt как же я люблю воскресенье немыслимо просто;good
27389;так вот оказывается зачем нам нужны главенствующие курицы чтобы остальные неслись продуктивнее d;good
27390;приветик верочка веселого настроения;good
27391;rt я бог рисования да d кишулик прям как живой 3;good
27392;надо вставать и бежать в сторону ванной комнаты что бы опять не лечь и уснуть раааз двааа три;good
27393;обожаю папу увидев мое плохое настроение с утра привез шоколадку и сказал чтобы я никогда не грустила ведь много шоколадок есть нельзя;good
27394;прям выписка из полевого журнала батлы батлы;good
27395;мне вчера было очень плохо d зато попробовала порисовать на компьютере;good
27396;наконец то я выспалась ураааа d а завтра ужасный день;good
27397;в другой раз когда еще раз готовить буду;good
27398;ты в ответе за свои слова а не за то как их поняли так что все нормально так пафосно но так правильно d;good
27399;я тебе разведусь слышишь эй d даже не думай ты моя единственная любовь;good
27400;эй пугало пошли сказал питер обращаясь к ли;good
27401;rt дизайнеры желающие но стесняющиеся мне что то подарить смелее я не кусаюсь;good
27402;rt судя по всему дилан бьет тая на съемках игрища d;good
27403;тут и армия не нужна и деньги есть главное организовать и мерикансев сразу кондрат хватит;good
27404;оххх утро у меня доброе мое утро началось с мысли о тебе;good
27405;я хочу задать тебе вопрос но я не знаю что задавать поэтому вопрос ответ d;good
27406;так плохо мне никогда не было но это была охуенная суббота с танеей;good
27407;ладно вопросы не задают ок пойду тогда фильм смотреть заняться все равно нечем с;good
27408;а еще люблю это чувство когда не верят что ты хорошо поешь и что вообще ты поешь эту песню пока ты не начинаешь петь;good
27409;читаювзаимно погодка стоит прекрасная пошли на лыжи народ;good
27410;rt твит с 1d для;good
27411;для качественного просмотра олимпиады телевизор для родителей они его смотрят я только 15 минут утром успеваю глянуть;good
27412;спасибо так овуляция же она для того и есть определил по активности дубиной по башке и всего делов;good
27413;ну как всегда флаг вам в руки пишите я позже зайду что нибудь вам на растерзание еще кину;good
27414;согласен но у нас же сборная россии ребята не предсказуемые захотят выйдут не захотят и очка не наберут;good
27415;rt доброе воскресное утро на улице днем хорошая зимняя погода 3 с и небольшой снег в общем сплошной позитив;good
27416;звизду тибе;good
27417;я и не заметил что читателей уже за сотку о всем спасибо всем счастья d;good
27418;rt твит с лиамом для;good
27419;с утра пошла за овощами заодно купила пароварку логику поступка сама не понимаю но вареникам на выходных да;good
27420;мне вчера тоже тему для размышлений этим подкинули;good
27421;скоро сокол заедет и зно будем отмечать;good
27422;запутанные отношения у меня были только с наушниками;good
27423;как же весело на репетициях ванька вообще умора d;good
27424;доброе утро тьфу тьфу тьфу чтобы не сглазить;good
27425;rt у нас своя атмосфера;good
27426;а еще сегодня предстоит попрощаться со своими кучеряшками только прямые только хардкор;good
27427;и пофиг что ему блондинки по душе полюбит и таким куда денется;good
27428;на рад о люкс зараз шикарна музика отак живемо;good
27429;rt radiot сегодня я плачу только за качественные фотки d;good
27430;пока лебединого озера не было вроде;good
27431;говорю же цитата истоминой;good
27432;только проснулся рядом любимая девушка и любимый мопс счастье;good
27433;в детстве после нового года мы брали санки и бежали на горки а сейчас проснулся встал посмотрел в зеркало ужаснулся лег обратно d;good
27434;угусь ты няша или милаша угусь я лена;good
27435;rt добрый день всем;good
27436;сегодня день футбола и квна буду диванным ультрасом;good
27437;rt а я думаю и верю все будит хорошо;good
27438;сегодня исполняется 19 лет молодому таланту ливерпуля с днем рождения рахим;good
27439;никита вероника а я в середине хмурый сен дени франция;good
27440;встала в 6 чтобы пойти к себе домой отсыпаться дальше dddd;good
27441;rt понял за что еще люблю жуйк на жуйке нет флэша;good
27442;мы ждем;good
27443;ага вероятность цыстита уменьшается а парням приятно потрогать пощупать;good
27444;rt твит с 1d для;good
27445;rt run jesus run выносящая мозг если он есть игра;good
27446;посмотри околофутбола там найдешь ответ;good
27447;такая красивая девушка в метро похоже что с ямочками на щечках;good
27448;блин рыбий жир в ленту одна кариша смотрит в небо и слушает его;good
27449;rt так значит уже нельзя ключ под ковриком хранить;good
27450;rt че за фигня творится с сиськами мамы дяди федора;good
27451;сегодня чудный денек настроение отличное поздравляю с днем рождения витеньку творческих успехов и начинаний тебе;good
27452;пришел к выводу что смартфон alcatel one touch pixi идеальный вариант для армии дешево и сердито армия телефон;good
27453;мм ну ладно потрачу еще один больничный день на игру в wow как я подсела;good
27454;rt держии;good
27455;d я сама не поняла сначала пока по очереди картинки не посмотрела;good
27456;я еще любила харлей дэвидсон и ковбой марлборо мимимим;good
27457;не плохо даже есть где шашлычок приготовить;good
27458;ну он такой а давай твоих марсов сникерсов и грин дэев послушаем марсов мы слушаем сейчас d;good
27459;пизды все дадут уебут убьют порежуууут ай збс;good
27460;rt с днем рождения милая всего тебе самого самого хорошего будь счастлива всегда улыбайся и забудь о грусти;good
27461;забавное чувство когда знаешь что незачем бежать с утра как проснулся проверять вк тт потому что знаешь что там пусто d;good
27462;и не надо мне говорить из чего эти котлеты сделаны burgerking;good
27463;если я нервничаю то стоит расслабиться под какую нибудь музыку мумба например;good
27464;ничего особенного это просто упоротый беня камбербетч d;good
27465;так классно просто находиться рядышком с тобой щас виталя приедет и домой;good
27466;такая крошечная нежная сказочная девочка спим более менее;good
27467;доброе утро как же я люблю воскресенье можно повалятся в кроватке;good
27468;успокойся тебя последнее время тянет все раскритиковать негативный бой;good
27469;зачем платить за удовольствие которое не испытаю;good
27470;после стояка сама честная форма лести это пьяные сообщения в 5 утра с просьбой о фотках;good
27471;rt хорошо что я уже прочитал ска d хотя ты тоже в свое время половину проспойлерила;good
27472;да;good
27473;rt все таки здорово иметь нормальный инет дома это я отчетливо понял после того как несколько дней сидел на мобильном ине;good
27474;утром гуляли по городу обошли кучу мест замерзли бррр;good
27475;он такой милый а я еще в паре с другим милым играю боже как классно и вот с этими людьми я встречу новый год mtvstars justin bieber;good
27476;дайте мне универ закончить сначала;good
27477;был сегодня в секонд хенде видел sendmail 3rd edition;good
27478;ахуенно погуляли мне налмално d очень налмално d;good
27479;спасибо как только из этого разлипну обязательно гляну;good
27480;о привет или по сто раз за ночь просыпаешься;good
27481;когда смотришь астрал 2 нельзя курить кальян да и расплесканный чай не очень обрадовал кошку;good
27482;тоже самооее очень насыщенный год;good
27483;как я счастлива что рабочий день до 4 с любимым всю ночь болтали не спалось нам обожаю наши разговоры ночные;good
27484;надеюсь мы свои планы осуществим и ничего по п зде не пойдет d;good
27485;настасий с рыжим приедет и подергает я разрешила 18 раз по 18;good
27486;доброе утро так рано по своей воле я давно не просыпалась;good
27487;а я поверила что это воспоминания персонажа айфон постарался;good
27488;а вот amare это лат любовь бога любви у римлян звали cupid или amor amiable это дружелюбный в испанском есть известное amigo;good
27489;а у него такая прикольная моська ни кому его не отдам;good
27490;соскучилась по заказала белон и грюнер ваше здоровье василий;good
27491;как вам норвежская средняя школа;good
27492;кто нидь знает когда голосование кончается;good
27493;наконец то нашел старую добрую игру всем советую;good
27494;проспали сегодня 11 5 часов оооооооо какое сегодня было утро;good
27495;доброе утро мама уехала я сегодня целый день малую смотрю;good
27496;rt я по фоткам понял что вчера была ладно похуй уже сколько просто неожиданно марина скоро бабушка;good
27497;я думала опять скажете что я ебанутое дитя d;good
27498;восход december 8 2 13 at 7 45am light snow еще разок еще разок еще разок еще разок еще разок еще разок еще разок;good
27499;как же красиво за окном особенно хорош тот мужчина слева что чистит свою машину уже 15 минут;good
27500;пройтись в жару по не очень очищенным от пыли и песка улицам в сандалях на босу ногу пиздец ноге так что;good
27501;там экскалаторы как беговые дорожки 1 5 раз покатались;good
27502;7 12 13 в 22 4 кто дрался окола герат кафе малоцы так держать;good
27503;посвящение прошло хорошо у сашки была офигенная бабочка d;good
27504;офигенный день день позитива бегал как идиот целый день танцы офигенны хоть я и ракал но мне очень понравилось;good
27505;надо что нибудь с лошадью год лошади ведь d;good
27506;спасибо и тебе приятного денечка хоть погода и не айс;good
27507;rt 2 яйца 5 г овсянки и банан вот это завтрак;good
27508;aviva норм у нас в городе должны быть за lawine тоже замолвить могу цена качество типа;good
27509;не забывайте друзей ребят 3 всем счастливого дня;good
27510;доброе утро страна как у вас настроение лично у меня обалденно романтичное настроение и вам такого же желаю;good
27511;там еще снега особого нет но все же поволяться можно;good
27512;rt женщины как спам предлагают всякую фигню и член увеличить;good
27513;в 8 утра уехала только вернулась нагулялись в снежных сопках за пятиречьем и чистоводным устала как собака отличный день кароч;good
27514;rt хорошо mtvstars justin bieber;good
27515;что то настроение подхватило воспользуюсь этим сделаю часть уроков;good
27516;мальчик в розовых брючках подарил мне раскрасочку мило;good
27517;если ты насчет гаррюнделя то не боись;good
27518;севыч трудиться на кухне наконец то по завтракаем;good
27519;рязанские студенты только сейчас дошло что это как то смешно звучит;good
27520;ты прям фанатка их теперь;good
27521;дело нужное и требующее творческого подхода вдохновения так скать;good
27522;rt флет удался;good
27523;иметь общие желания и общие отвращения именно в том состоит прочная дружба гай саллюстий крисп и отношения тоже;good
27524;санек поздравляю просто молодчага пы сы с тебя пристава блеать d;good
27525;ахаха сучка это мое дело если что;good
27526;нуу встретилась с систер нашла любимых твиттерских и многое другое;good
27527;ссср и рф будем сравнивать в этом плане;good
27528;няши жуйка с праздником пусть мартовский кот принесет всем счастье и компот 3;good
27529;надежда первухина блюз полной луны юрич посоветовал;good
27530;еще толком зима не началась а я уже успела упасть несколько раз;good
27531;зайцу своему в школу елочку сделала;good
27532;сколково также как китайцы всегда будут только копировать технологии свободной калифорнии;good
27533;аха жансая з жа ынжа ешк м де б лмейт н шы ар оны з м з ма тап к терген;good
27534;rt ну вот и я приобщился к современным мобильным технологиям купил себе htc wildfire что на благословенном андроиде тел;good
27535;ооо кто то мою запись вк увидел про борщик и сметану;good
