Num;Review;review_type
45001;rt когда вк обновится уже;bad
45002;грусть печаль оказывается tea amp coffeegarden на 8 марта закрылся;bad
45003;навязываться я устала навязываться с меня хватит достаточно нет так нет не надо и мне не надо я уже теряла потеряю и еще;bad
45004;на самом деле правильно они очень вредные а такие дурачки как ваня этого не понимают;bad
45005;не первый раз такая хрень с инстаграмом когда загружаю одно фото а публикуется совсем другое;bad
45006;блин хоть разорвись налево пойду домой не попаду направо пойду налево не успею;bad
45007;rt вечная память тебе кимочка с днем рождения;bad
45008;знаю что нужно с спасибином дружить начать что бы дурь курить и микро автобусы угонять 9 9;bad
45009;я завтра с удовольствием проебала бы пары но зачет по имок не дает;bad
45010;ага я спасала их как могла;bad
45011;rt только я могу проебать загодать желание в 14 15;bad
45012;ааа как это мило 3 обожаю тебя я бы тоже хотела отпраздновать нг с тобой жаль что не могу всего всего тебе;bad
45013;божеееееее я забыла совсем капец я опечалена;bad
45014;мой одноклассник никита заболел шот как то грустно без него стало;bad
45015;rt на работе муха который день доебывается гопник штоле;bad
45016;rt удалил какой то пакет и теперь везде кроме хрома вместо букв квадратики;bad
45017;rt по закону подлости чулки подрались утром же хотя в такую погоду стоит вообще на них забить но девушки в меховых жиле;bad
45018;амбиции решительность и даже жесткость дают конечно результат но враги так быстро множатся а когда они объединяются происходит;bad
45019;жизнь стала такой насыщенной что перестала успевать писать твиты;bad
45020;почему я думала ты хочешь его обидеть тт;bad
45021;скучаю по длинным;bad
45022;дааааш посиди доооома пожааалуйста;bad
45023;нет не грузится кранчбанг индикатор загрузки доходит до конца и пустой экран;bad
45024;вот она демократическая поправка в избирательный кодекс владимирской области предложенная депутатами зс;bad
45025;а вы знали что дельфины не умеют пить и могут умереть в воде от обезвоживания организма о о;bad
45026;всегда и везде с ним вот эт реально любовка хочу тоже так;bad
45027;ggogoogogogogoogogog мне очень скучно;bad
45028;я забыла загадать желаниееееееееееееее;bad
45029;rt я ржал как мудак когда смотрел первый раз;bad
45030;веном патамуш в воскресенье вы почти весь день в тви а по будням вы заняты все;bad
45031;здается мне не выйдет у меня и 95 баллов по инглишу за этот тетраместр;bad
45032;аааа скоро к репетитору пойду черт;bad
45033;проебала сегодня все что было можно;bad
45034;только отъехала от колледжа почему все так долго;bad
45035;интернет не радует youtube со своими заморочками тоже так себе настроенице;bad
45036;уже сегодня 11 12 13 14 15 я прос юпала;bad
45037;надо собраться собраться и сделать английский блин как не хочется спать хочу;bad
45038;а я в 4 лег ппц завтра пробное гиа еще;bad
45039;смешно тебе тут беда подкрадывается ростик в тп превращается;bad
45040;rt кругом в основном элт мониторы ужасная belinea у нас тоже такие покупались в 1999 глазам неприятно;bad
45041;ааа там нет товара который мне нужен еду в другой магазин и еще мне надо вызвать сантехника блять воду перекрыли из за шланга;bad
45042;опять вставать в 6 утра как все это надоело;bad
45043;наконец то дома устала замерзла кошмар;bad
45044;ай хейт ма лайф и блять даже има угла нету 9 говорю ж уебанская комната;bad
45045;rt так хотелось на праздники туда поехать но теперь флоренция в задницу этих майданутых;bad
45046;эхх дыа и я адинок и карбюратор ток остается;bad
45047;сижу и пытаюсь подобрать правильную комбинацию ключа на збт для риккуши;bad
45048;ну вот блин кто меня вспоминает икота блин;bad
45049;ну лох я да чтож поделать;bad
45050;rt жуйк для чего порт 666 может юзаться кроме игры doom o o;bad
45051;такое настроение что хочется петь но надо делать это в одиночестве ибо пою я ужасно;bad
45052;приехали к аньке без пацанов постараемся веселиться так же как и с ними 3;bad
45053;макдонааалдс туршилт байж;bad
45054;и не заходишь мартышка и чаем меня не поишь;bad
45055;жалко в мгту не преподают некромантию и чернокнижие;bad
45056;подошел к концу пакуем чемодан винчиом и скоро уезжаем в осень;bad
45057;блблблбл 9 9 огурчиком было лучше быть 9;bad
45058;украл у вейдера половину зефирины мне пиздец;bad
45059;теперь я понимаю как важно делать все во время;bad
45060;сама только что вспомнила когда увидела твой твит;bad
45061;ты не смей меня обманывать я тебя люблю но тока попробуй;bad
45062;хочупровестиновогоднююночьвместес обязательно давно с ней не общались;bad
45063;хотела купить кофту с пингвином папа забраковал сказал мол тебе же не 5 лет детячая кофта;bad
45064;rt мне ни когда не жениться на ней;bad
45065;бедная пусть stay strong lt 3;bad
45066;приехал на встречу муниципальных депутатов с префектом свао виноградовым какой же все таки унылый зал в префектуре;bad
45067;я и так под одеялком сижу с только кажется я умир из за кашля;bad
45068;надо с курением завязывать а с депрессией у меня серьезные отношения и я не могу ее бросить;bad
45069;жизнь доминирует в жесткой форме еще и линда умерла да что ж за гребанный экибастуз;bad
45070;я на всех срываюсь из за того что с тобой в ссоре сууукааа;bad
45071;вы даже не представляете как я хочу спать и как я устала;bad
45072;вот так зато я с вами в сб;bad
45073;rt делаю модельку вентилятора пока что ничего не получается я бездарен;bad
45074;меня не выписали теперь еще и темпиратура поднялась блииииин ну что творится;bad
45075;rt гребанное недосыпание после пары бокало шампанского мне хотелось только спать а не приключений как обычно;bad
45076;знаете что в квартире сверху происходит какой то шаманский слет бубны барабаны будто туда по райдеру заселили труппу японского шоу ямато;bad
45077;rt сегодня в 14 15 нужно было загадать желание а мы как всегда просрали;bad
45078;жизнь боль;bad
45079;и снова на улице 1 и дождь опыт мне подсказывает что завтра будет минус и я точно наебнусь;bad
45080;блиин где же вывод совсем затянули уроды;bad
45081;блиин где же вывод совсем затянули уроды;bad
45082;иду домой с репетиторства на улице холодно;bad
45083;и я скучала милая 3 у меня просто учеба и поэтому так редко захожу но я рада что ты все еще помнишь меня;bad
45084;не нудно делать мне предложение я все равно скажу нет;bad
45085;сегодня было 8 уроков 8 уроков они издеваются;bad
45086;уже вторая четверть заканчивается а я еще тетрадку по химии не купил;bad
45087;теперь спина болит;bad
45088;в этом то и дело да по хорошему не уйдет;bad
45089;что делать если тебе нравится девушка но ты не можете быть с ней вместе;bad
45090;только там чернильных пятен много;bad
45091;все пора отказаться от кофе а то иначе мое ближайшее будущее это желтые зубы;bad
45092;ну не люблю я математику вона мене паходу тоже;bad
45093;я читала там 4 выживут вроде там 4 погибнут;bad
45094;как же стремно болеть весь день играю в фалач и больше вообще ничего не хочется да и горло чертовски болит;bad
45095;пережатие звука и запуск мплеера с audiofile не прокатило придется пихать в матрешку;bad
45096;божечки я дома 2 часа у зубного это невыносимо;bad
45097;я вообще не знала о желании поставила время как в хельсинках и загадала по их времени надеюсь так можно 3;bad
45098;закинул в школьную почту валентинку эшлин брук жаль что не дойдет;bad
45099;этот кошмарный сон был хуже чем все предыдущие вместе взятые;bad
45100;ручки слабенькие прыгаю не оч бегаю не оч кидаю мяч не оч пинаю мяч не оч отжимаюсь не оч подтягиваюсь не оч не спортивная я фу;bad
45101;rt чувак разломал пиченюшку вилкой ему это понравилось и он стал дубасить по печеньки но она этогоне зашлужила;bad
45102;activity на тамблере оставляет желать лучшего;bad
45103;ааа не открывается на что идет;bad
45104;та не обижает просто так бесит;bad
45105;пора менять линзы глазкам уже больно краснеют и плачут;bad
45106;еще крече было бы с парнем;bad
45107;rt когда мне начитают читать тысячники я себя прям звиздой чувствую с;bad
45108;брось это же не грех autofollowback;bad
45109;я весь урок руку тянула а она меня не спросила чзх какого я вще тему учила gt;bad
45110;все ясно тебе от меня только машина утром нужна;bad
45111;11 12 13 14 15 не успела загадать потому что долго выбирала какое;bad
45112;rt когда мне начитают читать тысячники я себя прям звиздой чувствую с;bad
45113;я сейчас иду на экзамен в муз школу очень волнуюсь лента пожелай мне удачи;bad
45114;rt доброе утро супер мега бизнес центр на профессора попова д 37 остался без связи;bad
45115;rt линта линта смотри это же реально шелдон o o;bad
45116;зашел домой на пару минут и уже пишу в твиттер вместо того чтобы норм похавать и отдохнуть;bad
45117;у меня с интаграмом уже неделю что то не так я думала только у меня одной;bad
45118;фу завтра контрольная по корням n степени;bad
45119;устала очень только еду домой а еще куча дел надо сделать;bad
45120;сегодня родительское собрание ааааааааааааааааааааааааааааааааааааааааааааааааааааа;bad
45121;3 день ничегонеделывания но я похудел это точно без жирка холодно так он ведь часть меня я даже слезу пустил;bad
45122;да не проходит без нее ничего все тело ломит пришлось так даже;bad
45123;не буду яблочком не поделился;bad
45124;укол сделали первый раз в жизни плакала;bad
45125;вот нахуя она уходит с музыкалки доучилась бы уже эти пол года и музыкальное образование получила а так 7 лет в одно место;bad
45126;сегодня была нулевка я вообще никакая;bad
45127;у меня коллега с ойфоном этожжуть хочу старый ламповый как в вебе;bad
45128;рисую вот прости джерард;bad
45129;ингэх тусам нь хайр х рээд байхг й юу;bad
45130;ясн я вообще дома сижу болею;bad
45131;художка это когда в любом месте может быть кнопка;bad
45132;подвешенное состояние нервы словно натянутая струна только бы не сорваться;bad
45133;обложила себя учебниками по английскому с 8 по 11 класс угу как будто сильно поможет;bad
45134;мда а я радовалась что не упала в первой день земи и блин на 11 все таки упала;bad
45135;я тоже уже давно уговариваю отца на ствол но он все обещает и обещает;bad
45136;а этот я тоже не сделала;bad
45137;сегодня была в школьной столовой купила кофе и облила случайно им какого то парня;bad
45138;rt из за поддержек у меня болят ребра;bad
45139;береги то о чем в первую очередь вспоминаешь с утра я мечтаю с утра беречь то не чего оказывается;bad
45140;на эти выходные еду к бабуле как же моя киця без меня;bad
45141;rt лох;bad
45142;у родителей подгорела картошка сейчас задохнусь от угарного дыма кхе кхе;bad
45143;прости дорогая но у меня пока симка сломана скажу после нг;bad
45144;только сел в танки гамать выехал тут же запиздили обидно;bad
45145;очень плакала сегодня так страшно видеть человека в послений раз ксюха держись;bad
45146;at home и я только сейчас вспомнил что мне сегодня на вокал а так лень туда идти;bad
45147;разочарование текущего года самый лучший фильм 3 шлак полный;bad
45148;rt мы сами себе создаем счастье но порой не такое как представляли;bad
45149;у нас оригиналов точно нет;bad
45150;завтра лучше не брать дневник но наташка сожрет все нахрен;bad
45151;хочу в баскетбольчик поиграть но саныч только в феврале отвезет;bad
45152;я тоже;bad
45153;урабе чем то напоминает сейлор меркурий o o;bad
45154;бляяя ну как это так на тренеровку не едууу;bad
45155;как же наши знаменитости практически все безвкусно выглядят по сравнению с западными даже в том же деревня блин модные тренды мимо них;bad
45156;rt только я могу написать слово математика через и как то печально это мозг к 5 часам отключается автоматически и е;bad
45157;подвернула очень сильно ногу на тренировке надеюсь не перелом;bad
45158;юля ты бяка ахахахахх наташа блин;bad
45159;энэ орчлон хорвоо яасан ч шударга бус юмбдээ з гээр л хайртай х м сээ хайрлаал хийх естой юмаа хийгээл явж байх нь хамгийн том жаргал;bad
45160;rt теперь я обычный парень который хочет девушку лишенный всяких надежд получить ее в ближайшем времени;bad
45161;из речи на вромайдан украина разрушила российскую империю речь посполиту и советский союз на очереди ес;bad
45162;нажралась меда с мандаринами чувствую завтра мне будет плохо;bad
45163;хочу увидеть джи в живую и фрэнка всех;bad
45164;уф ни наю gt lt было сложно но я и это пережил и теперь могу отдыхать со спокойной душой а ты как;bad
45165;вся эта маковская фигня такая заразная;bad
45166;как же дома скучно я б хотела сегодня быть в школе;bad
45167;меня решили кормить бульоном;bad
45168;обычно после этого следует ответ это вышка детка но что то как то уже не смешно я не хочу завалить сессию;bad
45169;у меня нехватка мотивации и острый дефицит энергии другими словами лень одолела;bad
45170;взял с собой зарядку а розетку найти не могу это андроид детка;bad
45171;весь город одна большая пробка владюш;bad
45172;тоже самое ругаю сама себя как можно было профукать такую редкую блин вещь;bad
45173;я за европу соответственно против фсб но и против таких методов соответственно против фбр наша сбу ничего не может печально;bad
45174;совсем редко пишу я сюда в последнее время увы и ах псто затягивает сильнее;bad
45175;rt блин только что два джуйка косячных было и не в одном не успела похихикать;bad
45176;ехали с ним и тут тот наш магазин с парковкой где он выкинул milka и мы оба помним это место;bad
45177;помогите найти английский язык english;bad
45178;реферат сделан конспект сделан осталось подготовиться к зачету;bad
45179;написал информатику осталась геометрия ненавижу уроки;bad
45180;rt хочу взаимности в любви фак;bad
45181;надо учить международное право а то больше никак не сдать 2 экзамена осталось из 5;bad
45182;заплатила за интернет но ограничение еще на 19 дней осталось бля;bad
45183;как потерять друзей и нажить проблем пошаговая инструкция 1 будь собой 2 будь собой 3 будь собой так я и сделала;bad
45184;меня накрывает и уносит с собой беспричинная депрессия;bad
45185;самое время ныть про то что он покупал здесь булочкиии и кооофе;bad
45186;мышка опять отваливается придется перепаивать что ли;bad
45187;rt черт возьми как я хочу в 12 й класс;bad
45188;ну у нас по началу никого не было щас 3 человека и все;bad
45189;согласна и да только подумала учиться как сегодня же получила плохую оценку;bad
45190;надо уже собраться и позвонить ненавижу говорить по телефону;bad
45191;обновленный дизайн нового твиттера как то не очень;bad
45192;вот это я попала блин вроде пару минут прошло а уже всеееее;bad
45193;вообще не как планов не каких не знаем с друзьями что делать ну а там как всегда решиться все в последний момент ау тя;bad
45194;неожидано для себя я расплакалась безумно привыкла к своим уже близким и дорогим сегодня весь день как лагерь погасших свечей;bad
45195;ойой кто бы говорил;bad
45196;моя любименькая крууужечка что же я без тебя буду делать из чего пить;bad
45197;кстати вчера приобрел книжку дать почитать не могу там на всех страницах вотермарка с моим именем и адресом;bad
45198;предложите какую машину рисовать людиии делать нечего;bad
45199;я не вижу не одного комментария я тогда проводить не буду так не интересно же;bad
45200;москва адекватно ответит в случае расширения властями сша списка магнитского мид рф о заявлении посла макфола прям страшно;bad
45201;люблю тебя очень но мы никогда не будем вместе;bad
45202;блять хотела в магаз зайти но деньги забыла;bad
45203;ну это за прошлый год и за нынешний сувенирка и календари по 4 р за лист но обидно что столько стоит;bad
