Num;Review;review_type
41259;rt ты милее всех бля сука скучаю ужааснооо;bad
41260;в сингапуре беспорядки;bad
41261;на меня тьфу сердце одно уважаемые фэйки вы смертники;bad
41262;моя подруга тютю целый вечер меня смешит;bad
41263;торька немного поиграла с ним;bad
41264;я тоже очень скучаю хочу к вам скорее;bad
41265;показуха 99 лвла удачи всем кому не повезет с тобой;bad
41266;надо учить эти дебильные 3 строфы не выучить мне будет;bad
41267;лол прям как я я тоже никогда не знаю печально;bad
41268;походу мы не будем отмечать нг с классом нормваще;bad
41269;не ожидала что и вы туда же мне очень жаль вы прекрасный музыкант певец не надо вам в эту грязь все это фарс и абсурд;bad
41270;все плохо;bad
41271;да в мире игрушек они нашли свое место жалко времени не хватает на конструкторы;bad
41272;rt анфолловер на аске тайм ту вскрывать венки;bad
41273;я не знаю про что дальше писать мангу это была уже 1 страница;bad
41274;rt где праздновать новый год;bad
41275;мне лень встать и занести папку в сумку дожили;bad
41276;эти пидары заставили меня представлять весь проект и рассказывать о нем;bad
41277;уже 6 выпила и так там но спать не хочу и молодежка не грузится;bad
41278;где там о нет такого;bad
41279;ну серьезно наводит на грусть и печаль;bad
41280;может в вк как нибудь поговорим;bad
41281;у меня монитор только половину экрана показывает;bad
41282;rt я сегодня заебался начальник хотел чтобы я заебался я его приказ выполнил;bad
41283;блин выкинули подкаст вместе с олимпиадой неудачно то ли из за трафика то ли из за облаков сейчас меня заминусуют;bad
41284;даааа очень скучаем каждый раз во время гонки вспоминаю его;bad
41285;сдерживаюсь чтобы не дать тупой совет в стиле выпей кипяченого молока с медом и маслом и все пройдет ну вот;bad
41286;ну лан ну зато прозвучало как кавалер ордена фрибэтча лим гееватый;bad
41287;никто ничего не ценит в жизни все бесчувственные зачем жить смотря на других жить нужно так как хочется только тебе а не кому то;bad
41288;но я все равно не очень люблю читать я вообще из за мамы даже самостоятельной не могла стать;bad
41289;не надо целовать каждого;bad
41290;просто зенит же ставит цели завоевать европу и мысли у них что наши на это не способны поэтому и не будет там;bad
41291;как то даже немного жалко братьев кличко бедолагам совсем бокс мозги отшиб;bad
41292;ну ты нормальна ну как бы даа;bad
41293;хотела по раньше лечь спать но получается как обычно;bad
41294;rt я не знаю в точности как они называются autofollowback;bad
41295;джуиск посоветуй годные учебники по терверу мой институтский мне не нравится;bad
41296;сууукааа скрваак взломали пиздец все персы на нуле админка слетела бляяя ну ебанутый в рот;bad
41297;ухо не боли пожалуйста весь день мучаюсь правы были те кто сказали еще утром срочно ехать к лору а я как всегда;bad
41298;почему наши родители посмотрев это фото думают что мы вступили в некую секту почему так;bad
41299;долбанный twitter for mac не показывает анимацию в gif пойду ка я из него;bad
41300;у нас с тишиной тоже очень мало и это печально с самыми дорогими людьми всегда наименьшее количество фотографий;bad
41301;такое могло произойти только со мной;bad
41302;я спать а ты учи не хочешь спать;bad
41303;малограмотный троечник алкоголик с царскими замашками губит страну и на век вперед губит саму идею демократии;bad
41304;до нового года осталось меньше 1 дней как то незаметно крадется слишком незаметно;bad
41305;горлышко болиит ибонехуйходитьбезшапки;bad
41306;rt глупые просто походу мы натворим херни а потом жалеть будем какжевсезапутаноооо;bad
41307;rt какой то я раздражительный сегодня;bad
41308;rt прослезилась;bad
41309;ох уж это икт gt в компах я нуб никогда свой ноут не вылечу с;bad
41310;эх да эти ужасные муки ожидания встречи с моей любимой;bad
41311;согласна молодые совсем им бы жить да жить еще;bad
41312;всегда хотела лечь спать в 9 часов и каааждый раз у меня не получается это сделать;bad
41313;наткнулась в нете долго ржала;bad
41314;как же я ненавижу все то что происходит со мной ночью надоело это чувство уже;bad
41315;надо заканчивать со скайпом контактом и бездельем в принципе;bad
41316;а почему у тебя кличка в вк закрыта;bad
41317;ты почему вк не заходишь спокойной ночи зайка;bad
41318;но мне надо мне грустно а еды нет хныык;bad
41319;они не уважают чужие вкусы печалит;bad
41320;прости что не смогла тебя предостеречь;bad
41321;пока большинство населения рассуждают как мои родственники ну все же воруют нам ничего не изменить;bad
41322;дома так хорошо из за снега я теперь переживаю что не доеду до работы;bad
41323;господи ну это же норд ост ну что вы тупите ну;bad
41324;мы будем скучать;bad
41325;малышке плохо следовательно и мне тоже;bad
41326;но чем больше я узнаю что на него вешается куча баб тем мне интереснее;bad
41327;кто нибудь убейте меня ахах несколько часов не могу вдуплить химию;bad
41328;стерва тт мне тоже он нравится хочу;bad
41329;нет не лезет из меня сегодня графоманство ну никак;bad
41330;жрать хочеццо а зряплата еще не пришла;bad
41331;сегодня в 2 3 ч закрыли первую линию в метро хорошо я знаю как идти от фрунзенской до балтийской а так была бы паника o o;bad
41332;перед операцией будет обследование полное и я пару дней в больнице пролежу и мне даже вставят укол в вену на несколько дней;bad
41333;ребят ну одумайтесь не пишите мне я ж стерва я серьезно;bad
41334;мля а у меня завтра сессия начинается;bad
41335;азаз моржик меня чуваки тюленем называли в питере я обидку кинул на них я жи единорог;bad
41336;целый день дома а все равно оставил все на сон грядущий;bad
41337;время 11часов а я до сих пор учу ужасно устала;bad
41338;это конец все мысли о проводках и счетах как раскидать остаток средств чтобы сошелся баланс и прочие фин операции дожитьбыдо3 ого;bad
41339;уууу сочувствую давай держись там;bad
41340;сгорел офис gpda;bad
41341;посмотрела фильм телекинез и совсем это не ужастик никого не съели и даже не убили;bad
41342;rt поговорила с любимым и можно жить дальше 3 только ему там тяжело а я блин тут почемутак кнемухочу;bad
41343;rt а давайте завтра в школу не пойдем гребаный вторник;bad
41344;я не могу родители не разрешают;bad
41345;мне вообще в последнее время ничего не нравится я заметил;bad
41346;блииин написала лерке а твиттер не посмотрела то снова у нее отобрали вк печаль;bad
41347;честно я не знаю как мне быть дальше;bad
41348;в магазинах не бачила такого;bad
41349;такими темпами я за ночь не управлюсь;bad
41350;ок да;bad
41351;не люблю ходить в гости без подарка ненавижу особенно на праздники нас позвали на юбилей а подарка нет;bad
41352;черт расхотелось спать киньте что нибудь интересное посмотреть;bad
41353;зашибись блин походу завтра кладут в больницу только недавно думала что никогда не лежала в больнице сглазила да;bad
41354;ой готуюся до геометр завтра контрольна;bad
41355;его очень не хватает;bad
41356;обидно и непонятно как то;bad
41357;rt блять а я переживаю за энриса;bad
41358;температура высокая слезы ненавижу болеть;bad
41359;репет по русскому сошла с ума даже больной мне приходится делать 1 вариантов цт;bad
41360;пхахаха ого ты мощь чего я от мамы наслушалась ты бы слышала с а свелось все к тому что я учится останусь в кр брееед;bad
41361;оо что то сильно не признал ее изменилась;bad
41362;дайте пл3 ключик а то не приходит уже 3ий месяц;bad
41363;так себе я болею а ты как з;bad
41364;хех все пути сходятся в мордокниге где бы не писали прочесть я смогу в ней 8;bad
41365;o o ой ванилюш ты меня пугаешь;bad
41366;мои надежды не оправдались теперь я без фоток;bad
41367;обиделись и какашка и твиксик никому не нужна я;bad
41368;все равно посмотрю его позже всех ведь пока доберусь до интернета после празднования др;bad
41369;опять телефон тупит инст открывается только так;bad
41370;блин такая хорошая она у меня была;bad
41371;спасибо костылевой я только что заметила что у меня декан за второй семестр не расписался;bad
41372;ну это псец какой то все настроил все собрал собрался спать и тут отвалился perl вначале у vim затем autounmask;bad
41373;я раньше думал что такое мог учудить только саня но я ошибался;bad
41374;обновил за каким то лешим surf теперь не работает простоплеер;bad
41375;вот смотрю в жуйк слушаю коллег и не понимаю откуда берется еще пара часов в день на игрушки;bad
41376;мы вам платим а вы интернет отлючили и колл центр на автоответчик перевели;bad
41377;забыла что сегодня молодежка идет так печально ахаха;bad
41378;мне кажется нам так и придется делать шпаргалки так и не выучим;bad
41379;rt дома электрическая духовка и не покончишь же с собой;bad
41380;я руками и ногами за только нам долго оставаться там нельзя будет найти смогут;bad
41381;rt да бля;bad
41382;driicky graham ft yung berg snapbacks and tattoos remix я надеялась что выступлю танец тяжело дался но я выучила его увы заболела;bad
41383;одна я ничего не знаю;bad
41384;97 кг при росте 19 ебать мой хуй какой же я жирный;bad
41385;эх ходячих до февраля не будет какая печаль;bad
41386;блин и ведь был же вариант пойти в риа после универа;bad
41387;та и папа так же это как бы реально но нереально вообще я сделала все что могла;bad
41388;rt привет снег привет зимняя депрессия привет сессия;bad
41389;rt фигасе в россии оказывается думают что москалi это только москвичи о о;bad
41390;rt синдром золушки внезапен жесток и беспощаден встал ночью водички попить хотел вытереть пятно со стола и вымыл всю кухню;bad
41391;ладно а теперь проходя мимо шкафа я обняла свитшотики;bad
41392;не в ус х нам на х м ю завтра;bad
41393;насилие унижение подорванная психика;bad
41394;rt настроение в говно ваще;bad
41395;чет вообще сегодня был напряг на физкультуре нисколь нас не жалеют;bad
41396;кошмар никто не умер даже толком;bad
41397;прости что вовремя не сказал я еще месяц назад знал не думал что ты захочешь в следующий раз обязательно скажу честно;bad
41398;что не делаешь все не так я ведь хочешь наоборот пытаешься но увы;bad
41399;а кому то например мне вставать в 5 утра;bad
41400;rt скоро и рожать будут как зачали с высунутыми ногами в окно и в твиттер выкладывать;bad
41401;еле нашли совместными усилиями новую это я к чему все впервые пожалела что у меня не какое нибудь пежо например а то денег уходит море;bad
41402;блин жаль не сфоткались я хо новые фотки;bad
41403;почему то не знаю почему жизнь не имеет значения не чувствую не хуя;bad
41404;убейте меня кто то завтра 4 пары и 4 контрольных история математика химия и англ я ведь нифига не шарю ни в одном из этих предметов;bad
41405;rt ага собирал я мир гтк зафейлился изза libpng а он посоветовал сделать revdep rebuild опять все сначала;bad
41406;комары в сортире быстро избавляют от привычки читать;bad
41407;меня тоже больше чем на hearthstone ни на что не хватает;bad
41408;господи пожалуйста пусть я завтра не завалю историю ибо меня на покарает аминь;bad
41409;как же плохо тем у кого родители умеют пользоваться интернетом;bad
41410;у меня было очень мало времени я вообще инкогнито с валерушкой встретилась тк у евгена останавливалась все;bad
41411;за всю четверть 7 раз сходила в школу вот завтра иду оценок вообще практически нет надо получать;bad
41412;чувствую владельцам отечественных автомобилей подобной заботы придется ждать долго примерно до покупки иномарки;bad
41413;анонс niikuda предлагает закутаться в уютный клетчатый плед;bad
41414;блин у меня кто то твиттер проклял от всех своих твиттеров пароли потеряла боль;bad
41415;досмотрел вчера kvn понял почему команда 25aya вылетели в этот раз просто они куда то задевали рыженькую девочку;bad
41416;и вот я снова плачу я плачу уже пятый раз за этот день и честно не знаю что со мной с;bad
41417;бесит меня все происходящее настроения нет совсем;bad
41418;в украине такая движуха а я тухну в рашке почему все пати обходят нас стороной;bad
41419;по находила фотки с лета и осени так грустно стало;bad
41420;смотрю кадетство так тут суровые суворовцы танцуют под ранеток;bad
41421;rt а мимо часовогонельзя;bad
41422;rt как женщины носят корсеты и грудь пардон не расплющивается не понимаю;bad
41423;это когда лена дает мне свой кактус со словами кать даже он тебя не слушает;bad
41424;из них 2 это гонщики дрифтеры на 6ках каторые думают что они ахуенныйе дрифтеры;bad
41425;это да я уже сама об этом думаю;bad
41426;ахаха лошара таня все секреты распиздела;bad
41427;бедная спать хочешь ихихи;bad
41428;мы тебя теряем где мой малыш есенин;bad
41429;rt такой классный аватар похерил;bad
41430;у меня ранка на локте чешется неприятное чувство;bad
41431;rt сессия и живые позавидовали мертвым;bad
41432;как выйти из чата в аймессадж меня насильно туда запихнули;bad
41433;перец нахуй опасно корни посушит;bad
41434;не люблю когда одноклассники не отвечают;bad
41435;rt оказывается что девушки с такими маленькими гламурными собачками предпочитают анал извините;bad
41436;мои будни проходят именно так;bad
41437;rt как же заебало что я заебался заебываться;bad
41438;а там пиво будет я то я хуйню бабскую не пью;bad
41439;мне давно уже не пишешь коменты типа прекрасная и тд а вот другим блять пишешь была какая то надежда теперь ее вообще не осталось;bad
41440;я честно чувствую себя намного лучше умереть;bad
41441;скоро нг а настроение не праздничное нефига;bad
41442;rt я б хотел но мой телефон сломан;bad
41443;лично во мне просыпается адское желание убивать когда ижу фотки этого мерзавца;bad
41444;достала учеба всем что то нужно от меня ааа кошмар;bad
41445;чем холоднее на улице тем более одинокой я чувствую себя в этой дурацкой квартире;bad
41446;rt завтра походу будет ужасный день;bad
41447;а у нас 5 украинский биология география математика обязательно и один по выбору учителей;bad
41448;rt почему в таганроге и ростове метель а в кущвeгace нет;bad
41449;ну почему ты за столько времени не научился понимать мои сарказмы;bad
41450;вчера мне стало очень грустно с экранов телевизоров пропал жириновский помним любим ржем sledui;bad
41451;на хабре серьезно обсуждается гуглбомба;bad
41452;rt вы вообще знаете что молодежка закончится в четверг осталось 3 серии всего;bad
41453;rt ебать у меня почерк как у первоклассника;bad
41454;лер я очень скучаю;bad
41455;папа как ты там мне тебя так не хватает;bad
41456;количество домашки сегодня меня просто убивает;bad
41457;rt я скучаю по вам;bad
41458;эх печалька с продажами в автосалонах сам уж наводящие вопросы задаешь а они один хрен не цепляются за это;bad
41459;rt 7 процентов депутатов воронежской облдумы v созыва бизнесмены;bad
41460;я бы с радостью похоже я так сейчас и сделаю ахаха;bad
41461;у нее красивая и необычная внешность хочу ее улыбку;bad
41462;эх не успела я посмотреть такое редкое явление хз;bad
41463;они мне снятся и заставляют рыдать во сне такая правда;bad
41464;устала на этой неделе предстоит сделать очень многое на кону медаль настроения ноль мелкий губу разбил хочется только спааааааааать;bad
41465;ну вот допрыгалась опять голова заболела;bad
41466;ты замечательный зачем кому то тебя анфолловить это полуумно;bad
41467;без твоих танцев на физре сегодня было скучно;bad
41468;чем холоднее на улице тем более одинокой я чувствую себя в этой дурацкой квартире еще и hdserials не хочет показывать мне новенькую;bad
41469;водка хуедка сигареты хуеты наркотики хуетики все что блять надо ему для счастья ссор за маты;bad
41470;я увидела твои плохие стороны которых раньше не замечала;bad
41471;бля мираклс ин десемба заставляет меня оч сильно грустнуть;bad
41472;rt мне так нужно твое внимание просто немного тебя я так скучаю;bad
