Num;Review;review_type
43561;блиин ну когда уже позвонят ожидаание и неизвестность это ужасно;bad
43562;у меня такие же проблемы x;bad
43563;завтра еще один день без моей лапуле по парте;bad
43564;да нам говорили в школе что все равно дадут нам медали обычные просто но это все равно не то;bad
43565;мертвецы просто супер тягомотина щит не знаю что такое наверно то что слышится докто кто стал слишком детским;bad
43566;rt вот же говно эти религиозные праздники пол москвы перекрыли я то тут при чем;bad
43567;блин вот поспала днем 4 часа щас уснуть не могу;bad
43568;все еще болею завтра опять не пойду на работу;bad
43569;из за тебя пирожков захотела;bad
43570;ох завтра иду к врачу готовлюсь к разорению на лекарства;bad
43571;вот тебе не повезло ну тогда буду ждать до поры до времени;bad
43572;rt вспомнил что давно не видел vimperator поставил запустил iceweasel o o я прям в шоке от этого гламура только потом у;bad
43573;сижу а ноги так болям и руки тресуться ужас;bad
43574;ну я сразу вспоминаю тебя и злорадствую чуть чуть зайчик;bad
43575;я боюсь советовать мой ответ запретили в госдуме;bad
43576;скоро совсем скоро;bad
43577;настали тяжелые времена когда даже дома мерзнут ноги;bad
43578;и вообще жду когда симоньян уничтожит свою карьеру свом же твиттером так не вовремя и по идиотски раскрывать свой ебальник талант нужен;bad
43579;нет повести печальнее на свете чем повесть о знакомстве в интернете;bad
43580;я даже не хочу представлять как я буду без тебя целый месяц;bad
43581;ну неееееет уже не то этот пуск;bad
43582;это я назови меня сырочком;bad
43583;он видимо хочет чтобы я стала толстой;bad
43584;блин ну все завтра уже будет скучно 9;bad
43585;меня выгнали с уроков сегодня возвращаться туда не охото было;bad
43586;за весь день пироженка расстроила меня больше всего люди то люди а вот еда это же надежная вещь без заморочек эх;bad
43587;вещет же а у меня в группе репетитора все какие то бее и один мега мажорик который понтуется а за тебя я рада;bad
43588;англ читаю что смотришь;bad
43589;я неудачница меня окружают друзья предатели с которыми я все равно продолжаю общаться;bad
43590;это вообще невозможно прикол в том что от этого худеешь;bad
43591;принтер зямал бумагу и нифига сделать не могу;bad
43592;а я просто не успела много сделать надо было;bad
43593;ненавижу но люблю это не про людей это про еду а точнее про блек и закончился первый снег йо;bad
43594;кто вовремя не оплатил интернет это мэтт;bad
43595;за последнее время пересмотрела множество лайвов beyonce богиня j lopez мое мнение конечно посмотрим;bad
43596;завтра очень сложная контрольная по алгебре к ней надо готовиться но когда мне никак не надо по ней получить 3 или вообще 2;bad
43597;холоднооо даже теплое одеяло не помогает;bad
43598;ай вы меня всее бесите неужели так трудно со мной поговорить эта ржет этот психует эти в танках я одна;bad
43599;тут все ходят в майках шортах а настенька сидя в штанах майке байке безрукавке укатывшись в одеялко смотрит фильм;bad
43600;как же болит нос нога и плечо снова травмы;bad
43601;ладно я спать а то мне завтра из за этого снега в ростов рано утром выезжать чтоб успеть да еще и на работу надо прийти пораньше;bad
43602;это ппц работаю работу на работе работаю работу дома почти не сплю и все равно ничерта не успеваю;bad
43603;мы че уже на станции о о ятуплю;bad
43604;rt только вот не думаю что у меня время будет тоже надо отпуск брать;bad
43605;мой мужчина даже умеет мыть посуду убираться и ухаживать за кошечкой пока у меня уже несколько часов почему то кружится голова и тошнит;bad
43606;мне и скучать некогда даже;bad
43607;rt химичка спалила походу;bad
43608;раньше столько грамот получала а ща нигде не учествую;bad
43609;я так соскучилась по этому волосатому полосатому пидору;bad
43610;я тебя в 12ке видел окрикнул а ты не обернулась;bad
43611;не совсем но вопрос стоял о том с кем ты хочешь провести нг;bad
43612;солнце печет очки сломал;bad
43613;объективно мне сейчас сто рублей уже много денег нет вообще впереди новый год подарки семье не на что покупать;bad
43614;а у меня а у меня не знаю даже;bad
43615;я чувствую себя ужасно от одной только мысли как я завтра пойду в шк а еще спать хочу но онегин не дочитан;bad
43616;порой нам немного не хватает смелости и это очень плохо;bad
43617;блин сижу и даже не знаю про кого и что написать у нас даже в сушнего было все тихо мирно хочу сплетен;bad
43618;что то опрос про микроблоггеров не зашел хоть был поддержан адэптами твиттера один ответил 2 второй 5 вот и вся статистика;bad
43619;qt в слаке собран без поддержки многопоточности придется пересобирать;bad
43620;кажется у меня один террабайтник лег;bad
43621;да сейчас чуть чуть короче;bad
43622;23 3 я ем шоколадку и запиваю молоком тварь а ведь весы показали утром что я похудела на 2 кг а на до на 5 миссия невыполнима;bad
43623;завтра контрольная по физике и тест по немецкому с грамматикой и лексикой я уже засыпаю а еще столько делать;bad
43624;мистар долбонеб я тебе тоже загогулю посвящал так то;bad
43625;ооо как болят руки и пальцы и ноги лучше эта боль чем ту которую я испытываю на протяжении всего дня;bad
43626;жаберы плохие опять не доставили мне один жуйкодень;bad
43627;rt ну вот откуда они такое выдумывают;bad
43628;печальноооо я ее упустила теперь буду всю ночь сторожить;bad
43629;rt моя хотеть бальшой бальшой террас которая зимой превращается в зимний сад;bad
43630;единственное что меня тревожит так это то что смарт хаус закрывают;bad
43631;ой моя голова что то болит наверно того что давно не пил;bad
43632;почему люди так не любят его;bad
43633;эта новая страница от другой пароль забыла;bad
43634;rt когда наконец git начнет поддерживать докачку качать 14 часов и не дай бог за это время что нибудь отвалится;bad
43635;да хотя русский норм еще;bad
43636;отогреватели идут в бой а вот закрыли душ до 16 декабря;bad
43637;rt выздоравливай я тожи болею;bad
43638;сегодня познакомилась с мальчиком по имени дима он был так мил и вежлив со мной мы проговорили всю дорогу до дома как жаль что ему 6 лет;bad
43639;про меня как потерять флешку 1 положите флешку на стол 2 моргните;bad
43640;rt ну какого хрена так холодно хочу лето тепло хочу;bad
43641;как я магу типерь вереть в настающюю любофь;bad
43642;я хочу яблочко или гранатик или мандаринку;bad
43643;хз мне все еще нехорошо воспаление легких быстро не проходит;bad
43644;блин скоро конец четверти оценки не такие уж и хороший;bad
43645;прости но я не хочу чтобы ты была лягушкой;bad
43646;мамаьуезжает через 5 часов остаюсь с папой;bad
43647;нужно себе приобрести кондиционер а то жара ужасная;bad
43648;самое ужасное что в квартире не так уж тепло;bad
43649;от пилять аськокапец отложился после реконнекта транспорт прицепил всю асю;bad
43650;танцуешь o o ничего себе я себе такое только в начальных классах позволяла;bad
43651;как развлекать гостей на свой день рождения о чем разговаривать;bad
43652;а рядом было вот так как в загоне концлагеря;bad
43653;как на мере прибить входящие звонки с определенных номеров;bad
43654;черт возьми почему я так дико скучаю по некоторым людям;bad
43655;ага магомед таких раньше быстро успокаивал;bad
43656;rt вся жизнь работа даже когда не на работе а только идешь все равно уже на работе т к фиг оденешь косуху ибо это не;bad
43657;сладких снов всем я спать я очень устал работаю как конь надоело хочу быть богатым;bad
43658;так скучаю по проведенному лету с тобой;bad
43659;у а я же в субботу на детский день варенья иду то есть на дачу косить кусты за пиво я не поеду;bad
43660;всио балашиха уже оффлайн sovserv не работает;bad
43661;rt еды нет;bad
43662;rt озоз та девка не согласилась на перепихон 99 9;bad
43663;ну вот началась минусовая погода и хоть минус небольшой я уже очень сильно мерзну мне нужны обнимашки обогревашки;bad
43664;конец дня очень напряженный заставили сделать презентацию на завтра не смотря на то что я болею;bad
43665;rt коля sэмпл человек вернувший себе веру в лучшее человек не придумывающий а рассказывающий о реальных ситуациях из жиз;bad
43666;как ты забыла свитоэ как ты магла;bad
43667;судя по количеству фантиков на моем столе у кого то стресс;bad
43668;да что же это за проституточная то повсюду господи;bad
43669;само собой одни ворюги кругом воруют идеи за полмесяца до озвучивания и прямо из головы вот ведь а;bad
43670;отпизди шлюшку ненавижу когда ставят отл только жополизам;bad
43671;rt неслабенький пони на 8 кб;bad
43672;бедный мой прям посередине ночи у него ушко сильно заболело он пока плакал я чуть сама не расплакалась;bad
43673;rt решил бублик съесть откусил а внутри ничего нету;bad
43674;лера мостак устраивать разборки пикапер пострадал;bad
43675;почему я уже полчаса слушаю ricky martin la copa de la vida как то странно о о настроение слишком хорошее для вечера понедельника;bad
43676;иби сваю подушку я больше вам не откроюсь;bad
43677;мама хочет чтобы я ей фенечку сделала о о;bad
43678;rt жуйк я лузир я занял 3 е место;bad
43679;rt а куда пропали обычные советские мандарины невозможно найти в каждом магазине лежит по пять разных сортов но они не;bad
43680;да все поменялось в самом деле грустно скучаю по прошлому году;bad
43681;рин ты дура ахаххах у меня от него синяки по всему телу;bad
43682;у меня нет развлечений;bad
43683;да мне блять жалко тебя что ты не спишь а потом весь день ходишь мучаешься наверное;bad
43684;это ахиренно но я не хочу чтобы ты так делала;bad
43685;и что такого если там ничего такого сокровенного нету;bad
43686;посидела подумала короче явный недотрах;bad
43687;блииин не люблю когда наступает момент черной полосы это капец;bad
43688;голова болит уже говорить webcamtoy;bad
43689;мы завтра проходим но мы учимся утром а потом пишем везет вам;bad
43690;я уже час сижу ну шо его писать;bad
43691;дома нет бутылки постоянно испытываю жажду блясукабя;bad
43692;курва що я роблю не так;bad
43693;по ссылке в сети ну соврал немного в твите крче провокатор;bad
43694;rt стою уже 1 5 часа втыкаю в маникен уже успел обойти все отделы как же бесят все эти походки в магазин с родней;bad
43695;rt вся жизнь работа даже когда не на работе а только идешь все равно уже на работе т к фиг оденешь косуху ибо это не;bad
43696;все уже давно определились с будущей профессией кроме меня;bad
43697;спать уже надо а не размышлять;bad
43698;блин ахахаха я писал о батончиках о книжках;bad
43699;так это эта глава была к др;bad
43700;уже несколько дней забываю кинуть денег на телефон только сейчас вспомнил когда хотел в whatsapp зайти;bad
43701;бесит когда начинают ныть типа не хочу жить ненавижу свою жизнь меня никто не понимает пойду вскроюсь 9 при чем из за фигни;bad
43702;на улице холодина это капец просто лето хочу;bad
43703;курсовая какая курсовая а точно курсоваяяя надеюсь завтра сдать;bad
43704;я так долго шла к этой цели и вот добившись я опять падаю;bad
43705;тупая моя голова не поздравила вчера тато;bad
43706;вот оно мое состояние немного о наболевшем и вроде все достаточно п здато но все равно какая то х йня;bad
43707;а вы пидросо хуисосо мистр;bad
43708;так вот взломали тот твиттер все сюда;bad
43709;rt сочувствуем всем москвичам имевшим смелось выползти сегодня на улицу без перчаток и шапки;bad
43710;теперь простыла я гадость не квартира а лазарет;bad
43711;зайка моя я тоже не могу без тебя;bad
43712;у тебя есть инстаграмм нет не хочу;bad
43713;хотя я могла выйти мама спит папа уехал до выходных но мне не кайф;bad
43714;потому что когда то они просто уйдут к господу и вы не сможете их вернуть цените каждую минту с ними;bad
43715;rt чеза наебы;bad
43716;за окном 1 и в квартире похоже не больше;bad
43717;мне тоже первая понравилась часть у второй довольно предсказуемый конец;bad
43718;такая печаль новый год каникулы а я заболеваю;bad
43719;так чеки оо нема ти ж мене не попередила я не залишила;bad
43720;россия великая страна а во главе ее;bad
43721;каналья валитос из моего лентос мадемуазель;bad
43722;криворукие не способны ничего создать способны только рушить и ждать манны небесной им ведь все должны;bad
43723;это чувство когда хочется поиграть в танки а интернет хуже жизни боль;bad
43724;о жизненно только не кофе а сраные макароны;bad
43725;я хотел тебе свои творения выслать;bad
43726;нравится этот шк автобус тк там свет выключают всегда бы на нем ездить но не судьба наверно;bad
43727;rt печально когда с работы увольняются люди к которым ты успел привыкнуть или даже привязаться что ли;bad
43728;little busters 1 нууууууу онавзяла и закончилась а еще хочу серию;bad
43729;хватит сраться уже со мной я маленькая девочка же 99 я уже не твой уровень я выше а ты попробуй посраться с пацаном;bad
43730;оч оч обидно;bad
43731;старые советские троллейбусы зимой это адъ;bad
43732;ой фу как же бесит эти мимими сюсюсю ну фу блять;bad
43733;я луффи только с эйсом вижу у них такой трагичный пейринг;bad
43734;где ты смотришь цены на авиобилеты вот не могу айти таких вкусных предложений;bad
43735;rt хм самостаятельный апргейд оперы до 11 1 меня не оч порадовал с быстрым запуском случилась фигня;bad
43736;кстати скорее нужно учиться спать давно этого не делала;bad
43737;rt вычитал тут в гугловском style guide ma;bad
43738;так и погибают печеньки;bad
43739;да уж у вас же совсем не продохнуть небось;bad
43740;что случилось я не знаю как же так не понимаю люблю ее других не знаю вот сам с себя ахрениваю superrt;bad
43741;таких актеров прекрасных взяли яценко цыганов а кино полный вышло это печаль оттепель;bad
43742;rt ну мне пора спать сладких и незабываемых сноов с;bad
43743;rt скучаю по ней очень;bad
43744;настроение ужасное что делать прямо не знаю какой день уже ниже плинтуса а вроде же все отлично что за чер;bad
43745;штоо вот ита поворот 9 99 99 9 я буду скучать кароч ночи о с з;bad
43746;ебучий инет который вообще не грузит;bad
43747;почему дома нет кофе придется чай пить;bad
43748;а он серьезно ногу сломал;bad
43749;после сосиски с какао лучше не стало пойду пить из зеленый бутылки невкусную водичку и венки резать может поможет;bad
43750;продолжаю мучиться от болей надеюсь попасть сегодня в универ хотя б на одну пару;bad
43751;какое доброе если в школу идти надо;bad
43752;rt был себе неплохой сервис а взял и стал неюзабельным;bad
43753;rt мне иногда кажется что я единственная кто на этой земле не смотрит молодежку о о ее даже моя 5 ти летняя сестра смотрит о о;bad
43754;сегодня я никуда не пойду ибо мне даже вставать с постели запретили;bad
43755;меня точно отчислят точно бо я ничо не могу выучить ленивая задница;bad
43756;бля ну капец деньги на телефоне кончились;bad
43757;ухаха the calling wherever you will go уж не затюнился ли я по ошибке на лав радио;bad
43758;когда любимая дежурная неделя я заболела я ее так долго ждала;bad
43759;пожалуй начну читать а то что то в этом году все мимо пропускаю расслабился;bad
43760;мой любимый но зимой носить его некомильфо браслет bracelet а еще это называется я дорвалась;bad
43761;ааааааа я приехала в 6 утра и иду в школу;bad
43762;что случилось что не в школе;bad
43763;особенно весело если посылать машину а на следующий день все стало таять я как раз попал в такую ситуацию;bad
43764;самое плохое качество во мне привязоность правда от этого качества страдаю только я teamfollowback;bad
43765;блин в миранде токо что странный косяк был писала чертяка только на аглицком пришлось вырубить плагин автовыключения;bad
43766;фак школа линта пожелайти мне удачи у меня сегодня день вообще блин;bad
43767;неееее достала уже эта мелодия;bad
